name,stars,text,timeSince,openStatus,key
Victoria Callaway,3.0,My food came out kinda soggy with cold fries. Let my waitress know and she fixed it right away.,a year ago,Open,2000626826
Chris McIntosh,5.0,Great service and great food!!,a year ago,Open,2000626826
kim,1.0,Horrible service!!!! The waitress seemed put out that we came in!! The food was sloppy and not very good at all! The restaurant wasn’t even busy. We wouldn’t recommend this place to anyone!,a year ago,Open,2000626826
C H,5.0,Great service and food,a year ago,Open,2000626826
john wozniak,4.0,Beer was cold. Chips were good. Salsa a little spicy for my taste buds,a year ago,Open,2000626826
Mom Life,4.0,The food and service are good.,9 months ago,Open,2000626826
Robert Young,5.0,"A little loud, but it is a sports bar, good good",a year ago,Open,2000626826
Lesa Toon,4.0,Nice place with good food and service,8 months ago,Open,2000626826
Barb Sinnott,5.0,Atmosphere awesome. We were part of a large group.  The people there took care of us no problem. They were great.  And fun.,2 years ago,Open,2000626826
adam reynolds,5.0,Great pizza and have a good quinoa bowl for the ladies,a year ago,Open,2000626826
Brittany Meeks,5.0,Amy Joe at Boston’s is amazing! Great service and personality! Her lemon drops rock! Best in town!,a year ago,Open,2000626826
Sue Gordon,5.0,Had dinner with a friend good food prompt service.,a year ago,Open,2000626826
Alan Buechler,5.0,They have a few of my favorites including Spicy chicken and broccoli pasta.  Yummy,a year ago,Open,2000626826
Robin Poskey,4.0,Great food,3 months ago,Open,2000626826
Thomas Bee,5.0,The food was excellent and the host Jocelyn was exceptionally warm and friendly to me and my family,a year ago,Open,2000626826
Josh Konzal,5.0,Loved it. This was the first time I have ever been here and it was spectacular. The twisted Mac with sausage was stupid delicious.,a year ago,Open,2000626826
Christine Miles-McKay,1.0,"Do not understand CELIAC means severe illness. Don't put croutons on my salad and take them off. Those bread crumbs will hurt. If I mention gf, with celiac. Pay attention. I dont eat cardboard for the fun of it. Nobody does!",a year ago,Open,2000626826
Jim & Jo Flippen,5.0,Amazing Food ~ Excellent Service,a year ago,Open,2000626826
Jeff Rogers,5.0,"Good pizza, sandwiches and lemonade.",9 months ago,Open,2000626826
Holly Owens,1.0,"Deluxe pizza had white sauce on it and the veggies on top were raw! We had to flag down the waitress,  to tell her and she never asked if we wanted another beer or something else to drink, after having only 1 beer each and we waited 30 minutes on a not busy night! 1st and last time ever here!",a year ago,Open,2000626826
Janice Poe,5.0,"Great Food, great service!!  Amazing lemon drop and superbowl playoff coverage. What more Could you ask for?",a year ago,Open,2000626826
Angelica Foster,5.0,"Friendly servers, good service, good food. The nachos here are delicious and really unique. Every chip has some goodies on it so you don't get to the bottom of the pile and end up with just plain chips. Guac is great and tastes freshly prepared. Excellent pizza crust too. :)",3 years ago,Open,2000626826
Hannah Jackson,4.0,Everything was great except the server could have been a little bit more friendly!,a year ago,Open,2000626826
Ruvim Davydenko,5.0,Love the food. Great vibe. Awesome customer service. Visited a few times was pleased everytime.,2 years ago,Open,2000626826
Mark heavyweight,2.0,"Food was good, service was average...my only real complaint is that i paid 12 dollars for a drink that was half the price in the bar....what a rip-off.  I recomend not.buying drinks at this establishment.",a year ago,Open,2000626826
Nancy Embree,5.0,Friendly people and yummy food.,10 months ago,Open,2000626826
Sunrize169,5.0,Their creamy Cajun pasta is to die for! 👌👍,a year ago,Open,2000626826
Peggy Whitman,5.0,"This was our first visit to Boston's and found it to be absolutely wonderful.   Everything from the food, ambience, drink menu and wait staff were superb.   We're going back!",2 years ago,Open,2000626826
Wes,5.0,Great pizza,4 months ago,Open,2000626826
Sarah Phelps,4.0,Good food.  Kind of spendy.  Thanks WA state min wage!,a year ago,Open,2000626826
Heather Parent,5.0,Always good food & drinks!,10 months ago,Open,2000626826
Wardaddy 22,4.0,"Great calzone, pizza and pasta",a year ago,Open,2000626826
Josiah Van Egdom,5.0,Service was great.  Pizza was tasty.  The happy hour was really great too with a lot of options and great prices.  Will be going back.,2 years ago,Open,2000626826
Debi Hammel,5.0,We love bostons.   Large enough to hold large tables.,a year ago,Open,2000626826
Lyle G,4.0,Love the momma meata pizza great taste love the crust,a year ago,Open,2000626826
Gayle Heuschkel-Moote,5.0,Super good food and our waiter was excellent!,a year ago,Open,2000626826
Kat McClain,4.0,A little spendy for what it is. But the quality of the food and staff makes to for it,a year ago,Open,2000626826
Alex C,5.0,"I can't really flaw this place. Plenty of tv's, fairly large seating area, good staff to name a few. Any mistakes they've made have been corrected no questions asked. I feel prices are fair for the portions. Maybe a little high, but not much. Overall a well rounded restaurant.",4 years ago,Open,2000626826
Alex Stathos,3.0,"Pizza is always good, service is usually pretty good.",a year ago,Open,2000626826
Suzanne Weathers,5.0,"It's a good central location. Server was as sweet as they come, with a great side of hussle, which is appreciated as the work day was closing.",2 years ago,Open,2000626826
Ashley Counts,5.0,Monday nights the bar does half price pizzas.  We designed one and it was delicious!!  The breaded cauliflower bites are da bomb!!!  I think I'm addicted and can't get them off my mind.  AmyJo was a great bartender and she can sing!!!  Karaoke rocks so any place that hosts it is alright by me.,2 years ago,Open,2000626826
Eric Thompson,5.0,Good pizza and service.,a year ago,Open,2000626826
Jan Munson,5.0,delicious shrimp and chicken pasta,9 months ago,Open,2000626826
Monica Inman,1.0,"My two kids and I went there tonight, we were seated fast. Once we were seated we had to wait over 15 min for a drink order. We got our drinks and ordered our food. We sat at the table for 30 min waiting for our food with empty drinks. The …More",3 years ago,Open,2000626826
Grey Cat,4.0,Great waitress decent food,a year ago,Open,2000626826
Brady Bush,5.0,Great service. Especially in the bar on Wednesday nights.,a year ago,Open,2000626826
Billie Romano,1.0,The bartenders sucked service  sucked  the  food  was  ok.,11 months ago,Open,2000626826
Jared Gutterud,5.0,"Menu is large, but everything ive had is exquisite. Especially the mama meata pizza",a year ago,Open,2000626826
Loren Kilham,4.0,Good food and staff is awesome.,10 months ago,Open,2000626826
Janeen W,3.0,"Food used to be better,not as bland,cheaper. Atmosphere fine,waiters real good .",a year ago,Open,2000626826
Larry,5.0,The ribs are to die for. We try to get there every 3 or 4 months. The menu is varied.,a year ago,Open,2000626826
Sherrie Conner,4.0,Good drinks and fun environment. The Twisted Mac n Cheese is amazingly delicious! The calzones are really great too.,2 years ago,Open,2000626826
Tom Fomasi,5.0,Awesome food and great service,a year ago,Open,2000626826
Kevin Swayze,5.0,Our food was delicious and our waitress provided excellent service. We will definitely be coming back when we are in the area again,2 years ago,Open,2000626826
Sherry Vokoun,5.0,Yummy salad and pizza. Beer selection ok.,a year ago,Open,2000626826
Syl Occhiato,5.0,Delicious. Great service!!!,a year ago,Open,2000626826
Sam Fisher,5.0,Great restaurant with even better service! Ben was easily the best server that I’ve ever had. Especially for my first time visiting.,2 years ago,Open,2000626826
Amanda,5.0,"Great food, most the time friendly staff, decent prices. Take advantage of happy hr, and daily specials",2 years ago,Open,2000626826
Chris Mcilroy,5.0,Great service friendly they'll even took an order to feed my buddy's dogs!,a year ago,Open,2000626826
Tammi M,3.0,"Food was good. Gave me my bill and the customer two booths down.... I usually dont look at my tab, good thing i did this time. Lesson learned, thank you Bostons.",a year ago,Open,2000626826
Cathy Harrington,5.0,great food at great prices,a year ago,Open,2000626826
Briana W.,5.0,"Best drinks in Spokane Valley, hands down!",9 months ago,Open,2000626826
Danny Flores,5.0,"Love this Place,  great service, great Food, Sports bar has lots of big screen tv's fun atmosphere",a year ago,Open,2000626826
Rob,5.0,Great and friendly service. The cauliflower buffalo wings are amazing,2 years ago,Open,2000626826
RovingFox,5.0,Great food. The pizza was a little spendy. Can get noisy on game day but that's what's to be expected,2 years ago,Open,2000626826
Kevin Hagan,2.0,It's inferior bar food at a reasonable price.,9 months ago,Open,2000626826
Carter,4.0,"I came a few weeks ago and had a very good pizza, service was just okay but the pizza was definitely worth it.",a year ago,Open,2000626826
Colton Nibler,5.0,This place is the bomb. All the food is delicious and service was timely and extremely friendly. Would recommend to anyone who hasnt yet been by this awesome establishment.,3 years ago,Open,2000626826
Marc Ward,3.0,I will say the pizza flight is good and the price decent everything else seemed a bit to expensive for being a sports bar...,a year ago,Open,2000626826
B G,5.0,Good food and the customer service is always great thanks ladies,a year ago,Open,2000626826
Sam Fleming,5.0,Sicilian pizza is awesome!,10 months ago,Open,2000626826
Uhby,1.0,"Waited 35 minuted for my meal. When it arrived, some of the food was slightly warm and the rest was at room temp. First time here and very dissappointed. The barkeep was my server and she appearred to be very busy. Might be the reason for the delay. Doesn't change the fact that my experience was poor.",2 years ago,Open,2000626826
Nicole Otero,5.0,Food was really good! Friendly staff! Decent prices! Nice atmosphere! Good location!,2 years ago,Open,2000626826
Jordan Folk,5.0,Love this place. Thanks for the great service.,a year ago,Open,2000626826
Donald Gardner,4.0,Good food and service but somewhat expensive.,2 years ago,Open,2000626826
Erin McCandless,1.0,The food was good but we were treated very poorly.   The hostess ignored us until we trunee around to leave. Then when I asked for a kids menu I had to deal with a snide comment about his size.  A tall 12year old is still a kid and does not need to be made to feel bad by an adult.,2 years ago,Open,2000626826
Jessica Millspaugh,5.0,Great food and very friendly service!!,a year ago,Open,2000626826
Cari Peddycord,5.0,"Great atmosphere, good bartender great food and cold beer. Great happy hour",2 years ago,Open,2000626826
Kaleb Joseph,1.0,Friendly and amazing staff! However everything else about this place makes me want to shoot my own temples with a nail gun.,a year ago,Open,2000626826
Jessica Foreman,5.0,Love this place the food it the best the waiters are on top of it at all time the are super nice to kids. Best dessert ever.,2 years ago,Open,2000626826
Sharon Mcfarland,4.0,The shrimp tacos were fresh and spicy. Service was great.,2 years ago,Open,2000626826
Craig Sotelo,2.0,First time there and the food was ok at best. It looked nothing like the menu. I probably could have made a better burger than the one I had and the cheese fries should have been called the tomatoes fries cause there was nothing cheesy about them. I wont go back,4 years ago,Open,2000626826
Corey Judd,2.0,Worst service ever and food was nothing special,a year ago,Open,2000626826
Shannon McCallum,3.0,Food is good but every time I go there 5 service sucks after,2 years ago,Open,2000626826
Mike Trueman,5.0,"The service was fantastic, and you get everything you expect from a Bostons, never disappoints",2 years ago,Open,2000626826
Glenna Seely,4.0,Great service and good food,a year ago,Open,2000626826
Kody Schaub,4.0,Good food great service,a year ago,Open,2000626826
Erin Brooks,2.0,My husband and I received terrible service at the bar. Our server ignored us and helped everyone around us far more times than I can count. The food was subpar at best and the drinks were awful! There was absolutely no flavor to my …More,3 years ago,Open,2000626826
Jim Daniels,5.0,I think its the best pizza in town and unfortunately the best kept secret as we just tried it for the first time.,2 years ago,Open,2000626826
Cheasequah D,5.0,Ahhh man the dough in the pizza is to die for!,a year ago,Open,2000626826
Austin Santiago,5.0,Service was great food was awesome this is definitely getting added to our date night rotation,2 years ago,Open,2000626826
Sara Case,2.0,"We didn't order pizza, so that's half our mistake. But the food wasn't good. I got the 3 sliders. The mvp burger was good. The chicken was terrible. And the pulled pork tasted like it was out of a can. Boyfriend got the jalapeño onion straw …More",2 years ago,Open,2000626826
Faith Brandt,5.0,"Nice place, respectful people. Loved the mac & cheese !",2 years ago,Open,2000626826
Shawntae Symons,2.0,"One person in our party was 20 so we had to sit in the dining room side (no issue there) but this also made it so that those who were of age were not able to get the ""happy hour"" prices. Same restaurant same beer WAY different prices. And on top of that the steak was bland and over cooked.",2 years ago,Open,2000626826
Zum,3.0,"Nice attention, good fast food, flavory salsas",a year ago,Open,2000626826
Amy Santa,2.0,"Wasn't good food, do not get mac and cheese!!!!! Waiters and waitresses were attentive though, and drinks were just OK.",2 years ago,Open,2000626826
Matt Brosvik,5.0,I had a great birthday there.  Food and service are always really good.,2 years ago,Open,2000626826
Derek Zollinger,2.0,Service was bad...really bad. Forgot one of our orders completely and mine came without garlic bread. Wifes order was completely wrong. The place was also empty but it took 30+ mintutes to get our food. I've been to other Boston's with much better results.,2 years ago,Open,2000626826
Karen Perez,5.0,"Fantastic bar and restaurant. Has karaoke on Monday's with an awesome host, Russ!",2 years ago,Open,2000626826
Dave Ferguson,5.0,Always great food and service,a year ago,Open,2000626826
Beant Khaira,5.0,It is a great place for families to Dine! Loved the food and the service. Kids love there 🍕,4 years ago,Open,2000626826
Lacy Iverson,3.0,"Restaurant is what you expect from a chain. Pizza's, deep fried cheese and goodies, calzones and pasta. Portions are large, plan on being full for days!",2 years ago,Open,2000626826
Rawg,4.0,"Great enviroment, good service with good food.",a year ago,Open,2000626826
Ralph Sallade,5.0,Excellent service and friendly staff!,a year ago,Open,2000626826
Beth A,4.0,Good food. A little slow on the service but really nice people.,2 years ago,Open,2000626826
Cosme Cuevas,5.0,"Food was great, service was great.",a year ago,Open,2000626826
Sherry Eutsler,5.0,"There pizza and wings are amazing.
We have been several time . Love this place ..",2 years ago,Open,2000626826
Eric Sachtjen,4.0,Friendly staff. Good food.,a year ago,Open,2000626826
Vixen Lynn,1.0,There at 1:00 pm on a Saturday and were out of the rack of ribs. Ridiculous,a year ago,Open,2000626826
Caitlin Cornelia Anderson,5.0,"Got a lot of great food for the price, with a bunch of left overs for later.",2 years ago,Open,2000626826
Jessica Stonehouse,3.0,"Service was ok, love love love the deep fried pickles and peppers.",a year ago,Open,2000626826
Melody Sacpopo,5.0,"Great pizza, great service.",a year ago,Open,2000626826
Kate C,3.0,"Bostons was good, the place was pretty empty, the service was ok, and the food was ok. If you are looking for average night out, this is the place!",2 years ago,Open,2000626826
tamera gross,4.0,Very good. Everyone enjoyed.  A little pricey for what you get.,3 years ago,Open,2000626826
Jeff Horton,4.0,"Tasted great, needs more marinara sauce",3 years ago,Open,2000626826
Marissa K,5.0,"Fantastic food, great waitress and a friendly, personable manager!!",2 years ago,Open,2000626826
Jeremy BA,5.0,"My mom and I went there for dinner after visiting with our friends. I had the Mama Meata's Calzone and my mom had the salad. We were very impressed with the food and the serving size, as well. Our waitress Taylor was very helpful and friendly. We are still planning on coming here when we get a chance.",3 years ago,Open,2000626826
Cheryl Holder,5.0,"Great place to eat, the whiskey cake is to die for",2 years ago,Open,2000626826
Daniel Boleneus,2.0,"For as expensive as they are, you would think we would be able to have a visit there where there was NOTHING screwed up. How do you mess up spaghetti? Serving spoiled food? Shame on you. Gonna be a LOOOOONNNNNGGGGG time before I will ever be back.",2 years ago,Open,2000626826
Serge Artemenko,4.0,"Good food, but they need more servers.",2 years ago,Open,2000626826
Melissa Strickland,5.0,Great food and service. Love the patio.,2 years ago,Open,2000626826
Dan Pooler,2.0,"Not a great experience. Dirty utensils, forgotten appetizers and slow.",a year ago,Open,2000626826
Gretchen Serafini,5.0,Great pizza and service,a year ago,Open,2000626826
Roman AAA,5.0,"Really like this place, food always tastes great. Jake is one of the best servers i had there. Great experience.",3 years ago,Open,2000626826
C Douglas,5.0,Great service and solid food. Also they have golden tee now!,2 years ago,Open,2000626826
Francisco Martinez,5.0,"What a great place, food was excellent, my indy deluxe pizza the best, try this place you won't be disappointed",2 years ago,Open,2000626826
David Rollins,4.0,"Good food, great Sports Bar, good atmosphere!!",a year ago,Open,2000626826
Jeff Johnson,5.0,Great service. Awesome creamy buffalo wings. Great pizza.,2 years ago,Open,2000626826
Kevin Rice,3.0,It was okay. I should have known better,2 years ago,Open,2000626826
Lisa Barker,5.0,Amazing food outstanding service perfect environment my favorite place to eat.,2 years ago,Open,2000626826
Sharon Warner,5.0,Wonderful food and the service is great!,2 years ago,Open,2000626826
Mark Masterton,5.0,Always great food and service ever since it's been built!!,2 years ago,Open,2000626826
Leonna Andringa,5.0,We had a great meal and the waiter we had was awesome we will go back again for sure.,2 years ago,Open,2000626826
Renzler,4.0,Food is decent. They dismissed a parking issue instead of enforcing it.,a year ago,Open,2000626826
Kevin Maurice,5.0,A little piece of Canada in Spokane. Great prices too. 💯🍕🥗,2 years ago,Open,2000626826
Jacob Birr,5.0,Always a good spot when you're in the valley. Great food and prices are fair.,2 years ago,Open,2000626826
Todd Gunderson,4.0,Good service and food,a year ago,Open,2000626826
Kari Sobosky,4.0,a ton of food options.  maybe too many.  food is pretty tasty and prices aren't too bad,3 years ago,Open,2000626826
Ma Bellomy,5.0,"Love it, my favorite casual dining.",a year ago,Open,2000626826
dcmccabe41,5.0,"Very enjoyable visit with friends.
Good food and service.",2 years ago,Open,2000626826
Dina Shaughnessy,5.0,Quick service and great food. Clean place.,2 years ago,Open,2000626826
Elizabeth McLean,4.0,Food isn't bad but nothing special or memorable. The staff was very good and helpful.,2 years ago,Open,2000626826
Sandi Anglin Bartlett,5.0,Always so delicious!,a year ago,Open,2000626826
sammy ub1sammy@yahoo.com,4.0,"Had the wings, they were spicy yummy.",a year ago,Open,2000626826
Mark Vandermost,4.0,"Consistently good food, and is family/large party ready. Service is hit or miss but thats everywhere. I will go back.",3 years ago,Open,2000626826
Sukh,4.0,Friendly staff pizza was amazing but wings weren't really up to expectation didn't taste like chicken,3 years ago,Open,2000626826
arnold moss,4.0,Great food price is a little much though,2 years ago,Open,2000626826
Scott Engeldinger II,3.0,Super expensive and food was ok,a year ago,Open,2000626826
Daren Carlson,3.0,"Good food,  don't be in a rush service for foods slow",2 years ago,Open,2000626826
Ivan L. Spencer JR,5.0,Cranberry spinach salad. Awesome.,a year ago,Open,2000626826
Jara Baker,2.0,Boston's has a very good atmosphere and the staff is mostly friendly.  We went on Friday night and ordered appetizers with our meals.  The food was 'ok' but what irritated us the most was that while we were eating our appetizer (it was …More,6 years ago,Open,2000626826
Brenda Ludwick,5.0,I love this place the food is great.,a year ago,Open,2000626826
Seth Zzz,5.0,Almost every time I go to my grandparents we always get pizza here it is delicious!,3 years ago,Open,2000626826
Aaliyah Zymph,5.0,Tasty food and attentive service.,2 years ago,Open,2000626826
K Elder,5.0,Great service and wonderful food.,2 years ago,Open,2000626826
Eric M,5.0,Great food every time. All the staff have been very good!!!,2 years ago,Open,2000626826
Brenda Goodwin-Winn,2.0,The Gluten Free pizza was disgusting,a year ago,Open,2000626826
KATHY RONPAUL AEA,5.0,"Very delicious french dip, and wings, especially the parmesan garlic...",2 years ago,Open,2000626826
Rob Tarver,4.0,Fast and friendly service. Not too loud for the kids with good food.,3 years ago,Open,2000626826
Travis Stindt,5.0,"Best food in town. Their ranch far exceeds my expectations. Their pepperoni cheese bread twists, Grilled chicken Sandwich, and mamma meata calzone are stellar. If you are looking for great food and decent prices you need to come here. The staff are excellent as well.",3 years ago,Open,2000626826
Chloe Wentworth,2.0,"Horrible service! Food was good but only after maybe a 30 minute wait from the time we ordered; not to mention that we weren't even greeted by our server for maybe 10 minutes. You could hear the staff complaining about their jobs and the customers, not my idea of a good time.",6 years ago,Open,2000626826
Mark Hughes,5.0,"Football, 32 Oz mug & bacon wrapped steak...OMG & good service! A winner, though my team lost.",3 years ago,Open,2000626826
kelly watson,5.0,Nice menu and staff good beer selection,3 years ago,Open,2000626826
Marjorie Henningfeld,4.0,Nice place friendly people,2 years ago,Open,2000626826
Jefferson Doom,2.0,Had the boneless wings and portions were very small. Like cut up breaded breasts. And for the money I was very dissapointed. The 27oz beer was the only saving grace.,3 years ago,Open,2000626826
Morgan Brinkman,4.0,Pretty good experience overall.,a year ago,Open,2000626826
Damage Inc.,4.0,"3 different kinds of pepperoni on the trio thin crust, nirvana.....",2 years ago,Open,2000626826
Cody Sanderson,5.0,"Good food service, amazing pizza and a fun atmosphere.",4 years ago,Open,2000626826
Nancy Berry,5.0,Great food poor service,2 years ago,Open,2000626826
Marcy Dodd,4.0,"Service was prompt and friendly, but the best thing is their marinara sauce! Dip anything in it; so delicious!",3 years ago,Open,2000626826
Kind SupplyNW,1.0,Winner of worst of Spokane 8yrs running! No joke this was straight up cafeteria food at $17 per plate. Please heed this warning and avoid at all costs.,2 years ago,Open,2000626826
Lori Carlson,4.0,Good service and food. Reasonable prices.  Would come again.,5 years ago,Open,2000626826
Rebecca Coxson,3.0,"We stopped in Spokane Valley for the night, after driving all day. I called to verify that they deliver, asked what their delivery radius is and if they delivery by the mall, the gal wasn't sure. I was told the order had to be over $100 for …More",5 years ago,Open,2000626826
Mark Morrisette,5.0,Great pizza!,a year ago,Open,2000626826
The Damonator,5.0,Pizza and cheese fries were amazing!,2 years ago,Open,2000626826
Daniel Oehlwein,4.0,Jake is a great server.  He remembered us and treats us well.,2 years ago,Open,2000626826
Dennis Chambers,4.0,Good food and service,2 years ago,Open,2000626826
Z PYRO NINJA,4.0,Only 4 stars due to it being a little spendy but the food is really good definitely recommended,a year ago,Open,2000626826
Kc Chandler,5.0,"Great food, good experiance, and server was appropriately snarky and joked with us! Fun time.",3 years ago,Open,2000626826
Jason Humphrey,2.0,drinks were not good and food mediocre,a year ago,Open,2000626826
Kas S.,5.0,Really good all the way around,a year ago,Open,2000626826
Jillian Lawson,5.0,"Good food, Great staff..",2 years ago,Open,2000626826
Rick W,3.0,Service is always slow. They need to get more people working.,2 years ago,Open,2000626826
Gregory Mann,5.0,Outstanding lunch. Wait staff extremely  helpful.,3 years ago,Open,2000626826
BigShane,4.0,Its good food .,a year ago,Open,2000626826
Josh Schluter,5.0,"Always great service and tasty food and drinks, I love that the manager drops by every time to check on the meal.",4 years ago,Open,2000626826
Travis King,5.0,Got pizza and salad and mac & cheese to go.,a year ago,Open,2000626826
Betsy Munson,2.0,Bostons has gone downhill since last time we were there. We won't be back,a year ago,Open,2000626826
Crimns in Typhoon,4.0,You could get the stands that texas Roadhouse has for the tablets so they dont get thrown drooped or wet get the tablets back,2 years ago,Open,2000626826
Nick Altvater,2.0,"Looks like all the food is precooked then heated up when ordered. Nothing here appears to be fresh.
Early 20 something's are the worst bartenders.",5 years ago,Open,2000626826
G Roberts,3.0,Food was just so-so.....wasn't hot & they weren't busy,a year ago,Open,2000626826
Jeff Moe,4.0,"Chicken Parm was delicious, but the dollop of pesto was unneeded, service was ok.",2 years ago,Open,2000626826
Wanda Smith,3.0,Average food and service.,2 years ago,Open,2000626826
Terry & Danielle Grubham,4.0,"Average pizza, great staff.",2 years ago,Open,2000626826
Erica Pitner,5.0,Great happy hour appetizers!,a year ago,Open,2000626826
