name,stars,text,timeSince,openStatus,key
M P,2.0,Worst pizza experience of my life. Ordered food on 9/13/20 for my son to pick up after he worked a 12 hour shift. He did not receive all of the food purchased and paid for. Called Shakeys in Oroville and asked for managers and they promptly …More,2 months ago,Open,2000630665
Mi Mi,3.0,Service was good! They had dine in seating  which surprised me and employees were not enforcing mask. People were drinking beer and chilling. Butte county spiked over the weekend. Good thing I live in another county. So disappointed. Mostly the customers fault.,3 months ago,Open,2000630665
Tina Nunley,5.0,Wasn't all that. The pizza sauce was very good. But the crust looked and tasted like frozen pizza. I most likely won't order pizza from here again. Friendly staff.,a week ago,Open,2000630665
William DeFronzo,5.0,"Shakey's the Best chicken in town! Can't forget about the MoJos! Salad bar! Beer,Wine & Soda! Of course some pretty dam good pizza! Thin crust great sauce and toppings! Give it a try! The only original pizza place left in to! Be around since I was a wee lad!",a month ago,Open,2000630665
Jennifer Hoglund,4.0,Stopped here for lunch. The staff was friendly and food was timely.  My daughter enjoyed her personal pizza and I liked the options available at the salad bar.,a year ago,Open,2000630665
Ian Skinner,5.0,Fantastic ambience and very personal service. The food was fresh and delicious. Will absolutely recommend this restaurant to others. Convenient rates and big portions. Keep up the great work.,3 months ago,Open,2000630665
Leah Gilmore,4.0,Great chicken and mojos.  Pizza crisp and thin crust.. perfect,a month ago,Open,2000630665
Wanda Mcdonald,5.0,"Love shake's pizza the guys that work there are very respectful and their pizza, mojos, and fried chicken are a real treat.",a month ago,Open,2000630665
Christopher Barnett,4.0,Always go here when i'm in town. Food great here.,a week ago,Open,2000630665
K,1.0,"Absolute worst pizza we've ever had!! The crust was like a cardboard cracker, and no flavor. Tasted just like the $1 party pizza you can buy pretty much anywhere. Will not waste my money again. Staff wasn't wearing masks and gloves either. Not even the cook",3 months ago,Open,2000630665
Jonathan Escue,5.0,Amazing place! Proud shakeys is in Oroville wish I could give it 10 stars keep it up!,2 months ago,Open,2000630665
Johnny P,4.0,"Awesome place, food was pretty good! Glad places are opening back up.",2 months ago,Open,2000630665
Lena Edwards,5.0,Awesome service. Pie was grea.t,6 days ago,Open,2000630665
ART REYNOLDS,5.0,Totally miss having shakeys in Sacramento but this shakey is exactly like the old ones we used to have here and love it the pizza and the chicken all of it deeelicious,2 months ago,Open,2000630665
ukz too,1.0,"Visited last night and received the most rudest, nasty customer service. No greeting, the word please and thank you not in cashiers vocabulary. Cashier had attitude as if he was unhappy that he had a job and just so happen to include …More",a month ago,Open,2000630665
Angela Hinton,3.0,"Second time my family has been there and the pizza hasn’t been cooked either time. Called and they told my grandma She had to bring it back in, in order to receive a new one. She lives out in Palermo and can’t just drive back fourth for poor quality food and customer service.",3 months ago,Open,2000630665
Carlos Medina,5.0,Love this place. Traveled 3 hours to get here. They best,4 months ago,Open,2000630665
WEE Inc,5.0,Monday and Thursday night football spot best chicken in town,a month ago,Open,2000630665
Derek Schaffer,4.0,"Nice family place with good pizza, freshly prepared. They have some nice old arcade machines too, to show your kids the classics! Friendly service and clean environment to top it off.",a year ago,Open,2000630665
Davin Cox,5.0,Grew up going to the original in Sacramento. This was a nice blast from the past. Just the way I remember it.,a year ago,Open,2000630665
Debbie Htdr,5.0,Ive always love shakeys pizza and my son works there,2 months ago,Open,2000630665
Danny,5.0,The pizza is so delicious. I order combination yum,3 months ago,Open,2000630665
Steve Bird,5.0,I like this venue a lot. there is a happy atmosphere. The meals are splendid. the service is effective and the personel is very professional. The cost is decent. very much recommend.,6 months ago,Open,2000630665
Daniel Wolfe,5.0,I sent my friends to this place with my warmest recommendations. I go their often. This recommendation is always successful. The the food there is great and the crew is attentive and cooperative. Whenever we eat in this place we have a pleasant time.  highly recommended.,a year ago,Open,2000630665
jarhead grunt,5.0,"Love, love , looooove that shakeys. Great stuff!!! Good service and great 🍕🍗🍺and mojo's baby!!!!",5 months ago,Open,2000630665
David Santos,5.0,Shakey's in Oroville is excellent. Quality of the pizza is consistent and delicious. I called ahead and they had burnt my order so I ended up getting a free pizza for my next order. Very nice people and a cool selection of arcade games lots of old school ones.,9 months ago,Open,2000630665
mom playlist bashann,5.0,Whole family loves the pizza and chicken. Such quick service thank you,5 months ago,Open,2000630665
G Sheehan,5.0,"Great family environment.  Cheapest and tastiest that is already hot with the exceptional of Little Caesars.  My little one loved the videogames, the egg machine and the sticker machine.  Great customer service.  Highly recommend the rustic garlic chicken pizza.  Occasional special treat.",10 months ago,Open,2000630665
Samantha Sichley,5.0,"We had a great time there was so many of us there (family reunion) and they did so good accommodating us all. Pizza was great, salad bar was great and the beer kept coming. We'll definitely be back.",9 months ago,Open,2000630665
Michele Boullie,5.0,Love their pizz and service. Prices are great.  Friendly staff.,5 months ago,Open,2000630665
Pete Marshall,5.0,"Service and Pizza, chicken and Mojo's are excellent.",a month ago,Open,2000630665
Aviva Lutz,5.0,"OMG the thin crust, the fresh garlic it took me back to going out with my dad we always went to Shakey's",6 months ago,Open,2000630665
mike webster,5.0,"The food is fantastic,  always great service",2 months ago,Open,2000630665
Christopher Kennedy,5.0,Great atmosphere and very friendly staff. Yummy food.,5 months ago,Open,2000630665
Dee THOMSON,5.0,Great food. Los of fun. All around great place for taking your family out to eat good food and have a great time!,9 months ago,Open,2000630665
John Wesley Chancellor,4.0,Great pizza and mojos,3 weeks ago,Open,2000630665
Mayson Eaton,5.0,"This spot knows how to take care of their customers. Consistently with a super nice approach. The food is affordably priced, constantly delightful and neat.",9 months ago,Open,2000630665
Devri Womack,5.0,As always good mojos and pizza,2 months ago,Open,2000630665
Matias Camprubi-Soms,1.0,"It doesn’t taste like pizzeria pizza, so it must be DiGiorno’s or some frozen pizza. It’s plastic and cardboard. No comment on the dining experience, but it seems like nothing has been updated inside since Reagan took office.",4 months ago,Open,2000630665
Super Mario Manuel,5.0,"The food was great! The service is outstanding! And theres tons of fun for kids, like arcade games.",9 months ago,Open,2000630665
dan w,4.0,We have not been to Shakey's in years but we made it there yesterday and it was almost as I remembered it from years ago. To bad we couldn't eat inside. We will be going back next time in Oroville.,4 months ago,Open,2000630665
Lindsay Bohm,5.0,Wow! Best pizza and Best atmosphere,a month ago,Open,2000630665
Jovian Bernhard,4.0,"If you go to shakey's for the pizza you will probably be disappointed, if you go for the chicken and Mojo's you will not be.",4 months ago,Open,2000630665
Kenny Townsend,4.0,This band was really good young but good.didnt catch their name though I gave them 4 ****,10 months ago,Open,2000630665
Mark Oliva,2.0,"Low score due to burnt fried chicken. It looks like they used old oil to cook it. Staff are not wearing masks, specially the food preparer. I am not going back.",6 months ago,Open,2000630665
Sunny Cole,4.0,Perfect pizza crust. Good service,6 months ago,Open,2000630665
Jason Morgado,5.0,Love it every time I'm back home,5 months ago,Open,2000630665
Nancy Babbitt,4.0,This was the first time I had been to Shakey's in Oroville! Pizza was very good. It was a little chilly in the dining area.,10 months ago,Open,2000630665
Andito Vega,5.0,Chicken and mojos (fried potato slices) are the best here. Pizza is great too. Spacious building.,10 months ago,Open,2000630665
Martin Valleza,5.0,Great place with a comfortable atmosphere and a small selection of arcade games.,8 months ago,Open,2000630665
Erik Hogan,5.0,"This spot never disappoints. They serve good food for affordable prices, there is no waiting time even when they are packed.",10 months ago,Open,2000630665
Amanda Cohran,5.0,Absolutely the best pizza and potatoes ever....,5 months ago,Open,2000630665
MarshyMellow,5.0,In the past few years I've seen the first one on a new level of island that has the hive of,9 months ago,Open,2000630665
Dan DeLany,5.0,"Still my favorite pizza outside of Italy...
The lunch special with a personal pizza and great salad bar cant be beat and the Mojos are crazy good.  Not flashy, just great food at fair prices.",a year ago,Open,2000630665
Kimberly Drakeford,5.0,Love their pizza..especially thin crust,5 months ago,Open,2000630665
Henry Mestaz,5.0,Been a loving customer since 90' when they use to be in san jose. Always a fun celebration spot,10 months ago,Open,2000630665
Lj,3.0,"Best pizza, chicken & mojo's!
Just like how I remember from back in the day. We used to go to the one in Marysville. My kids loved the mojo's.",a year ago,Open,2000630665
Bones Butcher,5.0,Best pizza in town ! Love this place !,4 months ago,Open,2000630665
Chaka Hedrick,5.0,The taste of the pizza and Mojo's is authentic. And really really good.😁😉,9 months ago,Open,2000630665
Joseph Sharpe,4.0,"Good pizza. The amount and quality of video games is pretty poor, but you can't beat the mojo's",10 months ago,Open,2000630665
Miss Fortune,5.0,"Now Open for Dine-In orders
Maximum Party size of 10 people
50% capacity limit …More",6 months ago,Open,2000630665
Matthew Owens,4.0,Very tasty is always been a whiles they been there But prices are a little high but I live in Idaho last time I was here  3 or 4 years ago seem bigger lot less,11 months ago,Open,2000630665
Jeremiah Alexander,5.0,Good food to go mmm Shakey's!,4 months ago,Open,2000630665
Biggs4Life 530,5.0,Chicken is freaking amazing!!! I used to dislike Shakey's years ago but things have changed big time. Great service and people as well as amazing chicken and good pizza. Don't miss it!!!,a year ago,Open,2000630665
Giovanni Brown,5.0,"So good, i'd never been here before but this place is AMAZING! <3, can't wait to go back!",11 months ago,Open,2000630665
Lawrence Durfey,5.0,I've been coming here with my family for years!! I love the chicken and Mojo's,10 months ago,Open,2000630665
Erica Marie,5.0,Wonderful! Ed was fantastic and the most welcoming kind and attentive host our family has ever had the pleasure of encountering. We live going out for family Pizza tonight and this officially and must return to place for our Disneyland …More,2 years ago,Open,2000630665
Zeke Acrimonious,3.0,Sauce was sour,a month ago,Open,2000630665
Daniel Duron,5.0,"Delicious freshly made pizza, and tasty crunch fried chicken. Self serve ketchup, and ranch? Oh yes. Friendly staff every time I go in. Oh and their potatoes (mojos) are SO good.",a year ago,Open,2000630665
Dan Jordan,5.0,Always a treat when we come to town.,5 months ago,Open,2000630665
Rhiannon Ochoa,3.0,"I have never been to a pizza place, that didn't have wings..i need wings with my pizza!! There are some old games for the kids to play and the pizza is great.",a year ago,Open,2000630665
Cindy Lavender,1.0,Our grandmother fell because the chairs and tables were not wide enough and her hip is out. And my boyfriend lost his phone there and no one turned it in while we were …More,a year ago,Open,2000630665
JEREMY MARSHALL,4.0,"Shakey's pizza is not the ordinary pizza. They have very unique flavors compared to other pizza chains. What sets them apart for me is that my pizza is always hot,  ingredients always top quality and you don't have to take out a second …More",a year ago,Open,2000630665
Jackie Peterson,4.0,Great food.  Music was great but a little to loud & we found it difficult to talk.,10 months ago,Open,2000630665
Barry Wilson,5.0,"Understated locale, awesome flavors! Flavorful sauce. Crispy pizza!",3 years ago,Open,2000630665
Vicki Hutchings,3.0,The Beer Selling is more important than the Pizza. I feel it's gone down hill since the remodel 💜✌,8 months ago,Open,2000630665
Jason torres,5.0,"Always been a great family pizza parlor
Love pizza & mojos & the beer is cold!",a year ago,Open,2000630665
Daniel Jewell,5.0,"One of the best in Oroville. Great food, huge selection, and friendly service. The pizza is spot on for good quality ingredients and taste. Got the potatoes, which I could eat a whole bag on by myself. Definitely someplace to go and someplace I will come back to.",a year ago,Open,2000630665
Krieger System,5.0,Always good service and great food!,6 months ago,Open,2000630665
Kyle Wells,5.0,Always great pizza!,3 months ago,Open,2000630665
Daniel Evanikoff,5.0,Yeah sure is great for five bucks does a Wonder you get all kinds of veggies with a salad to-go good dish,a year ago,Open,2000630665
Wanda Waybright,5.0,Good pizza. Their mojos don't taste the same. But are still good with the chicken. Good environment and music. The workers are friendly.,a year ago,Open,2000630665
Susie Parker,5.0,Pizza was great..still not happy with the people I met there for?? Oh now I remember..SSHH..it's a secret 👍,a year ago,Open,2000630665
Calvin Walker,5.0,They got good potatoes.,6 months ago,Open,2000630665
YourBee Gal,1.0,"Employees need to follow
Good safety laws with salad bar and wash their hands more.",a year ago,Open,2000630665
Tim Rogers,5.0,Almost 50 years I'm going to various parlors love it to death,a year ago,Open,2000630665
Vicki Cook,5.0,"Good pizza. Decent price, and they put up with ournl baby shower.",a year ago,Open,2000630665
Tania Ward,5.0,"Best old school pizza it's definitely nothing short of Amazing , their chicken and mojo potatoes outstanding! Looking for great food and service in a chilled laid-back environment this is your place.",a year ago,Open,2000630665
Alyssa Hale,4.0,The mojos are really what makes this place for me. I'm just here for the dang potatoes,8 months ago,Open,2000630665
Remjhun,4.0,The food is great worth the travel but the place gets a little crowded at peak hours and the makes the wait time a little longer.,2 years ago,Open,2000630665
anna maldonado,5.0,"Shakeys was great, excellent customer service and the mojo potatoes were the best.",a year ago,Open,2000630665
Troy Mcclanahan,5.0,"Great food. Great staff. Wonderful owner. Dan is such a great guy. Keep up the great work, Dan.",a year ago,Open,2000630665
Wayne Rochester,5.0,Good pizza thinner style crust l. The Mojo's are bomb 💣,11 months ago,Open,2000630665
Katie Beal,4.0,"Tasty little joint, the crust was good and not soft.  They make some bomb potatoes you've got to order them, we tried the loaded...comes with cheese and bacon and chives and olives. They also have fried chicken we didn't get to try, but heard it was good too. We will be back for it soon.",a year ago,Open,2000630665
Joe,5.0,Best pizza in town hands down and who doesn't love the mojo's  if you havent tried this pizza parlor I definitely recommend you do,3 months ago,Open,2000630665
LeWayne Wyman,5.0,Nice friendly place with great pizza and excellent mojos.,3 years ago,Open,2000630665
Troy Gabrielson,5.0,Love the pissa and salid bar😍,11 months ago,Open,2000630665
Russ Bravo,5.0,Thin crispy crust....good value .,10 months ago,Open,2000630665
Gail Gaughan,5.0,Super nice employees!,5 months ago,Open,2000630665
Crimson Sparrow,4.0,"Old school mojo potatoes, pizza, and a nice little salad bar. One of the local favorites!",3 months ago,Open,2000630665
Vickie yvonne Wilhite,5.0,I just love shakeys have for 35yrs!,11 months ago,Open,2000630665
Tatum Rushing,5.0,Pizza and mojos are one of a kind and taste amazing! Plus they still have old school pacman that's a blast to play😁,a year ago,Open,2000630665
Gayle Rasmussen,4.0,"I  have always loved Shakey's pizza, mom is, chicken and sandwiches. However,  I hate that they serve the lettuce wet. It's so awful!!!",a year ago,Open,2000630665
Shawn Shafer,1.0,Horrible service workers did not wash there hands EVER wiped off sweat place was dirty filthy the staff was also rude. Food was under cooked doughy in parts will never go back,a year ago,Open,2000630665
Christopher Lewis,4.0,Mojos are unbelievably good,6 months ago,Open,2000630665
Joe Young,5.0,I love pizza and Shakey's might just be my favorite pizza. The sauce and the crust is definitely some of the best if not the best!!,a year ago,Open,2000630665
william manes,5.0,"Where else can you get jojos , fried Chicken and pizza with a salad. delicious food as always 😋",a year ago,Open,2000630665
Michael Marchand,5.0,I've loved Shakey's pizza since i was a kid and they rocked it great pizza,a year ago,Open,2000630665
Jason Beno,5.0,"Awesome food, good service, nice restaurant.",11 months ago,Open,2000630665
Ange Jordan,1.0,"The absolute worst salad bar, watered down dressing, even the cottage cheese, items seemed to be on the verge of spoiling, the ice tea tasted like sewer water, didn't  want to complain because manager took our order, he acted as though it …More",a year ago,Open,2000630665
Stacy Kinser,5.0,We go here for big birthday's and occasional Sunday dinner.  The staff are always amazing and the food is the best in Oroville.,a year ago,Open,2000630665
Megan Randolph,5.0,Best pizza,3 months ago,Open,2000630665
John Chancellor,4.0,I've been visiting this place since my childhood. The pies are always good and the atmosphere is usually relaxed.,a year ago,Open,2000630665
Jesse Thompson,5.0,"My single favorite pizza place. I'm a fan of the thin crust that Shakey's makes as their signature pizza. It's hard to find a good Shakey's anymore, and having one in a small city like Oroville is kinda shocking, but they don't disappoint! …More",a year ago,Open,2000630665
rhonda letterman,5.0,"Excellent pizza, we saw a lot of people getting the chicken and mo Jo's. We want to try them next time",a year ago,Open,2000630665
crazynightout deaddrop,3.0,Their fried chicken was really good the pizza's good but for the price it wasn't that great seem like a regular old microwave pizza and their mediums a joke but they do have some good arcade games in a salad bar over all there's better places,a year ago,Open,2000630665
TYLER CHRISTENSEN,5.0,"Delicious pizza, fantastic fresh salad bar, clean dining room.",a year ago,Open,2000630665
Lisa Reed,4.0,It was really good..I like the old way they make mojos..they are still good though,a year ago,Open,2000630665
Jo jojo,2.0,"Friendly customer service that's worth the 2 stars.We were surprised at the positive reviews To be fair  there were quite a few people in the place. The last time I came for an employee party I swore I would never come back,but hey it's …More",a year ago,Open,2000630665
Mikel Arreola,5.0,The fried chicken and mojo bomb!,a year ago,Open,2000630665
Mark Haegelin,5.0,I had too have lunch their pizza is now upscale with a customer choice menu. A additional White sauce with Chicken and :.. what Avacado it was delicious.,a year ago,Open,2000630665
Daynn Miller,4.0,Shakey's Pizza 🍕 what more needs to be said it's a family thing. Great service good people 🍕 🍺,a year ago,Open,2000630665
Wendy Owens,5.0,We always have birthday parties here! Fun and friendly local pizza parlor!,a year ago,Open,2000630665
Marjorie Gibson,3.0,"They put wrong sause on one of our pizza, but still good",a year ago,Open,2000630665
Pamala Lincoln,5.0,We had a real good time! The food is great and so is the service.,a year ago,Open,2000630665
KasSandra KasS,5.0,I remember Shakeys from when I was a kid and it was very nice eating at Shakeys now that I'm in my 40s... still very delicious,a year ago,Open,2000630665
Patty Paterson,5.0,The guy who took our order was so cool and lived our stories about all the Shaky's we used to go to.  The pizza was incredible. Just like I remembered it! Missing Shakys in Sacramento! Come back!,a year ago,Open,2000630665
Keith Sharward,5.0,"Two words: MOJO POTATOES!
And FRIED CHICKEN!
OK, that's four words. …More",a year ago,Open,2000630665
Michael Harmon,5.0,"Shakeys is AWESOME and their food is AMAZING !
We eat there ar least 3 times a month",a year ago,Open,2000630665
Mark A. Jones,4.0,"Chicken, mojos, pizza, salad and cold drinks.  Excellent family place, live music on Friday evening.",a year ago,Open,2000630665
Forrest Hartman,5.0,Great local pizza place. Live music every Friday and great food and drink every day.,a year ago,Open,2000630665
Scott Silverthorn,3.0,They use to be a great place for pizza and chicken. With almost no one in the restaurant they said 30 minutes. Took almost an hour. Service is going down hill.,a year ago,Open,2000630665
Patricia McCown,4.0,The Mojo's are the best. Had fun playing Ms Pacman and Donkey Kong 😊 sipping soda and good pizza. Didn't care for thin crust,a year ago,Open,2000630665
tawnya stenroos,5.0,Had lunch seen a friend that worked there service and food was outstanding! Good job Bubbs!!😉,a year ago,Open,2000630665
Renee Sanchez,5.0,Love Shakey's pizza & chicken & mojos!!,9 months ago,Open,2000630665
Michael Taul,5.0,Shakeys is a nice clean place food was amazing the workers are polite and respectful and they even gave my son a balloon for his birthday,a year ago,Open,2000630665
Peter Lewis,5.0,Great pizza and fast service.  They use the old style pizza ovens. I'm sure that's part of the reason the pizza is good.,2 years ago,Open,2000630665
Shannon McCann,5.0,"OMG, there food is so phenomenal!! Great decor and service. I've never been there before but I am coming back and back and back. Just found my new spot!",2 years ago,Open,2000630665
Francisco Gonzalez,5.0,Hands down the best place to get a pizza highly recommended,a year ago,Open,2000630665
Rachel David,5.0,Shakeys is my favorite pizza parlor. Love their thin crisp crust! Their pizza is always fresh and never greasy. Must try the Shakeys special!,a year ago,Open,2000630665
Rochelle Myles,5.0,They hooked me up. Love it,a year ago,Open,2000630665
Mike Smith,5.0,Excellent service. Excellent pizza.  We had a good time!,a year ago,Open,2000630665
ted scherbenske,5.0,Best severest ever,11 months ago,Open,2000630665
Tina Ricci,3.0,Tthere chicken is fire,2 months ago,Open,2000630665
Keys City,5.0,Really good Pizza and the best potato wedges if you're in Oroville and you're hungry for pizza definitely got to check this place out,a year ago,Open,2000630665
Mark Herman,5.0,great place for pizza and beers and a great family place too check it out if you're in the area,a year ago,Open,2000630665
Deborah Steich,4.0,Good pizza I just did take out,a year ago,Open,2000630665
Patti Brewer-Habeck,5.0,Best pizza in northern california!  Live music on friday nites too!,a year ago,Open,2000630665
sharry hope,5.0,Shakey's has been here for a long time. It's a great place to bring your family and children or your friends. Usually on Friday night they have a fun band. Come have a great time and enjoy the pizza,3 years ago,Open,2000630665
Richard Lim,5.0,"Food and staff were great.... Customers... Well, people are crazy.",a year ago,Open,2000630665
Jenny M,3.0,"The Shakey's in San Jose was closed YEARS ago so we decided to take an over 2 hour trip to Oroville's Shakey's... It was pretty disappointing the number of games they had here. Back in San Jose it was an entire room full of games, you got …More",a year ago,Open,2000630665
Eric Jenkins,5.0,Great atmosphere. Awesome salad bar.,a year ago,Open,2000630665
Teresa Morrison,5.0,"Awesome food. Especially the chicken and mojos. YUM! Friendly employees also. Games for the kiddos, even the young ones can get goodies out of the machines.",2 years ago,Open,2000630665
John Romine,5.0,"Great pizza, chicken, and mojo potatoes",a year ago,Open,2000630665
Zachary Faunce,4.0,Came here since i was a kid no need to change what works,10 months ago,Open,2000630665
MANDIE WELCH,4.0,"Good pizza. Good staff. Stocked salad bar! Games for the kiddos.
There was a LONG wait time tho. So that was a little irritating. So dont go on a weekend once baseball season starts.",2 years ago,Open,2000630665
Leana Russell,5.0,"Good food, great customer service friendly helpful staff great atmosphere.",a year ago,Open,2000630665
Adam Hansen,5.0,My son dropped an entire pizza bringing it to our table and they did not hesitate to replace it! Pizza is amazing :),a year ago,Open,2000630665
Dawn Hesseltine,5.0,We went to Shakeys for a small birthday thing and ordered a party size pizza and it feed 6 grown ups. The price was a little much but the pizza is worth it it tasted delicious. And the Mojos omg those were the first thing gone off the table …More,a year ago,Open,2000630665
chuck waugh,5.0,Best chicken and Mojoes,11 months ago,Open,2000630665
Tim Dobson,5.0,By FAR the best fried chicken and pizza in all of Butte county. Their mojo's are amazing and the salad bar is well stocked. The staff is always friendly and professional.,2 years ago,Open,2000630665
Sonja M Burton,5.0,Friendly atmosphere food was great,11 months ago,Open,2000630665
