name,stars,text,timeSince,openStatus,key
Chris Cleveland,5.0,Love this place.  It's the best meal after a day on the lake.  The brick oven pizza is fantastic.  We love how the toppings are sliced and spread on the pizza. Salad bar is great too.,4 years ago,Open,2000630665
CindyLou Richmond,1.0,Staff unprofessional and not paying attention to what they're doing; terrible food...noisy...very expensive for what you get.,a year ago,Open,2000630665
April,4.0,"Only reason it's not a 5 star for me is bc of the price, other than that it's one of my favorite places! Mojos are yummy, pizza is great, salad bar is amazing! Great place for a birthday party to!",2 years ago,Open,2000630665
sandra hazelwood,5.0,I love the atmosphere at this place. Fun and exciting for the whole family. Great pizza and mojo potates  are to die for. Staff very friendly and always helpful. Great bonding time for the family. Great deals on family packs and they always have great deals on food.,2 years ago,Open,2000630665
Michael Roberts,3.0,"Lot's of memories as a kid, families getting together, gatheringto eat, laughter, good talk, and celebrate life with my brother and sisters and friends. Mostly because back in the day, pizza was affordable and you could get together with family and friends without a lot of $$$🍻😁",2 years ago,Open,2000630665
Denah Laws,4.0,"Good food and service. Shakey's is always busy, so there will be a wait. However the wait is worth it, because we never leave hungry and we usually have some to take home. I do wish there was more than 1 tv to see sports on, or a bigger screen.",2 years ago,Open,2000630665
Barbara Brokaw,2.0,Wasn't very good this time I have always enjoyed shakeys this time I was really disappointed,a year ago,Open,2000630665
Alex Davies,5.0,Damn good chicken. Which is funny since its a pizza place lol.,a year ago,Open,2000630665
Sharese Ungaro,5.0,I Love the food it's the best & very filling. Everyone should try there food. 👍👍👍👍👍,a year ago,Open,2000630665
Steven Hyde,4.0,It was quite a good experience. It reminded me of the pizza parlors back when I was a kid,2 years ago,Open,2000630665
Erron Garibay,5.0,Mojos and chicken need I say more,a year ago,Open,2000630665
Heather Morman,4.0,"This place needs to be updated. That being said, the food tasted great!",2 years ago,Open,2000630665
Dawn Brewton,4.0,Always good pizza for a large gathering.,a year ago,Open,2000630665
Lenorah George,4.0,"The staff was amiable, the chicken and mojos crispy and tasty, the salad bar well stocked and clean.",2 years ago,Open,2000630665
Martin Hein,3.0,Good beer and pizza joint. Clean and nice service.,a year ago,Open,2000630665
Johnny Herrera,2.0,All good food except for a cockroach that ran across the counter first and last time there,a year ago,Open,2000630665
Jeff Chapdelaine,5.0,Love Shakeys! Pizza is good! Real cheese and toppings! LOVE the fried chicken! Love the mojo's! Great salad bar! Great family Birthday party place!,2 years ago,Open,2000630665
Angie Herron,3.0,"We went there cuz old memories growing up, it wasn't the same. I was a good salad bar but the pizza was just so so.",2 years ago,Open,2000630665
Clayton Hobbs,5.0,Awesome place to eat. Been eating here for decades. Great food and atmosphere.,2 years ago,Open,2000630665
Heather,1.0,It taste like a frozen store bought pizza and the ranch is gross!,2 years ago,Open,2000630665
Devin Baxter,4.0,Bomb.com,a month ago,Open,2000630665
Brittany Pitrucha,3.0,Food was good (nothing really special though) but way over-priced. $30 for 1 large pizza that feeds 2 adults. Not worth it considering it was only pizza.,2 years ago,Open,2000630665
Win Again,5.0,I love Shakey's pizza since I was a child,a year ago,Open,2000630665
Robert Radtke,5.0,Clean place,a month ago,Open,2000630665
Holly,5.0,Great food for a great price,a year ago,Open,2000630665
Kelby Packwood,2.0,There was a frog in the salad bowl.  Everyone acted like it wasnt their issue to handle as food servers. The salad had looked like it has actually been out for hours. Watered down and wilted. The lack of professionalism was just a real turn off after we had paid to eat here....,2 years ago,Open,2000630665
G Walker,5.0,"Shakeys is awesome, great place to celebrate a birthday, the end of soccer season or just to hang out with the family while you listen to live music. Great food and over 30 years of great memories.",2 years ago,Open,2000630665
Cheri Marchand,5.0,Good food. Friendly people.,a year ago,Open,2000630665
Lynn Otten,4.0,Been going there since I was a kid! Great food and great staff!,a year ago,Open,2000630665
Steven Valadez,5.0,Hella good,11 months ago,Open,2000630665
Sherry Rogers,5.0,"Reasonable prices, good salad bar",a year ago,Open,2000630665
DamonGunn,5.0,"The only surviving original Shakey's between San Jose and Seattle, this family pizza restaurant was opened in the mid 70's and has been a home town favorite ever since. Owned and operated by a local family this is a must visit for pizza …More",11 months ago,Open,2000630665
Diana Bowen,4.0,Chicken & Mojos still good as I remember!,a year ago,Open,2000630665
Charles Claggett,5.0,Absolutely love their combination Deelishis,a year ago,Open,2000630665
Alisha Robles,5.0,Chicken and mojo potatoes!!,9 months ago,Open,2000630665
Alex p,5.0,Was  real good long drive .but worth it,2 years ago,Open,2000630665
name here,5.0,Best in the franchise. If you say double sauce or cheese. They give you the hook up. I've been going here for 12 years and it's been great every time!,3 years ago,Open,2000630665
Jesse Sossaman,5.0,Chicken and Mojo's are delicious! You either love the pizza or hate it. I love it!,2 years ago,Open,2000630665
Cathy Schmidt,4.0,Good food. Not a lot of parking if they're busy though. Friendly workers. Good for birthday parties.,2 years ago,Open,2000630665
Becca J,5.0,Just how I remembered it from my childhood. Wish there were more!,a year ago,Open,2000630665
nancy arias,1.0,Ummm. Not the Shakeys from the 80's. Pizza crust so thin and crispy. Reminded me of Tombstone Frozen Pizza. Had free coupon for 9in. Good thing I didn't have to pay for it. Will not go back!,2 years ago,Open,2000630665
daljit janda,1.0,"Very poor service At oroville, ca location! On 3/16/19 the manager refused to take a dine in out at 9:20pm! He said that we close at 10pm. We had called at 5pm and told an employee that there will be a party of 20. We drove around 40 miles!",a year ago,Open,2000630665
Mary Meadows,5.0,"So happy to have found Shakey's again! Grew up eating there Mojo's in Auburn, until they closed. Love them and their food!",3 years ago,Open,2000630665
Leosha Hamilton,4.0,"Great atmosphere...pizza needed more cheese but no skimping on the rest of the toppings , flavors we're sensational",2 years ago,Open,2000630665
John Gilbert,4.0,"Best Dough ive ever had personally. Very fresh, excellent taste! The ONLY downside is how long it takes to get your food.",3 years ago,Open,2000630665
Mackenzie McKeehan,4.0,Good service. Family friendly. Great pizza.,2 years ago,Open,2000630665
Angelica Massey,5.0,My Pizza and mojos were hot and delicious!,a year ago,Open,2000630665
Carol D Gramps,5.0,"Shakey's is a great family pizza parlor , that you can have Birthday party  or sports  party  .It' has great pizzas  monies & chicken",2 years ago,Open,2000630665
Teresa Schmidt,5.0,"So glad I found out Shakey`s is here. Love the Mojo's, the old video games. The pizza, sandwiches.  Yummy",2 years ago,Open,2000630665
Sabrina Alexander,5.0,Very family friendly and clean. Excellent customer service and great food,2 years ago,Open,2000630665
Fred S,2.0,Lets begin positive.......The Mojos were awesome!  Pitcher of Sierra Nevada was on $9.30.  Can't beat the taste or price for those two items. …More,2 years ago,Open,2000630665
John Hagman,4.0,"Always good pizza & mojo""s! Great atmosphere and reasonable prices.",2 years ago,Open,2000630665
D Xander,5.0,Always good!,11 months ago,Open,2000630665
Fino Espinoza,5.0,The best ever,11 months ago,Open,2000630665
Ernest Schuck,5.0,The Best...!!!,5 months ago,Open,2000630665
Donna Jacobs,4.0,Fun family resteraunt!,a year ago,Open,2000630665
Big Sexy,5.0,"I have been coming here since I was a kid food is always great, employees have aways been very polite.",2 years ago,Open,2000630665
Brandy Lee,5.0,"Sooo good! Fried Chicken, Mojos and Pepp pizza. Chicken crispy and moist. Mojos are elevated Jojo’s, Pizza light and flavorful. Clean family restaurant",2 years ago,Open,2000630665
joe wayman,5.0,The last pizza place I ate with my mom. We grew up on shakey's pizza. I try and eat there when I get back to Oroville.,a year ago,Open,2000630665
Chris Mitchell,4.0,Chicken and mojos. Friday live music,a year ago,Open,2000630665
Sherry Knight,5.0,Great place to eat and entertainment 2,a year ago,Open,2000630665
Ceji Mccurdy,4.0,"Great family pizza place. Good food. Good service, usually packed but that's cause it's so good. Pizza, salad, mojos and chicken.",2 years ago,Open,2000630665
Charlevonne Glenn Hall,2.0,Great!!,3 months ago,Open,2000630665
CAROL D Gramps,4.0,"Shakey's is a great family-friendly pizza parlor
Grate for  Birthday parties  and sports party or
Good ,pizza, chicken & mojos.",2 years ago,Open,2000630665
Steven Skoog,5.0,"Extremely helpful order taker, she really helped me out on Valentine's day! Very good pizza and not a real long wait!",2 years ago,Open,2000630665
Ann Evans,5.0,The best chicken money can buy.,2 years ago,Open,2000630665
Jesse Hipes,5.0,Wish they had more establishments through out the Pacific Northwest,a year ago,Open,2000630665
Denbeigh Burgess,5.0,Always good food and great help,a year ago,Open,2000630665
Cody Nore,5.0,Great thin-crust pizza. Mojos are excellent. They also keep the salad bar well-stocked with fresh ingredients.,3 years ago,Open,2000630665
Kevin Sanford,4.0,One of the last 5 Shakeys in North America. Just like you remember.,3 years ago,Open,2000630665
Ryan C.,5.0,Best chicken and mojos,a year ago,Open,2000630665
Brandi Strang,5.0,Love the pizza love the mojos my favorite is pizza place in town is Shakey's been coming here since I was a child,2 years ago,Open,2000630665
Morgan Turner,5.0,"Love it here, great pizza and mojos",a year ago,Open,2000630665
Robert & Terri Bardini,4.0,Great Pizza and good help. We really enjoyed our decision to stop here.,2 years ago,Open,2000630665
Teri Carter,4.0,"Pizza is decent, Mojo's and chicken are amazing! Salad bar is good. Can be crowded and have slow service. Overall, though, I have great memories of gathering here with great friends most of my life. They give out free balloons to the kids, and the games are ok. I love that they have a classic Pac-Man table arcade game.",2 years ago,Open,2000630665
Keith Lemm,4.0,A nice family place.. plenty of parking the pizza was just okay,2 years ago,Open,2000630665
Howard Little,5.0,"Just like the Shakeys we knew and loved.Very clean ,cool and a great location.",2 years ago,Open,2000630665
Conrad Gauntlett,4.0,Service was quick and friendly. Pizza was good.,2 years ago,Open,2000630665
Wendy Jacobsen,5.0,"Pizzas are good but, the Chicken and Mo -Jos are the Best. The Salad Bar is Fresh and need empty.",3 years ago,Open,2000630665
don peterson,2.0,Good pizza. Asked for it to be overcooked but didn't get it that way. Lots of Flys and nobody cleaning tables but just standing around,3 years ago,Open,2000630665
Devry Engle,2.0,Sucks worst pizza ever,10 months ago,Open,2000630665
Faruq Shirley,5.0,Shakey's is still great pizza! It's a shame this is the closest one.,2 years ago,Open,2000630665
Beth C,2.0,We came here because this place had good reviews. But to be honest the food really was not very good and the salads were pathetic. It does not have a very good atmosphere and didn't seem very clean. You're all packed into one open room like cattle. People stare at you when you're eating.,4 years ago,Open,2000630665
Lee Martin,5.0,It's rare that you see a restaurant with all 5 star reviews. Shakey's is actually that good. Their pizza is amazing.,4 years ago,Open,2000630665
Rosanna Baker,5.0,Pizzas are good.,a year ago,Open,2000630665
Mike Andrews,5.0,"Love, this place.  I drive the family an hour and a half from Sacramento just to eat here at least once a year for the family special of Pepperoni Pizza, deep fried chicken and mojo potatoes.",3 years ago,Open,2000630665
Roger Duran,5.0,Love the MoJo's and chicken,a year ago,Open,2000630665
Korbin Hughes 173,4.0,Great food,10 months ago,Open,2000630665
DOS UNO,5.0,Sure wish Shakeys Pizza would build more pizza parlors across northern California just like they do Southern California!,2 years ago,Open,2000630665
barbara brokaw,5.0,"This is the only shakeys I know of still in ixsistance and our whole family love it
.",3 years ago,Open,2000630665
Danel Cattalini,5.0,"I was excited to find a Shakeys. Huge  fan
Best pizza in town.",2 years ago,Open,2000630665
Papa Ken,2.0,"I didn't dislike it. I disliked the prices. My lady friend and I stopped here for lunch...one large. 🍕  and two small drinks
Cost $ 33.00 Dollars.",2 years ago,Open,2000630665
Benjamin Bartholomew,5.0,"The pizza is great, the chicken is great, and the Mojo's are a wonderful surprise!",2 years ago,Open,2000630665
Irvine Unruh,5.0,Best pizza and mojos hands down.,2 years ago,Open,2000630665
Josh Marquis,3.0,Meh...pizza was tolerable...the parts that were warm,2 years ago,Open,2000630665
Randy Jordan,4.0,I would probably give a five if they had the original Mojo's,2 years ago,Open,2000630665
George Martin,4.0,Local favorite pizzeria. The pizza is ok but the mojo's and chicken are what brings people in.the atmosphere is fun and it's a great venue for parties. Good lunch specials too. Been going there for 30 years and I'll keep going there.,4 years ago,Open,2000630665
Laura Slutter,5.0,Love the pizzas.,a year ago,Open,2000630665
Raelynn Appenay,5.0,"It was food food, great service",a year ago,Open,2000630665
mike kelso,5.0,"Really good pizzas, hand made, pretty cool.",2 years ago,Open,2000630665
Katie Welch,5.0,"Great environment, great food,enjoyed it alot.",2 years ago,Open,2000630665
Kevin Reno,3.0,"I haven't been to a Shakey's Pizza in over 40 years. It's ""Ye olde"" this and that all over again- fond memories.  They don't have a lunch buffet, so I ordered a lunch special. Soda, mini pizza, my choice of one topping, this time pepperoni, …More",2 years ago,Open,2000630665
Tammi Fabris,5.0,"Excellent food, excellent environment and great time for the whole family.",2 years ago,Open,2000630665
Christina Lemos,3.0,Mojos are bomb but pizza isn't great and ranch is from a bottle :-(,a year ago,Open,2000630665
Byron Hall,5.0,"Grew up eating this, still very good pizza.",2 years ago,Open,2000630665
Dannie Eaves,4.0,Pizza was good. staff was friendly and quick. we will return.,3 years ago,Open,2000630665
Russel Miller,5.0,"Best pizza shop in Oroville, This is my paintball groups spot of choice after a weekend at Combat Zone.",3 years ago,Open,2000630665
Tim Cummings,4.0,Was very good I love their pizza and they're Mojo's did my girlfriend there for the first time this evening... she was very impressed with the taste of the food! I was surprised to find out that they do not serve salsa with the Supreme …More,2 years ago,Open,2000630665
Jefkalefka,5.0,food is really big :) love it 👍,2 years ago,Open,2000630665
Brandy Seipel,5.0,Love it!! We drive all the way from Marysville just to get Shakeys pizza!,2 years ago,Open,2000630665
Carlos & kandice Leon,5.0,I drove from Sacramento to Oroville just to eat this pizza and mojos.  Anymore questions?,2 years ago,Open,2000630665
Scott Oversen,4.0,pizza is so good sure its a lil pricey but the pizza is quality def worth a try,3 years ago,Open,2000630665
Carrie Lester,5.0,Love their pizza and Mojo's. So good,2 years ago,Open,2000630665
Kaleb Johnson,4.0,Very greasy but good pizza and good people,2 years ago,Open,2000630665
Gabe Watson,5.0,I've been eating there for I.have no idea how long and always was received politely and always very good food,3 years ago,Open,2000630665
Zeusy,5.0,The chicken and pizza were divine definitely made by the gods.,3 years ago,Open,2000630665
D C,5.0,"Great pizza, Love their crust, and salad bar is always good and fresh",3 years ago,Open,2000630665
Teal Gunter,5.0,I absolutely love Shakey's!!,a year ago,Open,2000630665
Peter Bahnson,4.0,Try the mo-jos,a year ago,Open,2000630665
Marla Abrao,5.0,Great pizza! Great atmosphere! Nice employees! Very clean restaurant!💯💯👍🏻🍻,4 years ago,Open,2000630665
Vaughn Lampe,4.0,"Usually stop after camping. Great pizza, chicken and mojo potatoes.",2 years ago,Open,2000630665
one8ghty,5.0,I've always loved it here...... amazing food!!! amazing staff!!!!! clean and classic!!!,2 years ago,Open,2000630665
Nicholas Sinclair,5.0,The Mojo's are the best. Brought back a lot of childhood memories stepping into there,3 years ago,Open,2000630665
Stacy Kinser,5.0,Best pizza I have ever had.,2 years ago,Open,2000630665
Joanne Drummond,5.0,Love this pizza...eating it for over 45 years now!!!,2 years ago,Open,2000630665
Greg Asher,4.0,"Great food , just need more help to be better customer oriented",3 years ago,Open,2000630665
Susan Williams,5.0,"Omg, who lives in Oroville and doesn't like Shakeys??? They have the bomb pizza and they're chicken and mojos are spot on.",3 years ago,Open,2000630665
Connie Harvey,5.0,"I am the day time manager for this place. We have great service, and awesome food and very clean place, a lot of reservation's on the weekend for party's.",4 years ago,Open,2000630665
Nick Winninf,5.0,Been eating here 15 years and still the best pizza I've ever had,4 years ago,Open,2000630665
James Bacon Jr.,5.0,Great pizza and great people working here,2 years ago,Open,2000630665
Mike Gasque,3.0,Not as good as it was when I was a kid,a year ago,Open,2000630665
Sarah Ybarra,4.0,Love the crust.. Over all it was good 🍕,3 years ago,Open,2000630665
Nate Long,4.0,Mmmm good,a year ago,Open,2000630665
LuAnn McCurry,5.0,Very good pizza. Crispy crust YUM!,3 years ago,Open,2000630665
b Joseph,5.0,One of best pizza sauce I've ever had on a 🍕,3 years ago,Open,2000630665
Cara,5.0,Best pizza in Oroville!,a year ago,Open,2000630665
Laurie Aust,5.0,So Good,11 months ago,Open,2000630665
Sandra D.,5.0,"We come from Stockton, Ca for the pizza,  fried chicken and MOJO's  .. so freaking delicious .",4 years ago,Open,2000630665
Justin H.,5.0,Service is very friendly and the pizza was great!!!!  I wish they would expand back down to Sacramento.,2 years ago,Open,2000630665
Asha Cox,5.0,"Love, love, love Shakey's pizza!!!  And it's like one of the last ones left in the area.",3 years ago,Open,2000630665
Richard Smith,5.0,"Oh my gosh.  Chicken and Mojo's are the best!  Ive been eating here for over 20 years and love the place.  I noticed new owners took over and updated the place.  For the best pizza in Oroville, choose Shakeys!",9 years ago,Open,2000630665
Dimitri's Dream,5.0,BEST FRIED CHXEN AND MOJOS!,2 years ago,Open,2000630665
Christina Kepple,5.0,Very good service and food,a year ago,Open,2000630665
Patrick Dempsey,5.0,Great pizza,a year ago,Open,2000630665
Cody Cudlip,5.0,Mojos are amazing every time,2 years ago,Open,2000630665
Jason wammes,5.0,Good deals,a year ago,Open,2000630665
Don Curtis,4.0,Good  excellent staff. Pizza ok.,2 years ago,Open,2000630665
Jay Ruff,2.0,Wait time was a hour. Severely understaffed. Dirty tables everywhere.,a year ago,Open,2000630665
J. Denise Williams,5.0,Chicken and mojos are the best.,2 years ago,Open,2000630665
Dave Ferris,5.0,Got to love shakey's pizza,2 years ago,Open,2000630665
Jason Rice,5.0,Holding it's reputation,a year ago,Open,2000630665
Cathy Farris,3.0,Service is great but food isn't,2 years ago,Open,2000630665
Casey Webster,5.0,"Good pizza, looks like the whole town is here tonight.",4 years ago,Open,2000630665
Ramon Ruiz,5.0,Very good,a year ago,Open,2000630665
Kris Morris,4.0,"Always a favorite of mine, pizza and mojos I grew up.on...",2 years ago,Open,2000630665
Kimberly Pennington,3.0,"Seems like there just isnt enough room, everyone was bumping i to each other",2 years ago,Open,2000630665
D Terrell,5.0,Best pizza in the world!,a year ago,Open,2000630665
Game Changer,4.0,Shakey's is still my favorite pizza with it's crispy crust and the chicken and Mojo's are a must,2 years ago,Open,2000630665
Linda Lee,5.0,"It brings back
memories of when I brought my son here many years ago.",2 years ago,Open,2000630665
Junior Herrera,3.0,Not really what I thought it would be.,a year ago,Open,2000630665
Arvid Marlette,4.0,Very nice and clean with great staff.,2 years ago,Open,2000630665
Scott Ramsey,5.0,I drove an hour and 45 minutes to eat at Shakeys. I love their pizza and MOJO everything!,4 years ago,Open,2000630665
rita vargas 122,5.0,"fast & friendly service great food,very clean and organized",3 years ago,Open,2000630665
Danny Hight,5.0,Still great pizza and service.,2 years ago,Open,2000630665
Carlos Castle,5.0,This place had a wonderful family atmosphere.,3 years ago,Open,2000630665
sheila mae Arahan,5.0,Would take that trip just to eat there again!,a year ago,Open,2000630665
Kenneth Colwell,5.0,"Best pizza and chicken ever, the loaded Mojo's are amazing!",3 years ago,Open,2000630665
A Bass,5.0,Great Pizza and service! One of the original pizza joints in California established 1975,3 years ago,Open,2000630665
Linda Saevang,1.0,"It said on the website that a medium Shakeys Pizza is $12.99, I called in to make a order and the guy on the phone says ""Those are only prices online"". He tells us that the pizza is $20 and some change for a medium Shakeys pizza …More",4 years ago,Open,2000630665
janet carrasco,1.0,"Well we arrived at 10 pm on a Friday night,  went to order and They told Us they only had 1 pizza left!! Really!! So it was less than 1 star",a year ago,Open,2000630665
David Vick,5.0,Food,2 months ago,Open,2000630665
Eric Nielsen,4.0,Good food and quick service,2 years ago,Open,2000630665
Colin Turner,4.0,The mojos are the best and great pizza great service,3 years ago,Open,2000630665
Summer white,1.0,Tasted ok.  Super thin crust. Just breaks and falls off the bottom. Bad service. Rude.,4 years ago,Open,2000630665
Sarah Gordon,5.0,Excellent Pizza! Fast Service,3 years ago,Open,2000630665
Lex O,5.0,Great 🍕 chicken and mojos !!!,2 years ago,Open,2000630665
Rebecca Wilson,5.0,Love those mojo potatoes!,2 years ago,Open,2000630665
James Gray,3.0,Pizza was moderate! Service was good.,2 years ago,Open,2000630665
Wes Howarth,4.0,Great pizza and mojos,2 years ago,Open,2000630665
Starla Jaquish,4.0,Best pizza parlor in town forever.,3 years ago,Open,2000630665
Clifton Horton,5.0,"Good chicken 🍗, mojos & pizza 🍕",3 years ago,Open,2000630665
-_-,5.0,They have the best sauce in town,2 years ago,Open,2000630665
Shellee,5.0,Always a good trip and good food,2 years ago,Open,2000630665
Michelle Rowe,5.0,Great pizza..... every time!,2 years ago,Open,2000630665
Dillon Daundivier,5.0,Its shaky's...what else is there to say?,a year ago,Open,2000630665
Chakozzo,4.0,Kinda pricy for what it is but good,2 years ago,Open,2000630665
keshia potts,5.0,The FOOD is great!! Love the Mojo's..,4 years ago,Open,2000630665
Brenda Dunham,4.0,Good food and nice enviroment,2 years ago,Open,2000630665
Luis Marquez,4.0,Great pizza and JoJo potatoes,2 years ago,Open,2000630665
Carol Dubovick,2.0,A BIG DISAPPOINTMENT!,a year ago,Open,2000630665
sid nasty,5.0,Great service consistent food,2 years ago,Open,2000630665
Kathy Meek,2.0,The pizza wasn't very good,a year ago,Open,2000630665
Kimberly Piver,5.0,Great pizza,a year ago,Open,2000630665
Jorge Chavez,5.0,I miss Shakeys! There used to be one in San Jose. I came here with my family and it brings so much memories!,4 years ago,Open,2000630665
Michelle Bence,1.0,"The place was dirty, the pizza was hard and the workers were rude.",2 years ago,Open,2000630665
Quinton Taylor,4.0,Fair prices for what you get,2 years ago,Open,2000630665
Mike Berichon,5.0,Mojos are so good,2 years ago,Open,2000630665
connie bradbury,5.0,Great Pizza & Mojo's I give it a 5 star,4 years ago,Open,2000630665
Joseph Velasquez,3.0,Chicken was disgusting,a year ago,Open,2000630665
KJM-TV CLASSIC GOSPEL MUSIC,5.0,Brought back childhood Memories!,a year ago,Open,2000630665
jim sumner,5.0,takes me back 50+  still great! !,5 years ago,Open,2000630665
J G,1.0,Not a Shakey's pizza,8 months ago,Open,2000630665
Keys City,5.0,Awesome,a year ago,Open,2000630665
Olivia G,5.0,Best place ever,2 years ago,Open,2000630665
Luke Saxelby,5.0,Best pizza!!! Wish Sacramento still had one of these!,4 years ago,Open,2000630665
Geoff Barr,5.0,Friendly staff...,a year ago,Open,2000630665
Kyle Nelson,5.0,The best,2 years ago,Open,2000630665
melinda patterson,5.0,Great pizza!,a year ago,Open,2000630665
Ola Scarbrough,5.0,Good Salad Bar,2 years ago,Open,2000630665
LuAnn McCurry,5.0,Very good pizza and the crust was yummy,3 years ago,Open,2000630665
Susan Battjer,5.0,Best fried chicken!! Great pizza!,3 years ago,Open,2000630665
Renee Lemos,3.0,Pricey,a year ago,Open,2000630665
Evelyn Rodriguez,3.0,Nice good for bdays pizza too small!,3 years ago,Open,2000630665
Robert M Ross,5.0,"Very tasty, and good service.",3 years ago,Open,2000630665
jeannette arellano-rugg,2.0,Not impressed. Customer service needs some improvement.,2 years ago,Open,2000630665
Alice Kabati,4.0,nice pizza and mojo's,2 years ago,Open,2000630665
Ann Drea Vasquez,5.0,Amazing!!,a year ago,Open,2000630665
Loretta Geisler,5.0,Seems like old times.,2 years ago,Open,2000630665
Michele Vantassel,5.0,Best pizza,a year ago,Open,2000630665
Todd Balassi,4.0,"Love the pizza, employees are friendly",3 years ago,Open,2000630665
Petra Pena,5.0,Foods great!,a year ago,Open,2000630665
Em Jorgensen,1.0,Horribly transphobic personnel,a year ago,Open,2000630665
My_lovely_life_530,5.0,Best pizza ever!,2 years ago,Open,2000630665
