name,stars,text,timeSince,openStatus,key
Nikki E,1.0,Waaaaaaaaaaaaaaaaaaaaaay too expensive! Everything in there cost too much! And to get a refund u have to call corporate. Not cool....,2 years ago,Closed,1000884390
Trisha Doudou,1.0,"3:30pm on Friday: The only friendly staff member was the girl that brought the pizza out. Girl at the door, who stamps your hands,  didn't say one word to us.  We were the only people in line. She then acted like it was an inconvenience to …More",2 years ago,Closed,1000884390
Stella Dobson,3.0,The games aren't really worth the money,a year ago,Closed,1000884390
Angela Gooden,3.0,Had fun with the kids,a year ago,Closed,1000884390
abby wilder,3.0,The  ceiling was leaking. Where every body Could see it.. and needs to be cleaned.. and there is wait on food when you order it.  And not many prize selection. For the low points.,2 years ago,Closed,1000884390
Jahnecia Morris,5.0,Great time just a lot of older kids nothing really a 1 year old can do,2 years ago,Closed,1000884390
Destiny Meatchem,4.0,Very pricey but the kids loved it. Prices ridiculous high though,2 years ago,Closed,1000884390
Mark Johansing,3.0,"Fun for kids and adults, but a bit in the expensive side",2 years ago,Closed,1000884390
Linda Scheidt,3.0,Salad bar had brown lettuce food cold.  Pricey and run down.  Needs some work.,2 years ago,Closed,1000884390
Andrew Kramer,5.0,"Nice workers, nice managers, good food and overall a nice place for kids and adults 😁",2 years ago,Closed,1000884390
Sandra Ambrose,4.0,They have upgraded the experience here and it was a lot different from one year ago and the kids loved it.,3 years ago,Closed,1000884390
Frances Willis,5.0,Fun place for kids but it's not like it use to be when I was a kid,2 years ago,Closed,1000884390
Just Peachy,3.0,They took out the tunnels and there is nothing but games. Once the kids run out money on their cards there is nothing else for them to do but ran back and forth taking up space an in the way of the other kids who has money. Chuck e cheese …More,3 years ago,Closed,1000884390
Cee Wynn,3.0,Great Host at the time of Birthday party.,2 years ago,Closed,1000884390
unicorn squad,2.0,"The girls were RUDE & act like it killed um to wait on you!! My g-daughter..comes in & says ""its my birthday"", your worker says --- NOTHING!!!!  Rude & inconsiderate!!",2 years ago,Closed,1000884390
Jon TEK,5.0,My children enjoy it,a year ago,Closed,1000884390
Lisa Smith,1.0,"HORRIBLE! Through a private party for my grandson, we were the first people there that day in the place was a mess! Even the parking lot was a mess! There is food in the MACHINES , the people working were horrible oh, the cake we bought from there was horrible and looked horrible! If I could give this place and -20 Stars I would",2 years ago,Closed,1000884390
R. J. Denicola,4.0,"Some Machines didn't work, but over all the kids had a great time.",3 years ago,Closed,1000884390
MsMary Harrison,5.0,Great place for small children. My great-grandchild had a Ball dancing with Chucky Cheese.,3 years ago,Closed,1000884390
rhonda crawford,2.0,Half of the games wasn't working.no one to fix them ..No chicken with bones no fries.boneless wings was small like chicken nuggets,a year ago,Closed,1000884390
John Banks,3.0,"Pizza was tasty but customer service was terrible.  Customer in front of me placed order, left, then the cashier left too.  Stood there for ten minutes before someone else came up.
Kids enjoyed the experience though.",4 years ago,Closed,1000884390
Twin T Z 2015 GT,5.0,"Great time, everything went like it should have.",2 years ago,Closed,1000884390
JACQUELINE Davis,5.0,My kids had a lot of fun. But would be nice if they got a ball pit.,4 years ago,Closed,1000884390
Darlene Eiler,5.0,Fun place for the children to go...has a few more adult items on the menu besides just pizza...,3 years ago,Closed,1000884390
Angel Pasour,3.0,It was a little dirty some games were broken and the ticket munchery was also broke,a year ago,Closed,1000884390
Luis Perez,1.0,Probably the worst customer service ever. Not doing this location ever again.,2 years ago,Closed,1000884390
Rickey Pryor,1.0,Don't know if its for kids or grown ups,a year ago,Closed,1000884390
Alyse Richardson,5.0,Good place for a stress free birthday party,2 years ago,Closed,1000884390
Brian Bays,3.0,"place upgraded toys and games, BUT still needs some attention on cleanliness",3 years ago,Closed,1000884390
Michael Wagner,5.0,"Chuck E. Cheese is great! First, you don't have to worry about your kids, you get matching bracelets. They won't get out without you. Pizza is great and they have beer. The stage shows rock, but you'll watch them with the rest of the …More",2 years ago,Closed,1000884390
Darlene Combs,4.0,Great for kids not good adult food,2 years ago,Closed,1000884390
Lakyria Evans,5.0,Funny how it seems like Chuck e Cheese has the best pizza.,2 years ago,Closed,1000884390
Mike D.,2.0,Kids of less than 3 years will find almost no games of their age to play with,4 years ago,Closed,1000884390
Ali Meister,1.0,Disgusting... the bathrooms were nasty some of the games were out of order but had no sign on them so we got ripped off of tokens... there were bugs all around the pop despensers... even found 4 bugs in 1 of our drinks and all the lady at …More,4 years ago,Closed,1000884390
Steven Caudill,4.0,Kinda dirty but it is very very busy. They try to keep up. Good food,4 years ago,Closed,1000884390
Jason Francis,5.0,Very friendly and great service the pizza was delicious and it's great place to sit each and the kids have fun even big kids it's a great baby sitter,4 years ago,Closed,1000884390
Alex Bennett,4.0,"Chuck E. Cheese is still a decent bargain for little kids and parents. Customer service and security are good. Of course, the facilities could certainly use upgrades, especially the carpet and the animatronic band, which I understand are …More",3 years ago,Closed,1000884390
Maleisa Lee,3.0,The taste of the pizza was very good and the place was clean. But they are way too expensive.,3 years ago,Closed,1000884390
Tina Vaughn,1.0,Stood at the register for aprox 10 mins and wasn't even acknowledged by two workers the worker who finally waited on me was the manager and when I mentioned my wait rather than being apologetic she was rude. Also paid $20 for 2 lunch salad bars and 2 sodas!,3 years ago,Closed,1000884390
Bots Advertisment,5.0,At my grandson's birthday party and lots of fun was a little expensive,2 years ago,Closed,1000884390
Marvin,4.0,It gets the kids out of your hairs. The pizza is decent,3 years ago,Closed,1000884390
Erica S,3.0,Crew working was rude to each other but nice to me and family.,a year ago,Closed,1000884390
Dornisha Graves,4.0,The people was very friendly.. And the place was very clean.,a year ago,Closed,1000884390
Steve Richeson,2.0,"Friendly staff. We were the only ones there and the place was very very dirty
Didn't eat just played games.",a year ago,Closed,1000884390
Tiffiny Brownlow,3.0,Great for kids....,a year ago,Closed,1000884390
Jeremy Roark,4.0,Good place for kids had a birthday party there when I was a kid and my son had a birthday party there,4 years ago,Closed,1000884390
RooRoo,3.0,"Pizza was good, but there were several broken games and the staff was a little less than attentive.",3 years ago,Closed,1000884390
T Combs,4.0,"Clean, great pizza, helpful staff.",a year ago,Closed,1000884390
The African Couponer,5.0,Fun place for kids. But have not been ever since they changed from tokens to card system,3 years ago,Closed,1000884390
Marlena Goss,4.0,Alright games don't give tickets right.,a year ago,Closed,1000884390
Rachel Asbury,5.0,My grandkids had a wonderful day there,2 years ago,Closed,1000884390
Kay Kenny,1.0,"The worse experience ever! 80's Chuck E Cheese is gone. That's when it was about the kids and experience as a family. Now it's filth and workers who do not care about what it looks like, good service, let lone the kids. Will never return. If I could give no stars I would",2 years ago,Closed,1000884390
judy thomas,2.0,This place is always dirty. Kids use hands their hands to get to things off the salad bar.,2 years ago,Closed,1000884390
Debrah Evans,5.0,Love it  great place for the kids,a year ago,Closed,1000884390
Shirley Harris,5.0,Because of the madna or early show,a year ago,Closed,1000884390
Keiuna Talley,1.0,The worst experience.  I didnt even het my pizza and in order to get a refund i had to call a 1800 number this place sucks,2 years ago,Closed,1000884390
Jarrett McWhorter,1.0,"Grew up in Colerain. The place has gone downhill! Trash scattered throughout the property. We seen dirty diapers on the side walk as we walked in. Told management about the diapers and trash, they sent someone out and picked up one of two diapers and no trash...",3 years ago,Closed,1000884390
Teresa Bryant,4.0,The kids had big fun!,2 years ago,Closed,1000884390
Roderick Maxwell,5.0,Great place to keep the kids entertained!,2 years ago,Closed,1000884390
Dawn Garrett,1.0,It was the worst experience I have ever had and it was at the colerain chuckie cheese,2 years ago,Closed,1000884390
Tamieka Brown,3.0,Make sure you tell them you want to purchase tokens and not minutes,a year ago,Closed,1000884390
Jojo Jones,5.0,I Love Chuck E . Chees ...,2 years ago,Closed,1000884390
Ryan Amison,4.0,They are really nice and helpful when needed,2 years ago,Closed,1000884390
Dee Dee,2.0,Over rated and too expensive. The food is too bland.,2 years ago,Closed,1000884390
Haneezzyyy Sandoval,4.0,been going here for years for all my four kids birthdays,a year ago,Closed,1000884390
Mandee Hutchens,5.0,Great staff! Friendly people. Plan on returning,3 years ago,Closed,1000884390
Delmar Thompkins,5.0,My kids loved it,a year ago,Closed,1000884390
Shevaun Fox/Kilgore,5.0,Had a great time❤😊,2 years ago,Closed,1000884390
Judah S,3.0,"Great fun for kids, but crowded often. Sometimes can be dirty and you can always count on a bunch of the games being out of service.",4 years ago,Closed,1000884390
Tiffany Stallwell,4.0,My son loves it and prices are good,2 years ago,Closed,1000884390
Bethany Goldsberry,4.0,"Staff was very helpful and professional, food was ok I gave it 4 stars because they need more video games and the cake I bought through them was stale and dry.",2 years ago,Closed,1000884390
Cindy Lynn,5.0,Great Place Too Go. Very Friendly.,3 years ago,Closed,1000884390
Mahogany DuBose,1.0,The roof is leaking where the kids are playing. The staff is rude and it is very dirty in this place.,2 years ago,Closed,1000884390
Katie Isenbergg,5.0,Very friendly people. My child had a blast!,3 years ago,Closed,1000884390
Messlia Sorrell,1.0,This place was a joke..... I wont be back.....customer service was a joke.... no one bothered to clean the tables at all....and half of the machines didnt work.... very disappointed.....,3 years ago,Closed,1000884390
Alicia Gooden,5.0,Awesome place for kid's they enjoyed it,2 years ago,Closed,1000884390
Nicole Marksberry,5.0,Kids had a blast,a year ago,Closed,1000884390
michelle akins,4.0,My JJ's had a ball.,a year ago,Closed,1000884390
Dynamic Nutrition And Personal Training,3.0,My daughter liked it,a year ago,Closed,1000884390
Jennifer Miller,5.0,Babies had a blast,a year ago,Closed,1000884390
Candice Phillips,4.0,The pizza is delicious..,2 years ago,Closed,1000884390
Tabatha Davis,5.0,Clean good workers and friendly,2 years ago,Closed,1000884390
D. M.,4.0,Good pizza and salad bar.,2 years ago,Closed,1000884390
austin haley,3.0,"Service was OK  typical
The outside needs some trash cleaning up",3 years ago,Closed,1000884390
Cindy Emmons,5.0,Best place for kids..,2 years ago,Closed,1000884390
Francine Williams,5.0,My kids love being there,2 years ago,Closed,1000884390
Sean Casebolt,1.0,Extremely slow and not friendly at all. Will not be returning,2 years ago,Closed,1000884390
flameyola lava godd,5.0,Nice place fun fr kids,2 years ago,Closed,1000884390
Mekkah J,1.0,MOST TERRIBLE SERVICE EVER!!!!!!! IF YOU WANT YOUR TIME & MONEY WASTED COME HERE!!!!!,2 years ago,Closed,1000884390
Matt,2.0,"Lots for the kids to do, clean, but arrived one hour before close and we were told that the kitchen closes an hour before the store does, so we were refused service for any food..... Basically was a game room for the kids for an hour.",2 years ago,Closed,1000884390
Jaylan Williams,1.0,Threw our pizza away and didn’t refund or even give us pizzas in return and to start it off gave our first three pizzas to the wrong party!,a year ago,Closed,1000884390
Rohann figgs,5.0,Kids can have a good time,2 years ago,Closed,1000884390
Marie Jensen,5.0,Fun for the kids,a year ago,Closed,1000884390
christine mengel,5.0,Nice place for kids indor,2 years ago,Closed,1000884390
Tee Chanel,1.0,Always very crowded and understaffed. The games are always out of order or just not working and it takes 20 minutes to get someone to assist you with anything. The ticket redemption machines NEVER work and  there is always 1 person working …More,3 years ago,Closed,1000884390
Dj Hill,1.0,The staff is rude and lazy and the security guard is rude!!! It was dirty there was garbidge on the tables an the drink area was dirty! We will never ever be back to any chuck e cheese,2 years ago,Closed,1000884390
Miriam Ort,1.0,"Unorganized, bad service, the staff is rude. The food was two hours late! After one of the staff members told me to take my cheese pizza when it was ready, and I did, someone else came to my table to blame me that the server was running …More",2 years ago,Closed,1000884390
crischelle kinney,1.0,"Terrible service from the manager Suzanne and staff, filthy environment, no ice in the machine. Disgusting",3 years ago,Closed,1000884390
kim kite,5.0,Great time with the grandkids!👍,3 years ago,Closed,1000884390
Fernida Dye,4.0,The salad bar is good!,2 years ago,Closed,1000884390
Misteen Marshall,1.0,The female workers were more worried about how they look in the bathroom mirror then how messy the whole bathroom was.,2 years ago,Closed,1000884390
Gerald Anderson,4.0,Decent,a year ago,Closed,1000884390
Ms Patrice,3.0,"Honestly havent been to this one in so long.. Was going to plan my son's party there.., but lets just say i wasn't comfortable",3 years ago,Closed,1000884390
Mohsen Alajmi,4.0,Nice place,2 years ago,Closed,1000884390
Terence Turner,4.0,Cool place for kids,2 years ago,Closed,1000884390
kandi love,5.0,Had a great time there,2 years ago,Closed,1000884390
TDIZZLE 87,3.0,Watch out for the recycled pizza,a year ago,Closed,1000884390
Diana Rininger,5.0,Kids love it,a year ago,Closed,1000884390
Julie Brazile,4.0,Nice place for kids,a year ago,Closed,1000884390
Rebecca Abdallah,1.0,Pizza was awful 😭,a year ago,Closed,1000884390
Jeff Hicks,4.0,Kids love it,2 years ago,Closed,1000884390
Carliss Smith,5.0,Grandkids  really enjoyed  this awesome place,3 years ago,Closed,1000884390
Jason Bryant,5.0,Loved it,a year ago,Closed,1000884390
Felicia Cook,5.0,NICE place......,2 years ago,Closed,1000884390
Deion Holts,3.0,Nice variety of games Bt overpriced to play,3 years ago,Closed,1000884390
Zack Byrd,1.0,Reused pizza,a year ago,Closed,1000884390
Larisha Baines,1.0,Rude my order was not placed and when it was it was a mess brought back a new one and that took for ever only to bring it out when we are headed out the door they have went down hill,3 years ago,Closed,1000884390
Michael Todd,3.0,It's definitely not what it used to be at all,3 years ago,Closed,1000884390
John Bond,3.0,"Pizza was OK, but took as long to get attention at the counter for a drink.  Place looked OK, though.",3 years ago,Closed,1000884390
Ali Mader,3.0,Expensive AF but the kids liked it.,2 years ago,Closed,1000884390
Brad McGaha,1.0,Took over an hour to get our food which was cold when it got to the table and the manager Dan was extremely rude to my fiance I will never return to this location again,2 years ago,Closed,1000884390
Holly Adkins,1.0,Zero this place sucks poor customer service and is so trashy the bathrooms were foul and it took 2 hours to get our food because it got stolen lmao don't recommend this place,2 years ago,Closed,1000884390
Nicole Coleman,5.0,Family fun always,2 years ago,Closed,1000884390
Cleotha Byrd,4.0,Nice employees,2 years ago,Closed,1000884390
nursenana banana,2.0,Sevice was awful pizza was gross rude staff,2 years ago,Closed,1000884390
Tom Schuler,5.0,The kids loved it,2 years ago,Closed,1000884390
The Bullock Way,5.0,Very Friendly,a year ago,Closed,1000884390
T Sturgill,3.0,Ok,a year ago,Closed,1000884390
Yvette Mckines,5.0,Chuck e cheese 👍,a year ago,Closed,1000884390
Thomas Rigginseeopllw,5.0,Family fun,a year ago,Closed,1000884390
Jerry Adams,3.0,Staff was nice.Service was SLOW.,2 years ago,Closed,1000884390
Chad Gibson,5.0,Great family place,2 years ago,Closed,1000884390
Nicole Hampton,1.0,The manager Daniel was super disrespectful during the party.,2 years ago,Closed,1000884390
alicia carter,4.0,I like this place more than my child 😂,2 years ago,Closed,1000884390
Jacque Remias,4.0,Grandson loves the machines,2 years ago,Closed,1000884390
Tiffany,2.0,"It was entirely too crowded, the place was dirty,  and not enough staff",2 years ago,Closed,1000884390
Jason Stephens,1.0,Extremely dirty. Carpet needs cleaned and all games.,3 years ago,Closed,1000884390
Carla Myers,3.0,Not so much for little little children anymore.,2 years ago,Closed,1000884390
Emily Ann,5.0,Great staff,a year ago,Closed,1000884390
Ray Robinson,5.0,Grade A pizza.,a year ago,Closed,1000884390
William Staulters,2.0,Over priced and lots of rude kids haha,3 years ago,Closed,1000884390
Elaine Bennett,3.0,"Team very rude, not a good experience will not return",2 years ago,Closed,1000884390
andrew opp,4.0,Good family fun,2 years ago,Closed,1000884390
Desi Stewart,2.0,Food to high,a year ago,Closed,1000884390
Nichole Moore,1.0,This place screams ghetto and rude employees!!!!!!!!,a year ago,Closed,1000884390
sakinah lewis,5.0,it was nice,a year ago,Closed,1000884390
Cmoore J.R,3.0,Its ok,2 years ago,Closed,1000884390
Logan Halas,1.0,Bad service,2 years ago,Closed,1000884390
Michael Evans,4.0,Nice place,2 years ago,Closed,1000884390
MoMMaof 2sillygirls,3.0,Was ok,a year ago,Closed,1000884390
Vicky B,3.0,Something for the kids to do,2 years ago,Closed,1000884390
D. T-831,5.0,Fun for everyone,2 years ago,Closed,1000884390
• AppleSauce •,1.0,THE CLAW WAS SO LOOSE I GOT EVERY COLOR BALL AND IT WOULDN'T GIVE IT TO ME IT'S A TOTAL SCAM,2 years ago,Closed,1000884390
Cinthia Belanger,3.0,Unorganized!!,2 years ago,Closed,1000884390
Amber Leary,4.0,Fun for the kids,2 years ago,Closed,1000884390
Courtney Watkins,2.0,Not enough staff,2 years ago,Closed,1000884390
Emanuel Howard,5.0,Nice,2 years ago,Closed,1000884390
Tonice Gray,2.0,Needs to upgrade the characters in stage,2 years ago,Closed,1000884390
Nick Murphy,4.0,Fun n pizza,2 years ago,Closed,1000884390
Angelique Lanier,3.0,There wasn't ice in the soda dispenser. The wasn't enough staff so the wait for food was  an hour. The staff was friendly yet overworked and people were yelling at them.,2 years ago,Closed,1000884390
Twisted Playgrounds,5.0,Kids had fun,2 years ago,Closed,1000884390
Kara Carr,1.0,Pizza nasty,2 years ago,Closed,1000884390
Jennifer Fugate,1.0,Terrible service. Games were broken. Place was filthy. I will NOT be returning.,2 years ago,Closed,1000884390
Aaron Meyer,5.0,Fun good food,2 years ago,Closed,1000884390
Steve Wilcox,3.0,Some guest can be rude and inconsiderate.,3 years ago,Closed,1000884390
Kk Mommy,1.0,People spit in the tubes ewww😡😡,2 years ago,Closed,1000884390
Kiara Henderson,1.0,Rude incompetent managers,3 years ago,Closed,1000884390
Antoine Holliday,3.0,Just about what you would expect.,2 years ago,Closed,1000884390
BrownSkin Queen,5.0,Loved it my children had fun,3 years ago,Closed,1000884390
Ron Jones,1.0,Lots of fights,3 years ago,Closed,1000884390
Bryan Keller,5.0,A good clean environment,2 years ago,Closed,1000884390
Leonna Larkins,5.0,Very enjoyable,3 years ago,Closed,1000884390
Dee tierney,5.0,Friendly staff and clean for a bunch of kids running around,3 years ago,Closed,1000884390
Mary Martin,1.0,It was my first time there it was okay but the pizza was too small,2 years ago,Closed,1000884390
Adriana Prieto Quintero,5.0,Nice place for kids!,2 years ago,Closed,1000884390
Tamela Brown,1.0,Horrible place,2 years ago,Closed,1000884390
Napata Mero,1.0,This place is AWFUL!!!!...DIRTY...NASTY TERRIBLE SERVICE...NO ICE AND THE DAMN SEAT JUST COLLAPSED..THIS WILL BE OUR VERY LAST TRIP TO TRASHY CHEESE..,3 years ago,Closed,1000884390
Matt Dennler,3.0,Shorty service,2 years ago,Closed,1000884390
Kimberly Al-Ajmi,2.0,Just ok.,2 years ago,Closed,1000884390
Kimiko Burks,5.0,Good pizza,2 years ago,Closed,1000884390
andrew munlin,3.0,A little run down.,2 years ago,Closed,1000884390
Dispatch,4.0,Great for kids,3 years ago,Closed,1000884390
Melanie Reese,3.0,Was way cooler when i was 5,3 years ago,Closed,1000884390
Tatiana Milan,3.0,Bad service,3 years ago,Closed,1000884390
Cornelius Spikes,1.0,"Dirty, stinks, horrible service, and over priced. Never thought I would see the day when chuck E. Cheese would need police officers working security. Horrible place to take your children. Not what it once was. Would give zero stars if I could.",3 years ago,Closed,1000884390
Aubrey Miller,5.0,Kids enjoyed themselves,3 years ago,Closed,1000884390
Lisa Whitehead,1.0,One hour later and still no pizza,3 years ago,Closed,1000884390
Luwanda Mackey,5.0,Fun,3 years ago,Closed,1000884390
Trung Du,1.0,Bummer,4 years ago,Closed,1000884390
Anna Lattin,3.0,not very clean...,3 years ago,Closed,1000884390
Jeff Almond,5.0,Awesome for family and friends,3 years ago,Closed,1000884390
"Kenya, Like The Country",3.0,Fun for the kids!,3 years ago,Closed,1000884390
Lisa Marie Reynolds Presley,1.0,This place is ghetto as hell. Save your money,3 years ago,Closed,1000884390
Nikolai Berenzenov,1.0,Poo,3 years ago,Closed,1000884390
Joslin Martin,5.0,It wonderful,3 years ago,Closed,1000884390
Keith Mueller,1.0,Ghetto. Dirty. Robotic band is falling apart. Greasy food. They didn't even check the hand stamps with my child and I when leaving.,3 years ago,Closed,1000884390
tammy sicker,5.0,Best birthday party,4 years ago,Closed,1000884390
Shaik Abdullah,4.0,Nice palace,4 years ago,Closed,1000884390
D S,3.0,Dirty and poorly maintained,4 years ago,Closed,1000884390
Tony Hill,2.0,Very poor service,4 years ago,Closed,1000884390
Jahlontae Davis,5.0,Be cause it's fun,4 years ago,Closed,1000884390
Dustin Hughes,1.0,It takes two hours to get your order half of the games don't give you tickets and some of the staff seemed rude,4 years ago,Closed,1000884390
Jennifer Smith,1.0,Amy is really rude and condescending. Not sure how she still has a job.,5 years ago,Closed,1000884390
Bob Adkins,1.0,Service was slow the kids didn't get there icecream. My son didn't get his shirt and they didn't bring the pinata out until we was leaving. Then they tried to rip us off on my sons tickets,5 years ago,Closed,1000884390
Sharrieff,4.0,My daughter loves it.,5 years ago,Closed,1000884390
Mikel Bates,5.0,Lovely!,6 years ago,Closed,1000884390
MELISSA WINTERS,3.0,It's fun,5 years ago,Closed,1000884390
Veronica Halloway,4.0,You helped me spOrt,7 years ago,Closed,1000884390
Alondra Arce,4.0,"(Translated by Google) It is a good place to be with family

(Original) …More",a year ago,Closed,1000884390
Esdras Diaz,5.0,"(Translated by Google) I like very much

(Original)
Me gusta mucho",3 years ago,Closed,1000884390
Richard Beck,2.0,"(Translated by Google) It was a nitenare

(Original)
It was a nitenare",2 years ago,Closed,1000884390
Nelvia Zelaya,5.0,"(Translated by Google) Hi

(Original)
Hola",3 years ago,Closed,1000884390
Mike Williams,4.0,,a year ago,Closed,1000884390
Lady In red,5.0,,2 years ago,Closed,1000884390
Barbara Smittie,2.0,,a year ago,Closed,1000884390
Teara Shavers,5.0,,3 years ago,Closed,1000884390
Kimberly Poellnitz,5.0,,4 years ago,Closed,1000884390
Ajay Kumar,5.0,,5 years ago,Closed,1000884390
Tamara Griffin,4.0,,a year ago,Closed,1000884390
Ray Curtis,5.0,,2 years ago,Closed,1000884390
Jim Neuburger,4.0,,a year ago,Closed,1000884390
Elracio Hill,5.0,,2 years ago,Closed,1000884390
Drew Staudigel,4.0,,2 years ago,Closed,1000884390
Halena Price,4.0,,2 years ago,Closed,1000884390
David Mcelroy,3.0,,a year ago,Closed,1000884390
Isabella Lara,5.0,,a year ago,Closed,1000884390
Anthony Collins,3.0,,3 years ago,Closed,1000884390
Mykail Jackson,4.0,,a year ago,Closed,1000884390
mary lame,5.0,,2 years ago,Closed,1000884390
Joe Kirschner,1.0,,2 years ago,Closed,1000884390
James Clayton,3.0,,3 years ago,Closed,1000884390
Shalena Alexander,5.0,,a year ago,Closed,1000884390
Carrie Johnson,4.0,,2 years ago,Closed,1000884390
becky Phillips,3.0,,a year ago,Closed,1000884390
B Royalty,5.0,,a year ago,Closed,1000884390
A W,5.0,,a year ago,Closed,1000884390
Mark Dupree,3.0,,a year ago,Closed,1000884390
project zorgo member project zorgo member,2.0,,2 years ago,Closed,1000884390
fortnite thor Banks,5.0,,2 years ago,Closed,1000884390
Jαmes Corbett Brock,4.0,,a year ago,Closed,1000884390
Jacqueline Ward,4.0,,a year ago,Closed,1000884390
Lelei_Babi,5.0,,a year ago,Closed,1000884390
Ash Jones,4.0,,2 years ago,Closed,1000884390
charles chinnati,5.0,,3 years ago,Closed,1000884390
Natasha Wever,5.0,,a year ago,Closed,1000884390
Nicole Pitts,1.0,,a year ago,Closed,1000884390
Clarianne Hayes,2.0,,a year ago,Closed,1000884390
Scott Griffith,1.0,,2 years ago,Closed,1000884390
K Shamel,5.0,,a year ago,Closed,1000884390
THE WE CAN KIDS Castleberry Boy,5.0,,2 years ago,Closed,1000884390
J Hunter,4.0,,2 years ago,Closed,1000884390
Travis Wolf,4.0,,2 years ago,Closed,1000884390
Carlos Garcia,5.0,,3 years ago,Closed,1000884390
Arvel Hall,3.0,,2 years ago,Closed,1000884390
Brandi Leary,3.0,,3 years ago,Closed,1000884390
Jessica Edlin,4.0,,a year ago,Closed,1000884390
