name,stars,text,timeSince,openStatus,key
Nathan Rogers,5.0,"Great pizza at a good price, and any toppings you want. The staff were super friendly and helped me make a pizza just how I wanted with toppings and sauces. They have a variety of crusts available including pan pizza for extra cost.",2 months ago,Open,2000746806
Gabrielle Harris,5.0,"Tried the Cauliflower pizza crust with Chicken, basil, mushrooms, feta cheese, olives, banana peppers, sun dried tomatoes and onions🤗! Delicious and good for you too!!",a year ago,Open,2000746806
Le White,2.0,Pizza was less than ok. The toppings kept falling off due to a little amount of cheese. Customer service was great which helped with the review. Would not order again.,3 weeks ago,Open,2000746806
Torion Meekins,5.0,Love how we get to pick out own toppings and out it comes out of the oven quick and good.,a week ago,Open,2000746806
Sweet Epiphany,5.0,Great gluten-free pizza crust. Definitely recommend for those who have a GF diet. Just remember to let them know that is is for an allergy.,a month ago,Open,2000746806
Natasha Shaty,3.0,"3 people working, and they did not have a flow. Took almost 30 mins from the time we walked in there to when we got the pizzas. Two workers were very polite. The other worker's mask was not covering their nose, it was barely covering her …More",2 months ago,Open,2000746806
Adam Siek,5.0,"Wow, normally I don't write reviews but this time I felt I had to. So I have issues with gluten for a while now and most things don't bother me but I kinda miss.  Here they have a gluten free crust that is really good crispy through out. …More",10 months ago,Open,2000746806
Night Owl,1.0,"Bad Customer Service, unfortunately I had a Bad experience with one of the Employees here, Nataly, I understand there are regulations, but the way she expressed her self was not Professional, I believe there are some things she needs to work on. I hope no one else has to go through this experience. I would not Recommend this Location",a month ago,Open,2000746806
Daniel Cho,5.0,"Super friendly staff and great pizza!
This is one of the best Pieology locations I've ever been to.
Highly recommended",4 months ago,Open,2000746806
pebble person,3.0,The place is great and good food. Although I suggest lowering the music inside because I and others are of hard of hearing and can barely hear with wearing the mask and music.,2 months ago,Open,2000746806
Elliott Thompson,2.0,I ordered a via phone and when I picked up at the given time they haven't even started my pizza it was a regular specialty pizza not only that the manager was very rude,3 months ago,Open,2000746806
Ceyla Soto-Wade,5.0,"I really like the fact that I can choose how I want my pizza. An example: I chose thin crust, with white sauce, 4 types of cheese, artichoke, garlic, spinach, and mushrooms. And I loved it!",a year ago,Open,2000746806
Jessica Ax,4.0,Consistent pizza experience at this location. Easy to see all of your topping options and create your own combination. We typically order a family meal deal to keep everyone happy which includes 3 Artisan thin crust pizzas and a dessert …More,9 months ago,Open,2000746806
Alexander Cortes,1.0,Vsegvfthendksjajdisjdnsj benson’🙁😒😗😏😏😙😕😕🙁🙁😗🙁😗☹️🙃🙁😟🙂  😚🤩🤪mdjdjdjsj&:728;7;8:&;,2 months ago,Open,2000746806
Fred Arroyo,1.0,Very unprofessional how they turn of service at 10:30pm yet they say they are open until 11:00. I drove out here only to be disappointed. Please update your hours or stay open until you say you will be open. Or check your employees that they don't try to skip out early.,6 days ago,Open,2000746806
Pierre Jacinto,5.0,"Fine service,optimal flavorful taste. The artisan crust,hearty wheat was exceptional. I added pesto green sauce with spicy couture sausage😋",7 months ago,Open,2000746806
betzabe bojorquez,1.0,I usually go in and dine and the pizzas are great. Today I ordered online and the 4 pizzas I ordered were not great to say the least. One was burnt and the rest were hard to chew. Very little cheese that some slices had nothing on them. Worst Pieology pizza I’ve ever had.,6 months ago,Open,2000746806
Tereasa Tucker,5.0,Pieology makes this vegan very happy. I love being able to enjoy pizza.,5 months ago,Open,2000746806
Jason Ax,4.0,Food is pretty good. Mod Pizza is better in my opinion. Pieology doesn't cook the toppings very well.  They have a family special of 3 pizzas and 1 desert pizza for $24.99,3 years ago,Open,2000746806
SHALEECE LUSHAY,5.0,Perfect pizza your way!!!!!!!!!!!!! Awesome sauce I come here a lotttttttttt,a week ago,Open,2000746806
Yvonne Elizondo,4.0,You can order in advance and pick up. Great salads and pizza,5 months ago,Open,2000746806
Mr.O,5.0,Pizza and service are good. Nice and clean,a year ago,Open,2000746806
John Hale,1.0,Isiah failed to provide enough cheese on the pizza and failed to ask if I wanted any other types of cheese. The vegetable girl had to help me with Isaiah's failure.,4 months ago,Open,2000746806
Debora Lapham,3.0,Packed because it just opened. Delicious pizzas that you can order off the menu or make yourself. Gluten free crust is available as well as wheat and original. Topping are varied and choice of sauces as well. …More,a year ago,Open,2000746806
Michelle Warren,5.0,The service was great and clean. The girl zelda that helped us was very nice with everything and very polite. Great customer service. Love this place.,a year ago,Open,2000746806
Mitsue Roldan,5.0,"Our first time having Pieology and it was great! Way better than we anticipated, my husband had the Cauliflower crust and I had the Artisan, both were so good! The service was good and the employees were friendly, inside was clean and cool …More",a year ago,Open,2000746806
Haise Sasaki,1.0,"Horrible service from an employee called Nataly we always ask for extra ingredients and the other employees say yes but she's the only one that says that we can't, like we aren't going to pay here extra 😕  horrible don't recommend to nobody",a month ago,Open,2000746806
Jester Uknown,1.0,Ordered off of Postmates and bought two pizzas and garlic bread spent 30 dollars waited an hour for delivery and only got one pizza and 2 garlic breads then tried to call to get order fixed and no answer!,4 months ago,Open,2000746806
Denise Adams,5.0,Service was great and food is always a treat!,4 months ago,Open,2000746806
Chad,4.0,Pretty good!!  Customer service could use some improvement though.,5 months ago,Open,2000746806
Carlos Leonor,5.0,Fast clean very good pizza both thick and pierise crust.,a year ago,Open,2000746806
Amia Henderson,5.0,"I went into this location a couple days ago and I am never disappointed with the service. Thank you so much to Candice (I hope I spelled her name right :) ) my cauliflower pizza was delicious, made just how I asked and the customer service …More",a year ago,Open,2000746806
Daniel Prickett,5.0,Great place for a personalized pizza! I love the pie rise crust.,10 months ago,Open,2000746806
Noname Jones,1.0,"Today I recently bought a VEGAN pizza.
Gluten free crust and the regular house red sauce with lots of vegetables.
When they gave me the pizza they did not show me how it looked and just handed …More",a year ago,Open,2000746806
Oscar G.,1.0,An employee (woman) there just screamed at me ... I couldn't understand what she was saying over the music and the mask that we have to wear... she went overboard (almost hysterical) to stay behind a stupid green line in the floor....poor service to a repited customer.,6 months ago,Open,2000746806
Fabiola Preciado,5.0,Pizza very Good.....Clean and pleasant.....,a year ago,Open,2000746806
cres ramos,5.0,Delicious pizza and the churro pizza was the best,10 months ago,Open,2000746806
J Steele,2.0,"So we tried Pieology the other night.. Having had MOD, Blaze and a few other ""fast"" pizza places, it seemed like a worthwhile one to add to the list. At least locally, I've been to other locations. …More",3 years ago,Open,2000746806
Clau Reyes,1.0,The  only think I like about  this place is that is a new building and their David's cookies are really good.  I didn't like anything else about this Pizzeria.,10 months ago,Open,2000746806
Rob Peecher,4.0,Traditional pizza made while you wait - what's not to like 😁 had some overcooked pizza - they we're busy so I understand if things back up - replaced and credited with a smile. Worth the stop good crew.,a year ago,Open,2000746806
Jessica Duke,5.0,The pizza was delicious and for what you get the price was really good. I got 2 pizzas and 2 sodas for less than 30,9 months ago,Open,2000746806
Jeanette Huelskamp,4.0,First time to eat here.. Definitely coming back👍👍,9 months ago,Open,2000746806
lisa thomas,4.0,"Love that you are get deep dish and personalize pizza. Friendly staff, a little on the pricey side.",a year ago,Open,2000746806
William Eddens,5.0,Delicious personal (slightly bigger) size pizza.  Designed to your taste of toppings,a year ago,Open,2000746806
Daniel Torres,5.0,The staff was friendly and the pizza was delicious.,10 months ago,Open,2000746806
Manny Colergo,4.0,So delicious,a month ago,Open,2000746806
Kaylene Sihotang,5.0,"My family loves this Pieology! The same employees are usually here at lunch, and consistent at making great pizza! They are usually fast and efficient even when the line is long. This place is one of our “go to” lunch restaurants!",a year ago,Open,2000746806
Duane Carlson,5.0,"Loved the pizza! Cauliflower crust, veggie pizza with pesto sauce!",9 months ago,Open,2000746806
Lauren Laws,5.0,"Ordered a cauliflower crust pizza. Honestly, I I've had lots of gross cauliflower crusts but with this one I could not even tell the difference between this crust and a regular dough crust. The pizza was delicious! I will definitely be returning",a year ago,Open,2000746806
Valente Garcia,5.0,Good pizza,3 weeks ago,Open,2000746806
Alan Ng,5.0,Great pizza made to order.  Friendly staff and clean.,9 months ago,Open,2000746806
Melissa,4.0,Pizza is delicious & I love the special lemonade flavors! The staff is nice too!,a year ago,Open,2000746806
Ernesto Oros-Blanco,5.0,Great pizzas made right in front of you and great tasting. Great service,a year ago,Open,2000746806
Aaron Lopez,3.0,"Never fails to surprise my taste buds. Although, I wish the place looks cleaner. They were busy for 3.14 pie day.    They looked like they didn't have enough staff to keep the lobby clean. The service was fine yet again they were running.so fast that they don't have time to be legitimate to the customers.",a year ago,Open,2000746806
Trendy Posh,5.0,"Pierise with Alfredo sauce, Moz, feta, park and ricotta cheese paired with garlic herb, sun-dried tomatoes, red onions, pineapples and chicken. Topped off with pesto sauce, sprinkle of black pepper and oregano...yummy!!!",a year ago,Open,2000746806
Izzy nut tree,4.0,Excellent pizza however the 2 workers were not enough. They need more employees behind the counter.,11 months ago,Open,2000746806
ru,1.0,"One of the worst experiences I’ve had. Service was PAINFULLY SLOW. Employees had bad attitudes. Once our two pizzas were FINALLY in the oven after about 30 minutes, they came out completely burnt. Offered a coupon as compensation, but we asked for refund, which the employee did not know how to give. DO NOT COME HERE PLEASE.",11 months ago,Open,2000746806
Crystal Wells,3.0,Service was a little slow.,3 months ago,Open,2000746806
Hanson Family,5.0,"Super friendly employees, delicious food! If loud echoey background noise bugs you you'll want to take it to go or eat outside.",a year ago,Open,2000746806
Delashawn Kemp,5.0,Good food,2 months ago,Open,2000746806
Andrew Medrano,5.0,"Teresa M was amazing and the biggest sweetheart ever. She was fast, made the pizza the way I asked, and had amazing vibe and energy! Amazing customer service boo you’re the bomb<3",a year ago,Open,2000746806
Cindy Cervantes DeBinion,5.0,Love their Wednesday $6 build ur own pizza special!!,a year ago,Open,2000746806
Kendra Stocklin,5.0,"Great pizza, fresh toppings & Great service",9 months ago,Open,2000746806
Tirso X. Rayo,5.0,Always our place to go for pizza! Staff is generally nice.,11 months ago,Open,2000746806
ANITA WILLIAMS,1.0,Used to be a great place. Then some of the girls we bullies towards a co worker and the owner didn't care that it was happening.  We sure hope that lovely employee that was being bullied left. She deserved better. We highly recommend Blaze Pizza at Riverside Plaza.,2 years ago,Open,2000746806
Ingrid Mitchell,5.0,"Cauliflower crust pizza, excellent",a year ago,Open,2000746806
William Gracia,3.0,"Food was a bit overpriced. Two people was about $26. Ingredients were better than average quality, though many restaurants have better. I won't be coming back too often, maybe once in a long while.",a year ago,Open,2000746806
Terry Ellis,5.0,Love there pizza. Save alot of money with there point system. Got a free pizza tonight.,a year ago,Open,2000746806
Terry M,5.0,I love their cauliflower Margherita pizza. It does not taste like cauliflower taste like crust.,a year ago,Open,2000746806
AC,5.0,"Went here when it first opened, and thought I should just write a review on it! Place was clean and food was good. I love the thin crust and it was very flavorful. …More",2 years ago,Open,2000746806
DJ Gotcha,5.0,It was very good and the employees were very nice!,10 months ago,Open,2000746806
Liza Shinnefield,3.0,"Good if you want pizza with a thin, crunchy crust.  Your pizza is done in about 5 minutes which is great, especially if you're hungry when you arrive.  If you order meat toppings, be prepared for a greasy pizza",2 years ago,Open,2000746806
M M,5.0,"Made it Keto friendly with the cauliflower crust no sauce, just butter and herb with proteins. A little dry but still nice and crunchy.",a year ago,Open,2000746806
William Chaffin,5.0,"Build your own pizza, plenty of options, always fire",a year ago,Open,2000746806
Jeffrey,3.0,"For those who have to avoid wheat, they offer tasty alternatives to traditional crust. We actually prefer the GF and Cauliflower crusts, though I'm not certain that the cauliflower is 100% wheat free. But you can get a tasty Pizza here either way.",2 years ago,Open,2000746806
George Martinez,5.0,"Great place for customizing your pizza. You can consider it a ""Subway"" in cheese. Close parking is slim pickens but it's not a real problem. 🧀",a year ago,Open,2000746806
K Lady,5.0,Service is great and my family loves the pizza with all the fresh ingredients,a year ago,Open,2000746806
Jeanette Williams,5.0,Best brownies and cookies,5 months ago,Open,2000746806
Maryjane Mccullough,5.0,Customer service was great and my vegetarian pizza was delicious great price too.,a year ago,Open,2000746806
John Martinez,5.0,My wife is doing the keto diet.she really love the cauliflower pizza.  With all topping by choice...loved it,a year ago,Open,2000746806
JAKE 74,5.0,This place is the best it's like subway for pizza,a year ago,Open,2000746806
Diego Sanchez,5.0,Good pizza. Good time. My pizza came out too crunchy but that was my fault for not getting the hand tossed.,2 years ago,Open,2000746806
Leslie Mangram,5.0,"Great customer service. Fast and efficient (it was lunch time)and oh, so delicious 🤤",a year ago,Open,2000746806
Teresa Dubois,5.0,Was fantastic food was great and service was good,a year ago,Open,2000746806
Joel Rutigliano,2.0,Ate there once pizza was cold half cooked😭😥😷,2 years ago,Open,2000746806
Lynell Weller,4.0,"this place lets you create your own pizzas for one price of $9. They have other pizzas that you can order and they have different prices on and they even have a family package of 3 pizzas and one dessert pizza for 25. Nice clean place, and it wasn't too busy when we were there",2 years ago,Open,2000746806
Glenn Fonseca,5.0,Great pizza,4 months ago,Open,2000746806
Christina Baluyot,4.0,It's a hit and miss with toppings but taste good everytime. Service is good and price is great,a year ago,Open,2000746806
adnan albeitawi,5.0,"This is a new Pieology restaurant that opened near my house. The restaurant is clean, the atmosphere is calm, and there are a lot of big windows allowing for natural lighting. …More",3 years ago,Open,2000746806
Araceli Montes,5.0,Love that they have vegan cheese!,a year ago,Open,2000746806
Fabian Montgomery,4.0,"These restaurants are pretty much the same everywhere. Three staff were running the show during lunch hour, and there was little business. The price point on the pizzas are an issue for what you get. Howver I'm m a fan of the cauliflower crust.",a year ago,Open,2000746806
Patrick Jeffers,4.0,Quite good. I worked at a family owned pizzeria for years. I like their products and look forward to trying the new deep dish crust.,a year ago,Open,2000746806
Pat Wisniewski,5.0,"Love pizza my way.....love the cauliflower crust.   Fast, great service.",a year ago,Open,2000746806
Paul Verschueren,3.0,It's okay I've got a 599 pepperoni pizza and a dinner salad with Italian dressing and it was just okay. It was better than Little Caesars but that's not saying much I had higher hopes I wish you would have been better in their Crest would …More,2 years ago,Open,2000746806
Cyn Moore,3.0,I like the idea of being able to add all the veggies I want at no extra cost.  They need to work on their crust. It is always soggy.,a year ago,Open,2000746806
Christopher Brandon,5.0,"Great service, the food is excellent.",10 months ago,Open,2000746806
Tycho Twin,4.0,"Great employees, grest pizza just the way i love it.    Terrible Parking",a year ago,Open,2000746806
Marianne Crane,5.0,Excellent pizza! The cauliflower crust is amazing.  Great customer service and everyone is friendly.,2 years ago,Open,2000746806
Natalie S,4.0,"Food and service great. Need more parking, especially for pick-up orders.",a year ago,Open,2000746806
Diane Diehr,2.0,"Very thin bland crust, sparse on the toppings pretty pricey for what you get",8 months ago,Open,2000746806
Barbara Nobles,4.0,"Pizza is delicious, ingredients fresh.  I don't like the fact that there is an upcharge for wheat crust or a side of ranch.",a year ago,Open,2000746806
Ralphie Flores,5.0,It very good and cool cause its like the only pizzeria around where you can make your own pizza plus when the pizza come out they taste extra good cause you put toppings that you like.,a year ago,Open,2000746806
M P,5.0,It was an amazing experience the pizza with fresh delicious,a year ago,Open,2000746806
Daniel Manzo,5.0,Really good pizza. Customer service was great. Definitely going back,2 years ago,Open,2000746806
Sarah Gabuya,5.0,"nice people, great product open later than most restaurants in area and always has toppings you like",a year ago,Open,2000746806
Charles Hornsby,5.0,"Customer service, Quality of food and time efficiency was GREAT !!",a year ago,Open,2000746806
Peter Abdullah,5.0,You have made what you like on your pizza no questions....great place to have a quick bite and relax while doing so,a year ago,Open,2000746806
Nancy Villegas,5.0,"Visited pieology in Moreno Valley, ordered the pan crust herb butter, cheese, mushrooms tomatoes, sausage pepperoni. DELICIOUS! All young ladies who assisted us were corteous and very customer oriented, love this pizza and place GOOD JOB Pieology!",a year ago,Open,2000746806
Kaitlin Brummer,5.0,The people here are nice a d the pizza is so fresh and good,a year ago,Open,2000746806
yvonne Robinson,2.0,Impatience employees always rushing clients. Horrible service,a year ago,Open,2000746806
Joyce Johnson,4.0,"It was close to home,but the pizza was just ok",11 months ago,Open,2000746806
Lorena Juarez,5.0,Delicious and service Awsome,a year ago,Open,2000746806
Kenia Marrder,5.0,I love this place cause i create my own pizza and everybody there is nice,a year ago,Open,2000746806
Martin Krause,3.0,"I wanted a certain ""Chef Inspired Pie"", but had to fight to get it. Each person repeatedly ask ME what comes next, each time I would ask for exactly as written on menu. Still, they would have left out Gorgonzola Cheese, if I hadn't …More",2 years ago,Open,2000746806
Claire O.R.,1.0,If you have allergies steer clear. My experience was awful trying to get vegan pizza because they were so incredible careless that they had cross contaminated literally EVERYTHING with cheese. Also incredibly horrible attitudes. Won’t be …More,2 years ago,Open,2000746806
Norma Alvarez,4.0,Clean and fresh but staff could be more friendly,a year ago,Open,2000746806
fidel medina,5.0,"Great place and u cant beat the price. Customer service is great u get greated with a smile, in and going out.",a year ago,Open,2000746806
SmiLe HaPpY,5.0,Pretty pricey but you cant put a price on good food ... Now i wouldn't eat at any pazzia place but pieology (best pizza in the world),a year ago,Open,2000746806
susy garcia,3.0,"I honestly didn't like it! if you want a very good pizza, search for Marcos Pizza
near your area that one is delicious 👌",a year ago,Open,2000746806
Kathy T,5.0,Best pizza ever,10 months ago,Open,2000746806
Dale Jonasson,5.0,Glad they opened one here.  Really good pizza and pretty quick. Nice to customize it.,2 years ago,Open,2000746806
Renee Jaeger,5.0,I usually don't eat pizza but this place has cauliflower crust and everything is always fresh and you need to put your own pie together and it just taste so delicious there's nothing I could say bad about this place and it's always crying,2 years ago,Open,2000746806
Ricardo Lucatero,5.0,"Very good service, Theresa was very helpful and went out of her way to give tips to use for next time. Would highly recommend trying.",2 years ago,Open,2000746806
christina pepper,5.0,I'm in love woth this place!,a year ago,Open,2000746806
MattLikesGaming,5.0,Great fast food pizza place.  Great thin crust pizza.,a year ago,Open,2000746806
lovin life,5.0,Love it. Make your own specialty pizza at a decent price. Fast and friendly service,2 years ago,Open,2000746806
Jay Harold,2.0,The pizza was good but I was disappointed in the people working there they couldn't get my to-go order right .....I was stuck there waiting for a half an hour....... on something that I called in.... a half of an hour in advance..,a year ago,Open,2000746806
Aurora Gonzales,5.0,Place and food great just some workers not so good,a year ago,Open,2000746806
Sergio Benitez,5.0,Great great place and pretty cheap considering its vegan friendly. Also if you have a smartphone download the app to save either time or money.,a year ago,Open,2000746806
Running Horse,5.0,The vegan options here are why we keep coming back. We appreciate the customer service with the automatic glove changes. That really makes a world of difference because asking for that is never fun.,2 years ago,Open,2000746806
Kevin Usher,5.0,"Great if you want a quick pizza! Even has gluten free crust option, plus vegan cheese for Vegans!",2 years ago,Open,2000746806
Artemisa Castaneda,5.0,"Good service, quality food. The prices were average, but if you sign up for their email club, they send 2 for 1 coupons often.",2 years ago,Open,2000746806
Mary Jane Martinez,5.0,"1 st. time here 11/26/17. Excellent pizza, very tasty and it's very reasonable. Will definitely tell others about this new place.",3 years ago,Open,2000746806
Jeni,4.0,Jackelyn was kind & cheerful.  Even though she was making pizzas on her own while the cook was putting the pizzas in the oven. 👍,2 years ago,Open,2000746806
Maricella Vielma,3.0,High price for a small pizza. Ill stick with blaze 👍,11 months ago,Open,2000746806
Kahssey A,5.0,"There are alot of pizza places popping up and I'm pleasantly surprised that this one is really good and has great service! ""Theresa"" especially!",a year ago,Open,2000746806
Jason Briggs,5.0,I liked the wide range of toppings sauces and the pizza taste great,a year ago,Open,2000746806
Sheila Gilbert,5.0,Pic was worth the wait 🔥🔥,a year ago,Open,2000746806
Sarah Davenport,3.0,"The food was great but the 2 managers need personality overhauls. The 1st girl that helped me was very nice, but the other 2 sucked",2 years ago,Open,2000746806
Yaqub Ngankeu,5.0,Best pizzeria in Moreno Valley.  In fact on California hwy 60 there's nothing better,2 years ago,Open,2000746806
Shambhavi Balasubramanian,4.0,Lots of affordable options. Margarita thin crust was really good,2 years ago,Open,2000746806
Sharon James,5.0,"Fix it like you want it, ,you tell them what you want on your pizza from start to finish,,,nice and clean place,,bathrooms super clean..👍",a year ago,Open,2000746806
Literally Who,5.0,Great prices and delicious pizza.,a year ago,Open,2000746806
Matt Felix-Smith,5.0,"Fast, custom pizzas. Super good.",a year ago,Open,2000746806
Angelia blanton,3.0,Good food. Great service,a year ago,Open,2000746806
CrazyYT,5.0,It was very good,10 months ago,Open,2000746806
monica medina,1.0,"got my food and they didn’t even cut my pizza or breadsticks, slow service . just terrible",a year ago,Open,2000746806
Freddrick Knox,5.0,Always great pizza.,a year ago,Open,2000746806
Patti Knight,4.0,"Pizza was excellent. I would have cooked it a little longer, but it was delicious",2 years ago,Open,2000746806
Anna Coffey,5.0,"I have a severe allergy to olives. So, anytime I go out, I ask the server to change their gloves. I always feel like I'm asking for too much but I really just want to make sure I don't have a allergy attack from cross-contamination. Some …More",2 years ago,Open,2000746806
george ofthejungle,5.0,Great service and great pizza for the price. You can build your pizza your way..go there often with family,2 years ago,Open,2000746806
