name,stars,text,timeSince,openStatus,key
Leonardo Dorighetto,3.0,"Wonderful pizza, however the time to be prepared is too long and the attendants are not so nice.",2 years ago,Open,1000819155
Fernando L,5.0,Ordered on-line. Excelent quality,a year ago,Open,1000819155
Shaun Carr,1.0,"Slow service, tables not cleaned and in need of decoration. Little choice if food,",a year ago,Open,1000819155
Lorna Gray,5.0,I love Pizza Hut and I love the original hand-tossed,2 years ago,Open,1000819155
Juan Eloy Canta,5.0,"Nice place, nice flavor but expensive",a year ago,Open,1000819155
P S,1.0,Terrible service and mediocre pizza. Sat for 25 minutes before a server even said Hello. Server was rude and sarcastic and acted like he was just over it.,4 months ago,Open,1000819155
Samantha Gonzalez,5.0,AMAZING STAFF!!!! I love the food and the workers were great. They have an amazing management team!!! :) Definitely recommend eating there if your on International drive!,4 years ago,Open,1000819155
Ste Se,5.0,Tasty food and nice staff. Dunno what others experienced?,3 years ago,Open,1000819155
Juni Garza,1.0,Very disappointed in the way orders are done..so I’m here on vacation from Texas and came last night to order pizza. I called in to place the order for pick up and the gentleman I spoke with assured me the order would be ready in 15-20 …More,2 years ago,Open,1000819155
Kreattore Personalização Criativa,5.0,Love this pizza,11 months ago,Open,1000819155
Issac Ben,5.0,Very nice people working in this place,2 years ago,Open,1000819155
Armando Andres Arancibia Marquez,5.0,Perfect enviroment and service,a year ago,Open,1000819155
Daniel Alexander,1.0,Didn't give me my wings I ordered and then refused to answer their phone.,a year ago,Open,1000819155
inactive account,5.0,This place is in the Enclave. Wonderful staff. Great bartender such a delight. Very friendly.  Love this place.,3 years ago,Open,1000819155
BubsBeSnappin YT,1.0,Messed up my order and they refused to remake it for me. Store manager didn't even have the balls to talk to me like a man and I had to interact on the phone with an employee the whole time,a year ago,Open,1000819155
Bruce Daniels,3.0,Good take out pizza. Unfortunately we ate in.,2 years ago,Open,1000819155
Peter Parkinson,3.0,"You know what you're getting, it's a Pizza Hut!",a year ago,Open,1000819155
Sir Wiggulbottom,5.0,Good pizza,11 months ago,Open,1000819155
Benjamin Soto,3.0,No Deals. Not everyone in orlando is a tourists. This place needs an update but rush looks like it was built in the 70's and still...,2 years ago,Open,1000819155
Flávio Kennedy Rohden,2.0,"The check comes with 15 ~ 20 % gratuity, which I consider way to high. 20% should be for an excellent service, which was not the case.",2 years ago,Open,1000819155
Martin traynor,4.0,Good pizza good service,2 years ago,Open,1000819155
Sam Wilson,5.0,Fast service and just down the street from our hotel..,2 years ago,Open,1000819155
Ricky L. Smith,1.0,I was looking for pizza hut buffet google said this one is when I called I was on hold for 6 minutes and when she came back she was very rude I wont be eating there ever,a year ago,Open,1000819155
For the love of dog!,4.0,Nice pizza just a long wait to order,2 years ago,Open,1000819155
Shanty B,4.0,Fast friendly service,a year ago,Open,1000819155
Simon Thorley,3.0,"Usual good pizza hut pizzas, nice friendly staff. Could do with a refurb though.",2 years ago,Open,1000819155
Red Roses,4.0,Very good pizza,a year ago,Open,1000819155
Charles Hollis,4.0,Great food not a big fan of their dine in service.,2 years ago,Open,1000819155
David Ross,5.0,Very good food and service. Very reasonable priced.,2 years ago,Open,1000819155
Peyton Kelsch,5.0,Quick service and a friendly face,a year ago,Open,1000819155
conway Goree,5.0,"The Original, very good",a year ago,Open,1000819155
Mukarram Shahzad,5.0,Good service. Gooder pizza. What else can I say?,2 years ago,Open,1000819155
Anthony Dominic Duff,3.0,It was just really average.  The Pizza Hut in the UK us much much better!,2 years ago,Open,1000819155
Sam Smith,4.0,Food was great but the air con was too high so learned to take a heavier top when eating there.,2 years ago,Open,1000819155
Arturo Miranda,1.0,Sucks hire better employees at least to fake the willing to be at the job expressions,2 years ago,Open,1000819155
Chris U,5.0,Great food good service. Bathroom could use a face lift.,2 years ago,Open,1000819155
Leandro RJO,4.0,Great place for a fast snack or late night diner.,2 years ago,Open,1000819155
Oswaldo Rivero,5.0,I loved this restaurant,a year ago,Open,1000819155
Portia Pinkston,5.0,Love it eat there all the time,2 years ago,Open,1000819155
Susan King,1.0,Rude waitress got up and left,a year ago,Open,1000819155
Becky Hernandez,5.0,Friendly staff. Not at all that busy before 7 (on weekday) after that tgey do start picking up. Best advise is order online and bring back to hotel. Nothing like eating pizza and wings with a couple beers in ur room and watching t.v.,2 years ago,Open,1000819155
Patrice Hawkins,1.0,"If I could give it less than one star, I would. After waiting over an hour for a pizza delivery, I contacted the store who told me it was en route and to give them a call back if it doesn't arrive in 10 minutes. I gave them 15 minutes and …More",4 years ago,Open,1000819155
Anitra Pace,5.0,They offer gluten-free which is a great option for those with celiac disease.  Very tasty I might add.,3 years ago,Open,1000819155
Melissa Roberts,5.0,"Very nice staff, and service, food was good also. Would recommend",3 years ago,Open,1000819155
David Howard,1.0,sitting at buffalo wild wings you can just watch their delivery drivers break the law..... almost cause an accident in front of us endangering not only my life but others innocent people around.... learn how to drive or go back to driving school... please look up what a double yellow line means,2 years ago,Open,1000819155
Zach B,5.0,I usually don't like Pizza Hut but this Hut was surprisingly delicious!,a year ago,Open,1000819155
A M,1.0,"Went in last week and was greeted by not one person while a group of female employees were gossiping at a corner, like high schoolers. Finally had to approach them to get any type of service. Ordered carried out, then left to realize they …More",3 years ago,Open,1000819155
Jim Murphy,4.0,Never been a huge fan of Pizza Hut but I was pleasantly surprised by the quality and quickness of service given how busy it was.,2 years ago,Open,1000819155
Terry Suiters,2.0,Food was good but manager was very rude to many customers. No help on a Friday night! Please,2 years ago,Open,1000819155
David Marenco,5.0,Fast service. Good food. Waitress was very nice.,3 years ago,Open,1000819155
Michael Cordova,5.0,Sweet staff. The server was very helpful.,3 years ago,Open,1000819155
gary wiffin,5.0,"Stopped in for a quick bite , good oizza and service",3 years ago,Open,1000819155
MDTV Kids,5.0,"Good food pasta , pizza , sandwich, wings",2 years ago,Open,1000819155
paul yates,3.0,The food was good but the place is in need of some TLC.,3 years ago,Open,1000819155
Omar Busutil,5.0,Fresh food,a year ago,Open,1000819155
J B,1.0,THIS IS THE WORST PIZZA HUT I HAVE  EVER BEEN TOO......   RUDE STAFF.... NOT ONE SMILE..... NOT EVEN A HELLO.  WALKED IN SAT DOWN MYSELF.... DIDN'T GET ANY SODA OR WATER IN THE 10 MINUTES WE SAT DOWN.... GOT UP AND LEFT. MANAGER STANDING …More,4 years ago,Open,1000819155
Louise Sherret,1.0,"1 star but its more like 1/2 a star! And that is only because its close to our hotel!!! My husband and I came into this Pizza hut next to ""Buffalo wild wings"" for takeout pizza to share after a long day in the theme parks. We ordered what …More",3 years ago,Open,1000819155
Juan Vasquez,5.0,Easy and fast service. Food good as always.,2 years ago,Open,1000819155
Nadia D,1.0,"I placed an order since 12:10pm. It was supposed to be delivered to my workplace for lunch, since 1:15pm its now 1:55pm and NO SIGN OF DELIVERY. I called 3 times to see where my order is... And i am just being told that its on its way...i …More",4 years ago,Open,1000819155
Ashley Langston,5.0,Amazing food! Best caesar salad I've ever had!,3 years ago,Open,1000819155
Alisha Grisham,5.0,Really nice people doing their best while short staffed and really busy,2 years ago,Open,1000819155
Joseph Luciano,4.0,The food are pretty good. Fast order,3 years ago,Open,1000819155
Hayley Crook,5.0,Great pizza and great service with a choice of takeout if you don't finish it all,3 years ago,Open,1000819155
Tom Kelsall,2.0,"Customer service was poor, the lady serving me couldn't care less about us, very poor place. Would recommend ordering online as you are able to get deals which for some reason are only avalible online not in store.",3 years ago,Open,1000819155
E Salah,1.0,There was mold on the ceiling of the main room and wait was very long and they had bad customer service. Food was not that good.,4 years ago,Open,1000819155
Kat Le,1.0,"I had the WORST experience I can't believe I payed literrally 50 dollars and I couldn't even got the right topping on my pizza that I payed EXTRA for and also the breadsticks were burnt, the brownie was burnt, the pepperoni pizza was burnt! …More",3 years ago,Open,1000819155
jeremycozannet,1.0,"I am 33 years old. This was the worst pizza I have ever had. Soggy bread 1mm thick covered with traces of marinara sauce, burnt pineapple and ham. Wait was ok and Waiter friendly.",3 years ago,Open,1000819155
Clive Wood,2.0,Very tired restaurant needing modernisation makeover. Food and staff ok though.,2 years ago,Open,1000819155
Antonio Fallucca,4.0,"Place e as empty, and took a while to be seated food was great though.",3 years ago,Open,1000819155
Rigoberto Hernandez,2.0,"Slow  the only person that looked busy and was trying to stay on top of things. The older men .seating people ,taking orders..the other 2 slower and no worries or concerns....need more people and be more friendly knowing ur gonna have lots of people. .",4 years ago,Open,1000819155
Rhiley Langworthy,1.0,WARNING!!!!!!!!!!! DO NOT GO HERE!!!!!!!!! Worst pizza ever! I love pizza Hut but this location is terrible! Pizza was poor quality and when I tried to call to add a side to my order it took me calling three times from two phones for them …More,4 years ago,Open,1000819155
Luciana Capozzoli,2.0,"A bit dirty and old fashioned, good for fast and cheap pizza",3 years ago,Open,1000819155
Lee Hutchinson,5.0,"Good food,good service",2 years ago,Open,1000819155
Siraj Rasul,4.0,Good Service and Pizza Taste and Cost will be ok,3 years ago,Open,1000819155
Jhon Ramírez,5.0,"All here is good, the service and food. .  Great",4 years ago,Open,1000819155
g fargas,1.0,"Couldnt even order food cause the cashier didnt kno nothing.We asked her questions and she would look away.Poor service,ignorant.1/14/18 9:10pm",2 years ago,Open,1000819155
James Secone,2.0,The place was not updated so it looked old. The prices were kinda high for pizza. And the waitress was horrible.,2 years ago,Open,1000819155
Nina Estep,5.0,"Food was delicious, service was great. The restaurant is very clean.",2 years ago,Open,1000819155
Jothrax _17,1.0,"Garbage, garbage, garbage please save your self the trouble and never order from here. Their service is plain garbage. My pizza dispatched for 45 minutes and they didnt even know were the driver was. The guy never came. Had to cancel my order. Called papa johns it took like 30 minutes.",4 years ago,Open,1000819155
AMHCLASS,1.0,"I ordered a carryout and when I went to the counter pick it up, they ignored me and left me standing.  No one even bothered to walk over to the counter and speak to me about my order. There was not a single customer in line and few actually dining in at the time.",7 years ago,Open,1000819155
Jessica Covington,1.0,Way too busy,a year ago,Open,1000819155
Alexis Béranger,1.0,Same comment as below. We were waiting as hell for 3 ridiculous pizzas. As a result the waitress came one hour later without even getting what was our orders. Definitely a bad place to eat something...,4 years ago,Open,1000819155
Cezar Augusto Araujo,1.0,"Asked for pepperoni and got a cheese pizza. When i complained, they said couldnt do nothing. Lame service, lame employee. Hard to come back.",3 years ago,Open,1000819155
Only One Best Girl DDLC Mod,5.0,I love the pizza it's great,2 years ago,Open,1000819155
Rodrigo L Ferreira,4.0,Good pizza,a year ago,Open,1000819155
Timothy Paneitz,4.0,Great service and picture prefect pizza.,3 years ago,Open,1000819155
Rebecca Bartlett,1.0,"Smelt chemically and the service wasn't good. Food was okay, but not the best.",2 years ago,Open,1000819155
Rob C,2.0,"Walked in, they have no salad cart and the place stank of really strong blue cheese (or something else). Sorry, but we decided against dining here.",4 years ago,Open,1000819155
Bruce Young,5.0,Quality food for the price,a year ago,Open,1000819155
Lucas Gulla,4.0,"The food is delicious, also the service is good, but very dark.",4 years ago,Open,1000819155
Marcus McCoy,1.0,"They have horrible customer service and their cooks do not wear gloves while prepping food! Also, do not bother calling in an order. It will not be ready when you arrive. Expect to wait an additional 20-30 mins.",3 years ago,Open,1000819155
wendyy,1.0,"I would give this less that a star if it was possible. Service was long asf, no one was there to help the guests who were waiting on reservation. There were tables that were open but needed to be clean but no one did. It was already 20 mins …More",4 years ago,Open,1000819155
Abe Otero,5.0,"Friendly staff, great service, and oh yeah geat food!!",3 years ago,Open,1000819155
Santiago Nahuel Cordoba,4.0,Nice pizza,a year ago,Open,1000819155
Luisa Suarez,5.0,Fast and great Service,a year ago,Open,1000819155
Sophie Armstrong,2.0,"Unorganised, poor service ( not personal towards any servers ) but it's obvious they don't communicate as we seemed to be asked the same questions by different server every 2 minutes. Slow service also.",3 years ago,Open,1000819155
Aneyer Matos,5.0,Lue did an awesome job! Loved the pizza.,6 years ago,Open,1000819155
Chris Mcalinden,4.0,Pizza,a year ago,Open,1000819155
Sonia Medina,4.0,We had a good experience but that pizza hut was in Florida.,2 years ago,Open,1000819155
Luciana Reviews,5.0,I love this.,a year ago,Open,1000819155
AH INTERNATIONAL,1.0,Worst Customer Service...,a year ago,Open,1000819155
reche russ,5.0,Fast service,a year ago,Open,1000819155
dennis mulholland,5.0,Children friendly,2 years ago,Open,1000819155
Igor Chaffin,5.0,Great staff and pizza,2 years ago,Open,1000819155
Angie Childers,4.0,Great food,a year ago,Open,1000819155
Jason Lennon,1.0,Walked in with my family for a sit down dinner.  Stood and waited.  Not one person came to sit us or even greet us.  Another customer was sitting near us and she said she's been waiting for her take out order.  I told her we are here to eat in but no one seemed too concerned.  She agreed.  So we left.,3 years ago,Open,1000819155
Jane h,5.0,Nice food,a year ago,Open,1000819155
Zach,1.0,Pizza wasnt good at all,a year ago,Open,1000819155
stolnn,1.0,Didn’t even get our order,a year ago,Open,1000819155
chainylee de alvarez,5.0,best pizza i ever had,2 years ago,Open,1000819155
Pam Clayton,2.0,Not the best service and dirty bathroom,a year ago,Open,1000819155
Florenncia Vigo,4.0,Big sizes and not for much,a year ago,Open,1000819155
Frank Govers,5.0,We ordered the pasta and it was very good,5 years ago,Open,1000819155
Christi Kippersoff,1.0,"Terrible! Dirty, poor service! Manager seemed uninterested in his job. Don't visit this place",a year ago,Open,1000819155
Allan Perkins,1.0,Dirty in tidy pizza hut would not return,3 years ago,Open,1000819155
Mauricio Malheiro,5.0,The best pan pizza!,2 years ago,Open,1000819155
Kipchage Gardiner,5.0,Cheesy crust was on point,a year ago,Open,1000819155
Mike Druga,4.0,Good pizza,a year ago,Open,1000819155
Mohammed Algarni,5.0,Love the cozy atmosphere,a year ago,Open,1000819155
Beverley Palmer,1.0,Bad. gave a 1star because the waitress didn't moan THE place is a tip,3 years ago,Open,1000819155
Marcos Galuppo,5.0,"Top, pizza hut international Dr, Orlando.",2 years ago,Open,1000819155
Tony Hanna,5.0,"Amazing taste, very welcoming staff",4 years ago,Open,1000819155
Enkh G,1.0,"Worst customer service ever, they charged my card twice and won’t let me use deal",a year ago,Open,1000819155
Nilibeth Sanchez,5.0,Great pizza!,a year ago,Open,1000819155
Armando Espinosa Citarella,5.0,Good food,a year ago,Open,1000819155
Funda Herrera,5.0,The staff was very friendly and helped us with our questions about lodging in the area.,2 years ago,Open,1000819155
Neil Bowers,1.0,Good pizza but really poor service,2 years ago,Open,1000819155
joaqueim coco,1.0,They confused my order and did nothing when i complained. Lame service.,3 years ago,Open,1000819155
Mike Jee,2.0,No deals here too expensive tip is mandatory associates are rude 36 wings for 51$,2 years ago,Open,1000819155
Carine Kildal,5.0,Very nice,a year ago,Open,1000819155
Vicente Duvivier,3.0,Nothing special just pizza at hometown prices but super long wait.,2 years ago,Open,1000819155
Ed Mccoy,5.0,Good pizza,a year ago,Open,1000819155
Callum Watt,5.0,Excellent,a year ago,Open,1000819155
Deepak Dakhore,3.0,Good location,a year ago,Open,1000819155
Kirby Brown,3.0,Just ok,2 years ago,Open,1000819155
Tanya Aiken,1.0,We walked in. The place stank of feet and looked grubby and was empty. We walked out.,4 years ago,Open,1000819155
John Tex,1.0,The driver called and refused to deliver to my room at the hotel. Call dominoes. They will.,3 years ago,Open,1000819155
Leticia Dominguez,5.0,Good,a year ago,Open,1000819155
Eleazar Teran,5.0,Excellent,a year ago,Open,1000819155
Jon Clarke,5.0,the best pizzas in the world,a year ago,Open,1000819155
Yossussi Duran,5.0,Excellent,a year ago,Open,1000819155
Ghanshyam Sakhareliya,1.0,Near by me so...but staff not wearing gloves when making pizza..i m vegetarian and she and he making non veg pizza then without wash hand she making my pizza too..this is really not good for vegetarians.,2 years ago,Open,1000819155
Alex Hasenkopf,3.0,"Pizza here was subpar compared to other Pizza Huts, the restaurant was also not kept that clean.",2 years ago,Open,1000819155
Barry Ryan,4.0,Always a good pizza,2 years ago,Open,1000819155
Jacqueline Drenthe,3.0,Too much fat,2 years ago,Open,1000819155
Gena Hale,2.0,They were very rude.,2 years ago,Open,1000819155
jimmy hanna,5.0,Good food,a year ago,Open,1000819155
Victoria Horlle,5.0,Great and good servers,2 years ago,Open,1000819155
Paula Kro,4.0,Expensive,a year ago,Open,1000819155
KEVIN FROST,4.0,Good food,a year ago,Open,1000819155
Hazel Diaz,5.0,Lovely service,a year ago,Open,1000819155
stacey saddler,5.0,Food was great,a year ago,Open,1000819155
Cora Mcghee,5.0,Awesome place,a year ago,Open,1000819155
Melissa Tice,2.0,2 Hours wait for a Pizza? I called Dominos and got it in 30mins. No pizza is worth 2 hours.,7 years ago,Open,1000819155
Myra Cadenas,3.0,Restaurant was clean. It did not have any family promotions at the time.,2 years ago,Open,1000819155
Tami Marcoux,4.0,Delicious,a year ago,Open,1000819155
Fer Martinez,5.0,Best pizza,2 years ago,Open,1000819155
Sparkplug,4.0,"Good pizza,regular chain",2 years ago,Open,1000819155
Brett Gilts,1.0,Don't honor $5.99 deal want to charge me 32 dollars for 2 medium pizzas,2 years ago,Open,1000819155
ABDULAALA AHMED,3.0,Regular pizza hut,a year ago,Open,1000819155
Dee Llc,1.0,Sucks,a year ago,Open,1000819155
Nicole Quiles,4.0,Like the hand tossed...,2 years ago,Open,1000819155
Brian Rush,5.0,Classic  dependable  great pizza,3 years ago,Open,1000819155
Miguel Brito,5.0,Good food,a year ago,Open,1000819155
Ethan Silver,1.0,I don't know why this place sells pasta there's no Pastin the name they should just strictly sell pizza I am a palled I can't believe us off,3 years ago,Open,1000819155
ashley fryer,3.0,It was ok expensive for what you got,2 years ago,Open,1000819155
rakim sadat,5.0,Ok,a year ago,Open,1000819155
VILESOFT,5.0,Majestic,a year ago,Open,1000819155
עמית אהרון,3.0,Slow servise,a year ago,Open,1000819155
Aaron Macias,1.0,Bad attitude and bad costumer service!!! 👎,2 years ago,Open,1000819155
Osayemwenre Igbinidun,1.0,"Customer relation is zero, food presentation is zero",a year ago,Open,1000819155
Victor Hugo Oliveira Paveliski,5.0,Top,a year ago,Open,1000819155
Jorge Enrique Sanchez,4.0,Good!,2 years ago,Open,1000819155
Jean Pimentel Rodriguez,5.0,Delicious,2 years ago,Open,1000819155
Carlos Hernandez,5.0,Great,2 years ago,Open,1000819155
Claudio Gonçalves,5.0,Good service!!!,a year ago,Open,1000819155
Kirsty Whiteoak,5.0,Great Pizza,2 years ago,Open,1000819155
Rosana Santoro,4.0,Nice,2 years ago,Open,1000819155
Benjamin Krebs,5.0,Love it...,2 years ago,Open,1000819155
Luciano Loureiro,5.0,Very good,2 years ago,Open,1000819155
Hugo Quintero,4.0,Love it,2 years ago,Open,1000819155
lathell grimes,3.0,Ok,2 years ago,Open,1000819155
Rebecca Bourn,4.0,The food was verygood,2 years ago,Open,1000819155
ThEbillYang,5.0,Friendly staff!,2 years ago,Open,1000819155
Patricia Adkins,5.0,Wonderful waitress,2 years ago,Open,1000819155
joao batista reis carneiro,5.0,Note 10,2 years ago,Open,1000819155
jim,3.0,Not bad,2 years ago,Open,1000819155
Amanda Ray,1.0,Horrible.,2 years ago,Open,1000819155
Raul Ledezma,1.0,Piece of Shiit..,2 years ago,Open,1000819155
Norma Gathright,1.0,Very disappointed.,2 years ago,Open,1000819155
Dover Adams,3.0,Too cold inside,2 years ago,Open,1000819155
Fabii Fernnases,5.0,Ok,2 years ago,Open,1000819155
El ConZooltorio,1.0,Bad attention from the waitress...,3 years ago,Open,1000819155
Manny Herrera,1.0,"Carry out took 30 more min than time given,  worst pizza hut ever !!",3 years ago,Open,1000819155
Fernando Ortas Garcia,5.0,Good pizzas,3 years ago,Open,1000819155
Daniel Lopez,5.0,Excellent,3 years ago,Open,1000819155
Mariano De Nicola,5.0,Great Pizza!!,3 years ago,Open,1000819155
Albany Reviewer,1.0,Heard emolpyees laughing at a customer,2 years ago,Open,1000819155
Neil Greer,2.0,It's a pizza hut,2 years ago,Open,1000819155
Federico Tritscheler,5.0,Excellent attention,2 years ago,Open,1000819155
Terrica Logan,5.0,Great!,3 years ago,Open,1000819155
Fernando Teixeira,4.0,Our order took too long,2 years ago,Open,1000819155
Linda Evans,1.0,Bad service the person waiting on  me was rude and didn't want you to  ask questions  her name was tamarack and she walked away in the middle of transaction  never again Frig door where dough came from very dirty,3 years ago,Open,1000819155
Julio Nobuaki Fuzikawa,5.0,Great place!,2 years ago,Open,1000819155
Daniel Diaz,1.0,Horrible service,3 years ago,Open,1000819155
Rodrigo Inoue,1.0,Horrible!!,3 years ago,Open,1000819155
Rachel Reid,4.0,Yummy!,3 years ago,Open,1000819155
Ivette Rodriguez,5.0,It was cool,3 years ago,Open,1000819155
CHICHO COKIE.,1.0,"Horrible and dirty, bad service.",3 years ago,Open,1000819155
Brandon Price,1.0,Terrible customer service. They also don't accept Pizza Hut ads. $18 for a medium 1 topping pizza.,3 years ago,Open,1000819155
Vitor Torq,2.0,The place its old and looks dirty,3 years ago,Open,1000819155
Sam Waldfogel,4.0,Good food,3 years ago,Open,1000819155
Ladybug McCrary,4.0,very friendly staff,3 years ago,Open,1000819155
Eduardo Berrouet,2.0,"Employees , no bad face",4 years ago,Open,1000819155
Matheus Costa,5.0,Good place,3 years ago,Open,1000819155
Jessica Merritt,3.0,Busy as expected for i drive,4 years ago,Open,1000819155
Kierra DeBose,1.0,Order a pizza. Waited for it to be delivered for 2 hours and they never  came.,4 years ago,Open,1000819155
Teairra Sharde',1.0,This restaurant delivered cold and burnt pizza to my hotel room then had the nerve to not answer the phone when I called to complain about it. NEVER AGAIN!!!!! Do not order from them.,4 years ago,Open,1000819155
Luis Miguel Solares Pulido,2.0,Bad service,3 years ago,Open,1000819155
Omar Yunes,5.0,Lovely staff!,3 years ago,Open,1000819155
Cashene Cooper,1.0,Horrible service I called for a pizza and after an hour I called they put me on hold for at least 10 minutes when I finally got through she told me there was a 2 hour waiting time I then said I wanted to cancel she said OK I then realized I …More,4 years ago,Open,1000819155
M360 Communications,5.0,I love Pizza Hut.,4 years ago,Open,1000819155
Dominic Park,1.0,"Ordered two pizzas , fries and chicken and every bit of it arrived stone cold",4 years ago,Open,1000819155
Nigel Stewart,1.0,"Overcharged, got every aspect of order incorrect",4 years ago,Open,1000819155
Kie2 Jones,5.0,Love it . Hot and fresh,4 years ago,Open,1000819155
Magda Brar,1.0,Don't eat there.,4 years ago,Open,1000819155
Tamara Manning,5.0,Best ever,4 years ago,Open,1000819155
Isaac Graff,1.0,"This place caught on fire recently, the calls are redirected to the other pizza hut on I drive, which they don't tell you into you go pick up your pizza and find a closed down shop.",4 years ago,Open,1000819155
Kjartan Birgisson,4.0,Very quick service,5 years ago,Open,1000819155
Jens Wlodarczyk,1.0,"Noisy, bad food, long time for waiting - never again...",4 years ago,Open,1000819155
Ahmet Bulent Zorlu,2.0,Staff were not really helpful. Service was bad. I wouldn't recommend going there late night.,4 years ago,Open,1000819155
BlackmillOscar,1.0,"Grotty -  a real disappointment
P-Zone was not very nice - The P doesn't stand for Pizza.....
Menu's were so badly worn, you couldn't see the food on them. …More",6 years ago,Open,1000819155
Giampiero Della Monica,5.0,"(Translated by Google) To be in the United States, it's a very good pizza! The staff is kind, helpful and polite. Recommended …More",a year ago,Open,1000819155
