name,stars,text,timeSince,openStatus,key
David Singh,1.0,"Horrible customer service as soon as the rep ""Latoya"" got on the phone she rushed me spoke over me I couldn't even get to put my order in. I'm a trucker I'm parked 5 miles away at travel center called mr. Fuel, which is a valid address I …More",2 months ago,Open,1000817693
Alicia King,1.0,"One pizza the spinach was left off, another pizza didn’t have extra cheese that I paid for and none of the pizzas had the crust flavoring! Please pay attention to the orders!!!!!!",4 months ago,Open,1000817693
Priscilla Roberts,3.0,The pizza was good but the inside of the store was a hot mess. No chairs to sit down junk everywhere. The cashier register had paper plates everywhere. It was a disaster and I will never go back there.,2 months ago,Open,1000817693
Sara سارة Soda,4.0,"Pizza is usually ready and in great shape/taste, customer service is good also.",2 weeks ago,Open,1000817693
Fe Fe,1.0,"What A JOKE!!!! I Ordered the MEATY MARINARA PASTA. The pasta was CRUNCHY and it definitely wasn't meaty.
The driver comes in from a delivery run and did not even bother to wash her nasty hands before handling the food coming out the oven.",10 months ago,Open,1000817693
Qunnia Hatch,5.0,The neighborhood go to Pizza Hut. The food is always fresh and ready when you arrive.  The staff are superb and very professional 👏,2 months ago,Open,1000817693
Ross Bentley,5.0,"Good, but could do better the Pizza was a little under cooked and the slices were not cut evenly.",3 months ago,Open,1000817693
Cindy Lloyd,1.0,I called to order a delivery after I agreed to the price and time they called me back saying they don't deliver to my address and would not give me a reason as to why. I than explained that I haven't eaten all day and asked if my boyfriend could meet the driver at a corner again said no with no explanation.,2 months ago,Open,1000817693
Trina Albright,1.0,I had plastic in my cinnamon rolls. 🤢🤢🤢🤮🤮🤮🤮. I pick up my food round 4 pm today.,2 months ago,Open,1000817693
Da_Real Savage,2.0,"Not this time, got sick after eating here",a month ago,Open,1000817693
R B,1.0,Horrible! The need to get rid of the staff and start over!! The girl who answered the phone has a horrible attitude and acted if she was personally offended when asked to repeat herself because she was speaking too fast.,2 months ago,Open,1000817693
Nadarris Roberts,1.0,"I have been order from
Pizza Hut for years and them to make a dum mistake they have lost one loyal customer never again and would not Recommend recommend no one to order from them🤬🤬😡😡",2 months ago,Open,1000817693
Larry Jones,1.0,"The cashier was rude my pizza was not made properly they had to remake it, very inconvenienced as I had placed the order ahead of time so there would be no wait, the instructions were simple, extra sauce extra cheese! The first pizza was dry 🤷🏾‍♂️",a month ago,Open,1000817693
Sophia Terry,5.0,I had a very nice experience this trip with this location on main St I ordered over the phone for delivery to the job I spoke with Franklin who was very cheerful and extremely nice he  made my order experience what I am use to (The Pizza …More,9 months ago,Open,1000817693
Shelby Higdon,1.0,"My fiancee  placed an order for delivery, and the girl who delivered the pizza made him remove it from the bag she had, and the pizza was half-way out of the box. It honestly looks like the whole thing had been dropped. It then took over an hour to get someone on the phone to make a complaint. Worst service we've ever experienced.",8 months ago,Open,1000817693
Pat Workman,1.0,Ok if you like cardboard. Not edible. Wings not to good either. My last visit there.,6 months ago,Open,1000817693
Crysta Johnson,1.0,"We ordered pizza from this place at like 6:30pm, they were pretty packed and we understood and gave us a waiting time of an hour. Two hours go by and nothing,  it’s like 8:30, so I call them and ask where my pizzas are and they say that …More",10 months ago,Open,1000817693
lainey,2.0,"Took over 2 hours to get my order delivered, even though I am just down the street from this location. When I called to verify that my order was recieved and on its way, I was told quickly that it would ""be there in a minute"" then hung up on. I still waited another 30 minutes for the delivery after this call was ended.",10 months ago,Open,1000817693
Oj Pistal Ge,1.0,Never pick up da phone food occasionally b burnt or quickly put together food NEVER ON TIME,7 months ago,Open,1000817693
Brianna Bush,1.0,If the delivery driver could not loose my wings next time that’d be great. Workers in the store were extremely nice about the situation though.,7 months ago,Open,1000817693
Jermaine Jabril,1.0,No matter what time of the day it is there is a delivery problem with the main Street store. I deleted the app and download Domino's app and my pizza came in less than an hour.  Just saying,9 months ago,Open,1000817693
Lilly Howard,1.0,"The assistant manager Chris has no customer service skill,  he’s rude in person and over the phone. When picking up your order they act as if you’re not standing there, they walk back and forth for about ten to fifteen minutes before they acknowledge you . Some days you get good service depending on what time you go",11 months ago,Open,1000817693
Latisha Young,1.0,Customer service could be way better.You can tell their inventory is way off by the way they blow off remaking the customer food. It's take it or leave it at this store. Disclaimer: This is not for all Pizzas Hut stores just this one. There …More,a year ago,Open,1000817693
Sonja Stone,1.0,"I am a GM at a Cafe. This customer service is absurdly poor.

1.) We placed the order at 10:54pm. We received a call from the store at 11:20 …More",a year ago,Open,1000817693
Tessa Dykes,5.0,Great Pizza and delivery was quick,a week ago,Open,1000817693
Dorothy Mikel,1.0,Placed order at 5:58pm called after a WHOLE HOUR and they made my food free said it was on its way. Called customer care three times and two hours later after they let me know that the store dropped my food I get my food COLD and no apology …More,11 months ago,Open,1000817693
Jordan Geike,5.0,Great service and great food and its nice and clean,7 months ago,Open,1000817693
Antwon Harrison,1.0,Something is very wrong in there paid for my order at 7:23 the order is suppose to be ready at 8:30 get there 8:23 the woman toldme it would be ready at 8:30 she told me no one even made my order yet so i did get my food till 9:00 and i her …More,10 months ago,Open,1000817693
Simone Cook,5.0,The pizza tonight was absolutely phenomenal! The pizza and chicken Alfredo were cooked to perfection. My children enjoyed it and my 4 year old when ate 2 slices (he usually only eats the pepperonis off the top).,a year ago,Open,1000817693
Nik With A Stick,1.0,Man I keep ordering from here hoping that 1 time it will take less than an hour after I've received a text notification saying it's out for delivery when I live 10 minutes away. Only to be informed by the gm that she is delivering it and it …More,a year ago,Open,1000817693
KENFL74,2.0,Bad experience here. No greetings and no help! Order took 25 mins for the smallest pan pizza! Not clean inside and the guy working at the front was rude and rushing everyone as if like he did not want to be there. The only reason I gave 2 …More,a year ago,Open,1000817693
Mrs G,1.0,The lady upfront was rude and argued with me. I told her I called this Pizza Hut and put in my order at first she tried to over charge me I know the order is suppose to $21 yet she said $30 after she doubled checked it was actually $21 I …More,a year ago,Open,1000817693
Lady Boss,1.0,Do not order from here the Gm didn’t cut my pizza and just offered a $5 credit for it not being cut. FYI nothing on their menu is $5 even. All I asked for is a free replacement pizza... smh do better.,a year ago,Open,1000817693
Brendan Ross,1.0,"Consistently disappointing. Pizza should be a quick, easy thing to order. Delivery takes at least an hour longer than their estimate every time. My order today still has not arrived after two hours of waiting. They claim it hasn't been that …More",a year ago,Open,1000817693
Eugene Brown,1.0,"I'm done with this store, a much as I like Pizza Hut pizza I'm taking my business down the street to Domino's in the future. The service at this store is lousy (and that's an understatement)!",6 months ago,Open,1000817693
Chey C.,1.0,The guy fixing the pieces and dough did not wash his hands after rubbing his nose and then going to some other part of the kitchen before returning to kneading the dough and placing ingredients on the pizzas... will not be eating from here again. VERY UNSANITARY... the girl taking the orders was nice though.,a year ago,Open,1000817693
Lawrence Cash,3.0,"The cashier was nice, online said my order ready when it wasn't, order was not completely correct. Hope someone else has a better experience than I.",a year ago,Open,1000817693
Jessica Strickland,2.0,"Every experience I've ever had with this particular location is bad. They seemed to not only be understaffed, but the staff they do have often have bad attitudes, excuses, and lack of ability to do their jobs. I've also never seen another …More",a year ago,Open,1000817693
LilManley,1.0,"Ordered a pizza at 11:30, pizza didnt show until 12:50 and it was cold. Now I wasted my lunch at work waiting for a pizza to show that I ordered 30 minutes before my lunch when the delivery estimate showed 20-30 minutes.",11 months ago,Open,1000817693
Bruce LB,1.0,Horrible customer service.,a month ago,Open,1000817693
Lakeisha Dorsey,2.0,They were swamp...  and understaffed. The wait to order was 15minutes and there was no one in front of me. After I ordered my food I went shopping a few doors down to pass the time. When I got my food it was still warm but definitely not …More,2 years ago,Open,1000817693
Felecia Marley,1.0,Never had crunchy pasta until I stopped by this location,10 months ago,Open,1000817693
kaliyah clemons-haynes,1.0,I ordered my pizza at 8:36 and it currently 11 ok as I type this waiting for my pizza I am very upset and will not be buying from you guys,7 months ago,Open,1000817693
donna dennis,5.0,The Food Was Amazing. The Driver Had Good Customer Service & Timing Was Very Good. Everything Was Correct. I Will Definitely Order Again.,a year ago,Open,1000817693
Genese Staples,1.0,"Horrible!  I ordered my pizza and wings wayyyyy ahead of time, but when I went to pick them up, the wings weren't ready.  I asked them why weren't the wings ready when I had placed the order at the exact same time ... *crickets // blank …More",a year ago,Open,1000817693
jimmette Thompson,2.0,Terrible service was horrible got order wrong employees didn't have gloves on restuarant was dirty etc.,9 months ago,Open,1000817693
DIFFERENT BREED,1.0,DO NOT ORDER FROM HERE. IF YOU CAN CHOOSE DOMINOS DOWN THE ROAD. Absolutely disgusted with the customer service/employees here 😠. All the people have nasty attitudes. There is no reason why after 2 hours I still havent heard a word about …More,a year ago,Open,1000817693
Smiley Smiley,5.0,Great Supreme pizza,4 months ago,Open,1000817693
Mariama Outlaw,4.0,The pizza's was fresh and soooo good,11 months ago,Open,1000817693
Janae Holmes,1.0,I’m starting to believe that this Pizza Hut hires people who cannot read this is the second time I have came to this location and the order is the complete opposite wall of water water water pepperoni and bacon you give me cheese and olives.,7 months ago,Open,1000817693
Eddie Coss,1.0,"there are already smaller pizzerias that the ingredients are fresh, have more flavor and are cheaper, it is time for pizza hut to evolve",a year ago,Open,1000817693
EricGeno King,5.0,W wonderful great food great,6 months ago,Open,1000817693
Mary PVH,4.0,Decent customer service,4 months ago,Open,1000817693
Dionne Burton,5.0,Good pizza,2 months ago,Open,1000817693
Sally Murphy,1.0,Tracker said Pizza on the way! That was 40 minutes ago. I called to make sure driver was okay. They are now remaking my puzza. ☹,8 months ago,Open,1000817693
Tiara Renee,1.0,Waited hours for my order just for the driver to get to my house and say he forgot my food.... On another occasion waited hours just to be told that they cannot find the driver with my food... This place is a mess!!!,11 months ago,Open,1000817693
TheReal Mrs Mason,1.0,Ratchet they are rude and can mess up some orders,10 months ago,Open,1000817693
Mary Helvey,5.0,"It was better than ok, I just hit the wrong star. It's a good place for pizza",a year ago,Open,1000817693
Candace Freeman,5.0,My fav spot for Pizza. Great location to meet with friends. Nothing but great experiences here.,a year ago,Open,1000817693
chyann knights,1.0,Service sucks pizza was cold,10 months ago,Open,1000817693
Shajak Nieves,2.0,Good deals on line. Chairs available to sit and wait. The place is dingy. The food is ok.,a year ago,Open,1000817693
william bracy,1.0,Used to be the best pizza in town now they just Grease Grease and more grease,a year ago,Open,1000817693
Johnathan Quiles,1.0,Very unorganized so wait time was way above average. Once I got home the food was mad of very poor quality and the taste was very plain.  Not a pleasing experience for me this will not be a store that I will revisit.,2 years ago,Open,1000817693
Tiffiany Daniels,3.0,This place needs more professional people..called twice and had to go all the way up there to place my order...SMH,a year ago,Open,1000817693
Nate Criswell,1.0,very bad customer service the cashier was very rude our food was cold never going here again,9 months ago,Open,1000817693
Stitch McCain,4.0,Good food. Nice polite staff,a year ago,Open,1000817693
Paula Williams,5.0,"The guy who worked the front counter knew what he was doing and was fast.  The pizza I  ordered was the way I wanted it
Good job. It was my first time there would go back.",2 years ago,Open,1000817693
Rashaad Busch,1.0,"They delivery is terrible and time consuming.
And  the customer rep says any minute now when 5 min go by every call",10 months ago,Open,1000817693
Sir Cj Jaushlin,4.0,"The only issue, I could see being very hazardous/incident prone is the Christmas tree right by the door where the employees enter and the delivery drivers that come out with their orders pizza bags can hit the tree or the the employee can …More",a year ago,Open,1000817693
fluff ball,1.0,Wow every pizza hut that i have call dont deliver in the 32209 area thats crazy and sad oh well next.,a year ago,Open,1000817693
Whitney Hartsfield,1.0,Very poor customers service. They burn all the food. Do not pay attention to orders. Unsanitary I witness an employee I believe was the manager pull 2 pizza boxes out of the trash can throwing them on the counter where they service food.,a year ago,Open,1000817693
LEO AKEEM,1.0,Wat kind of business doesn’t answer their phone for 2 hours🤬👎,11 months ago,Open,1000817693
Lakisha Reyes,5.0,Great service,3 months ago,Open,1000817693
Tyrus Reed,1.0,Ordered online carry out and got there 30 minutes after ordering and food still wasn't ready. Other people were complaining about the wait as well. Nothing but idiots that work there.,2 years ago,Open,1000817693
UZ'ZENSHeRAH YisRaEL,4.0,VERY GOOD VEGGIE PIZZA!,a year ago,Open,1000817693
Monee Wilson,1.0,Dont know why I decided to give them 3 years to get their act together with better customer service and to modify their delivery service but I guess they just are content with being below average...so I will review and treat them AS such. …More,2 years ago,Open,1000817693
Madison Valentine,1.0,I ordered pizza from here and they never delivered it and still charged my card for it,11 months ago,Open,1000817693
Bryan Fluitt,5.0,Best pizza I ever ate,a year ago,Open,1000817693
Ledora Whitehead,3.0,Great pizza but they're always late.,a year ago,Open,1000817693
lashawndra lovings,4.0,Good,a month ago,Open,1000817693
Zi'Yah Adar Yisrael,2.0,Customer service is a 1 star and the food was a 1 star. Not going back to this place again,a year ago,Open,1000817693
mary panga,4.0,i met the manager he was verry nice. and  verry  busy .,a year ago,Open,1000817693
Didger Daniels,5.0,The pizza was awesome I ate it all in 15 minutes and the bread sticks was OMG thanks,a year ago,Open,1000817693
Daibaby Jackson,1.0,Placed order at 8:24 expected delivery time was 8:50. Called at 9:15 to check on delivery. Gilbert says because my number was wrong on the website its why I didnt get my delivery. So he corrected it. 30 minutes later still no delivery. ( …More,2 years ago,Open,1000817693
Gerald Sharp,1.0,Worst service ever poorly managed OMG staff member are very rude and disrespectful.....,a year ago,Open,1000817693
Kidmoneybag white,2.0,The cheese was burnt they said it like that then they gave us the wrong pizza,a year ago,Open,1000817693
Mo Chips,5.0,Love the fact that they have a drive thru. Service is always fast and friendly.,2 years ago,Open,1000817693
Maria Michalak,1.0,"We waited 2 hours for a pizza. We were told 80 minutes and 120 minutes later, it still was not delivered. Terrible, terrible, terrible service.",a year ago,Open,1000817693
KiMell Williams,4.0,Great service even when my manager friend wasn't there. 😀,a year ago,Open,1000817693
Tom H,4.0,Call from work on my way home. Stop by Pizza Hut pick a couple of pizzas up for dinner. It's that simple. Never had a bad pizza from PH.,2 years ago,Open,1000817693
Amanda Davis,4.0,Really needs help with staffing but they where wonderful it's extremely busy and could use a few more employees but other than that pretty good business establishment,a year ago,Open,1000817693
YakNoff_Quan,1.0,"I ordered my food today at 8pm and didnt receive my food until 2 hours later at 10:20pm. The delivery driver came to the door talking to someone on speaker phone while handling the transaction. To top the cake the pizza, cheese sticks and cinnamon sticks were all cold and was as stiff as the box it came in.",2 years ago,Open,1000817693
Klh Hm,1.0,AWFULL CUSTOMER SERVICE! The lady put me on hold twice and kept purposely hanging up.,a year ago,Open,1000817693
Azure Trio,1.0,"Employees and manager ignored me for over half an hour. They were busy calling people who made online orders, telling then they didn't have stuff. Never gave a rating bellow 3stars before. …More",a year ago,Open,1000817693
Sherry Parrott,5.0,"Love it, the pizza is always fresh and hot☺",a year ago,Open,1000817693
Kurt Irion,3.0,They make a pretty good pizza for Pizza Hut I usually get it delivered and it's usually here within 30 minutes hot and ready to eat!,2 years ago,Open,1000817693
chris wilkerson,1.0,Terrible service.  Was told my food was coming out of the oven....half hour later i had ti ask for my money back if it wasent done..ended up with cold old pizza. Terrible terrible will never return to this location,2 years ago,Open,1000817693
Chvon Merriweather,4.0,Fresh hot food,9 months ago,Open,1000817693
Lisa Daniels,1.0,I ordered a pizza & 2 liter soda to go. $17.00 is alot. So she tells me 15 min. 20 minutes later the board says 0 waiting time. No one calls my name or order. 15 more minutes goes by so I ask the guy if it's ready. He checks the oven and …More,2 years ago,Open,1000817693
Glenn Quagmire,1.0,"Wish I could give a negative star. The young lady that answered the phone had very bad customer service. I called and as soon as I tried to order she put me on hold and never came back. I hang up and called again, same thing. Third time …More",3 years ago,Open,1000817693
Valencia Williams,1.0,"Not enough people inside working, no hair protection is worn, the people that delivers come in not knowing rather they wash their hands also prepare pizzas",a year ago,Open,1000817693
Charles Brazell,5.0,Great food outstanding customer service. But a bad area to have a place like this customers verbally and physically abuse staff for a simple mistake,2 years ago,Open,1000817693
Katrina Oliver,1.0,Worst delivery experience and rude staff,9 months ago,Open,1000817693
Leonard Williams,5.0,Great Food and Service,a year ago,Open,1000817693
Tema V. Mitchell,5.0,"No one out PIZZAS THE HUT! my order was perfect, Hot and FRESH & TASTY!",a year ago,Open,1000817693
nene Brown,5.0,The bone in wings are my favorite and wednesdays they are on special .food always done within time frame,10 months ago,Open,1000817693
Curtis Coffey,3.0,"Cool place, takes a while for the pizza but its so good when you get it. Small location tucked away in the corner of a plaza. Service is fair nothing special.",3 years ago,Open,1000817693
Amber Coleman,1.0,"Piss poor service at this Pizza Hut location. They really do the community a disservice. They are late with deliveries, and mishaps with orders, terrible attitudes for customer service. An employee yelled at another employee to put a bullet …More",a year ago,Open,1000817693
Princetta R,2.0,"Please make sure you double check online orders, I've  just placed an order for a bbq stuffed crust chicken bacon pizza once it arrived they had put marinara sauce on my pizza. In the end they agreed to remake the corrected one.. All I'm saying is make sure you get what you pay for.",2 years ago,Open,1000817693
Chanel Engram,2.0,Pizza isn't great. You have to order extra cheese to have cheese on all your slices.,a year ago,Open,1000817693
Desmond Jackson,1.0,Ordered pizza over an hour and a half ago. I've been up to the store twice seeing that I live right down the street. The store has been closed for 37 mins and still nothing. The manager said he's on his way. FROM WHERE!?,2 years ago,Open,1000817693
Mrs WIMP Gaffney,5.0,👌,9 months ago,Open,1000817693
Jonathan Pate,4.0,Love the pizza,10 months ago,Open,1000817693
Autumn Hendrix,1.0,ABSOULUTELY horrible service! I placed an order at 4:21 P.m. for a delivery at 7:00 P.m. Monday night October 23rd 2017. At 6:45 P.m. I got a text message saying my order was out for delivery. My boyfriend then say outside for over an hour …More,3 years ago,Open,1000817693
Breona Bradley,1.0,On easter i waited over a hour (after the quoted delivery time) for 3 med pizzas.. when they finally got here two out of 3 were wrong.. i called the call center and was told id have a  credit.. just called tonight 4/25/17 and was told by …More,3 years ago,Open,1000817693
Renee L,5.0,"They messed up our order and redid it perfectly no questions asked. Very friendly, great service.",3 years ago,Open,1000817693
Niquanda FieldsMcNeal,2.0,Friendly in person too playful on the phone when taking orders or giving info,2 years ago,Open,1000817693
K L,1.0,"This review pertains to Pizza Hut overall, not necessarily that of this store. They have advertised a 7.99 large 2 topping as ""the best delivery deal"" both on TV and online. But when you go to order the 7.99 deal it adds a delivery fee of …More",3 years ago,Open,1000817693
Ashley Kitchen,5.0,I love this store they make the pizza with love especially the night crew,3 years ago,Open,1000817693
Mk ultra,1.0,Black lady on the phone was incredibly ghetto it's 10:28 on a friday April 6th... this is the 4th time I've had issues with this Pizza hut and specifically with the lady who I spoke with on the phone... each time ive been told ive had a …More,2 years ago,Open,1000817693
Swaggboy Killa,1.0,Horrible called and was never able to place an order called back after being on hold for 20mins no answer,a year ago,Open,1000817693
Tiffany Connell,4.0,Food,5 days ago,Open,1000817693
Shantelle Murrell,1.0,"I placed my order at 8pm. Waited an hour,no pizza. I called and spoke with the manager Courtney, who assured i woyldrecieve within 45 min. Well, an hour and half later still no delivery. …More",4 years ago,Open,1000817693
Nikki F.,4.0,"The store is clean and staff is friendly. No dining room for eating indoors, but their carryout orders are always piping hot and their estimated delivery times are very accurate.",3 years ago,Open,1000817693
Clarence Bolden Sr.,5.0,Good quality services,3 years ago,Open,1000817693
Raw Scopes,5.0,The Manager Natasha has been exceptional she's always involved and there to fix any problem that comes the stores way I think she should be able to run her own store she is awesome very professional!!!!,4 years ago,Open,1000817693
Christopher Fearon,1.0,"3:49pm on Monday.  Day after Christmas.  I guess I shouldn't  expect much!  Called in order and they didn't appear to start until after I came in and paid.  I read an online article for 10 minutes,  then went to save a lot and came back and still not ready.  Terrible  service!  It was not like this  in the past.",3 years ago,Open,1000817693
Andrew Junk,3.0,Found some type of plastic in the cheese ......... was probably just a piece of the wrapper from cheese packaging or something..... but still.... come on ..... would a little bit of work ethic kill you?,5 years ago,Open,1000817693
T. Delrio-Wright,1.0,"The girl at the counter was really rude and cold. I wish I would have gotten her name. But she was light brown skinned with a chest tattoo and a horrible attitude. We didn't even wanna wait inside, we sat in the car for the 20mins we had to wait. She wouldn't even greet us upon arriving.",4 years ago,Open,1000817693
Michelle Sheffield,3.0,Depends on who is on duty for whether you received I've great pizza and great service,3 years ago,Open,1000817693
Sidney Montfort,5.0,It was great quality service,3 years ago,Open,1000817693
Tis'ha Fulton-Law,1.0,My order was wrong and the pizza was crunchy. I can not get know one on the night shift to answer the phone so I can get this matter resolved,3 years ago,Open,1000817693
Rosilyn Strawter,5.0,There food is awesome great customer service,3 years ago,Open,1000817693
