name,stars,text,timeSince,openStatus,key
Maritza Mendoza,1.0,Came with my husband and brother the food was under cooked and pizza had no sauce never again 😡 the only thing that was good was the Pepsi,3 years ago,Closed,1000816658
Vhugo Glez,1.0,Not good service I'm not coming back to this place again.,a year ago,Closed,1000816658
PATRIC FINLE,1.0,Never have pizza wings stick run outta food on north avenue,a year ago,Closed,1000816658
Shakila Khan,1.0,Wow. Horrible place. I waited over two hours at midnight for pizza and it never came and they still took money out my account. And when I tried to call them they hung up on me. Worse place ever!,2 years ago,Closed,1000816658
DurtyDan,1.0,"If you're somehow forced to get food from Pizza Hut and this one in particular, don't. I was feeling lazy and got delivery even though my house is two blocks away and they somehow took over an hour to get me my food, so of course it was cold. They even managed to get the simplest part of my order wrong. Avoid at all costs.",3 years ago,Closed,1000816658
Jeremy Johnson,1.0,These reviews are no joke... Let's just say I forgive the 2.5 hours for delivery and then my pizza is cold like it's been sitting out for two hours and my garlic bread is cold and they didn't give me any sauce. The manager delivered my food and I could tell he hated working there. I mean are you guys even trying?,3 years ago,Closed,1000816658
Eugene Williams,5.0,Very Good Place,a year ago,Closed,1000816658
Calvin Russell,5.0,Store is under new management. I called the store and asked to speak with the manager. I told her about the bad reviews in Google and how I wanted to help fix a problem instead of just complaining about it. She made sure my order was …More,3 years ago,Closed,1000816658
Vretta Taylor,5.0,Never visit must was near by,10 months ago,Closed,1000816658
Alejandra Coria,1.0,Worst Pizza Hut ever. Who ever answered the phone should be fired. Rudest customer service I have ever received in my life.,3 years ago,Closed,1000816658
Bobbie Davis,1.0,"Wrong order, burnt food, cold food",a year ago,Closed,1000816658
Miguel Angel Rodriguez,1.0,Seems like they need better management.,2 years ago,Closed,1000816658
Shady Medina,4.0,Good Food And Cheap Pizza $6 Mediums Dessert are good to.,2 years ago,Closed,1000816658
Living In The Truth 4 Life,3.0,Didn't Have Salad Or Salad Bar,2 years ago,Closed,1000816658
Winter P,1.0,This place needs a makeover starting with the managers to the employees... Worst customer service ever!! Bad attitudes.. GO SOMEWHERE ELSE TO SPEND UR MONEY!!!!,a year ago,Closed,1000816658
marula H,1.0,They take too long ...very unorganized,a year ago,Closed,1000816658
Tarsha Patterson,5.0,Love the meatlovers pan,a year ago,Closed,1000816658
Amelia Martini,1.0,"The worst customer service ever!! The rudest people work in this place.

I ordered online and never got my food. After one hour wait and several calls to …More",3 years ago,Closed,1000816658
Doilgoly PLAYZ,1.0,"Took forever to get our delivery order and than was missing one of our pizzas. The delivery guy was nice but when I called the store the guy was ridiculous, rude and was refusing to make or deliver the missing pizza. We did an online order so it was clear we ordered and paid for 4 pizzas. Will never go to this Pizza Hut again.",3 years ago,Closed,1000816658
Donna Bella,1.0,"This location has terrible service.  Lazy employees with attitude problems.  Deliveries are always over an hr late and today the huge lady manager if she is one, wouldnt let me purchase my pizza with a credit card without showing id. I told …More",2 years ago,Closed,1000816658
Mundo R,1.0,"Horrible service & ignorant employees, & of course 🍕 lookin like their elbows, dry as hell lol not even lying pizza had no sauce barely any cheese and wasn't even correct. Their pizza wasn't even freshly made it was nasty🤢 dried out even …More",3 years ago,Closed,1000816658
Rafael Phillipps,1.0,Pizza was stale and cold and the wings were cold just a very very disappointment cuz it was so bad and very inedible you guys. I'll never buy pizza from pizza hut ever again.,2 years ago,Closed,1000816658
Crystal Frazier,5.0,Cant go wrong eatting 🍕,2 years ago,Closed,1000816658
Sharita McNeal,1.0,Rude delivery took way to long they don't need online delivery because they not equipped to handle that type of business,a year ago,Closed,1000816658
Stephanie Palencia,1.0,If I were the Area Coach I would be really dissapointed of this Restaurant and should close this one down. As a current Shift manager of another EYM Pizzahut in the South side I know when are the Do's & Don'ts when handling a unsatisfied …More,3 years ago,Closed,1000816658
Samelia Martinez,1.0,We placed an order waited beyond and hour. Called the place and employees ( manager ) kept playing and clicking on us. We will be filing a huge complaint with corporate.,a year ago,Closed,1000816658
Maria Vega,1.0,"Order was late for 30 minutes, they forgot my soda order was wrong first and last time I order from this restaurant HORRIBLE SERVICE.",a year ago,Closed,1000816658
anna moran,1.0,"Worse ever!!!
Waited over 3.5 hours and kept calling and got tons of excuses and then finally was told they have no idea where driver or food is and not sure what they could …More",3 years ago,Closed,1000816658
Mario Cruise,5.0,Got in and out fast,a year ago,Closed,1000816658
Tarnisha Rice,1.0,They need a whole new crew. Everyone that works the register has a bad attitude. They are so unprofessional and rude. The only reason I gave a star is to put up a review. I will never go back here again. I see why they rate 1.7. No customer …More,4 years ago,Closed,1000816658
Abimael Reillo,1.0,Rude no customer service standards and they don't even know their menu. The lady on the phone had explain to her one of their deal s.,2 years ago,Closed,1000816658
Clinton thomas,1.0,Very disrespected. I made an order which I was first told my area don't deliver(which was a lie because I ordered before) than was told it would take two hours to deliver but when I gave them two hours plus I never got my delivery and no one answered when I tried calling..,3 years ago,Closed,1000816658
kimberly robinson,1.0,"We placed an order online and paid for it as well and after an hour of waiting, I called to check on the order, gave the lady my number and she said the driver will be there shortly. Another 30 minutes go by so I call back to be told my …More",3 years ago,Closed,1000816658
TheChimoReport Arcelia Kailan Chimo,1.0,"THE WORST

This pizza hut is approximately 2 to 3 blocks from my house. My pizza was …More",4 years ago,Closed,1000816658
Bernardine Robinson,1.0,"Well, the service was nice the young lady was very thorough in explaining of a cost effective pizza order. However the next day when I went to eat some of the pizza It had mold on it.",3 years ago,Closed,1000816658
Frank Ramos,1.0,Wish I could pick 0 stars. Walked in & had about five people see us and we're never attended. We were told to go ahead and seat yourselves then we're told who seated you. Only waitress on the job saw us and never bother to come by and ask …More,5 years ago,Closed,1000816658
Anai Herrera,1.0,"Worst service ever, I asked for lite marinara and they put extra I also ordered sticks and did not receive them but did wanted to charge them, they took time to get our order and serve our drinks, we asked for some ranch and We had to go get it...",a year ago,Closed,1000816658
Mario Castillo,1.0,The worst customer service. Don’t order from here,a year ago,Closed,1000816658
David G,1.0,Server jamicka 🕳was very rude treating me like if I was a bother to her just to order my food. and then charge me for stuff and did not tell me what she was charging me for when I ask her for what she was charging me for she was even more …More,4 years ago,Closed,1000816658
Manuel Ramos,5.0,Great,a year ago,Closed,1000816658
Mary J Havard,5.0,I love pizzza,a year ago,Closed,1000816658
Michele Duckworth,1.0,I'm so disappointed in this whole experience. The dining room was atrocious my children were uncomfortable with the filth. They gave my little children giant cups claiming those were all they had... The cups had all your of unknown …More,5 years ago,Closed,1000816658
Janecia Pearce,1.0,"I wish I could give no stars. I called every pizza hut around my apartment and none of them deliver here, even though I'm only around 10 minutes away. You guys really need to fix that",2 years ago,Closed,1000816658
Gabriel Dascal,1.0,They cooking without gloves and no hats ...i hope more people calls 311 on them we can get sick,a year ago,Closed,1000816658
Lovely Antunez,1.0,ORDERED AT 7PM & CALLED THE STORE BACK A HOUR AND A HALF LATER TO CHECK ON MY ORDER AND SAID IT WAS ON THE WAY ALREADY. GOT A CALL BACK AT 9:47 STATING THEY WEREN'T GOING TO DELIVER BECAUSE THEIR CAR BROKE DOWN. MY SON WENT TO BED …More,3 years ago,Closed,1000816658
Zina Bonds,3.0,The at this location has gone down since they first open. Waited 8 min to be seated an there was no floor coverage at all My waiter just left now who's going to box my and bring me the check great service at this location,7 years ago,Closed,1000816658
MaeLove,3.0,"The hostess was nice and friendly, the food was hot and tasted good I've never had a bad experience there.",3 years ago,Closed,1000816658
Dulelandia Fullerton,1.0,Dominos is better. This message is Dulcelandia approved. I have not recieved my order and i've been waiting since yesterday lmfao,3 years ago,Closed,1000816658
cindy ortega,1.0,Every single employee I talked to when I had an issue with my order had a rude attitude. Delivery girl had no manners. Pizza Hut needs to hire new people.,a year ago,Closed,1000816658
Albert Vasquez,5.0,Thank you for your help and support my work schedule,3 years ago,Closed,1000816658
WeTheCrew Efree,1.0,This place doesn't know how to take orders or cook pizzas.,a year ago,Closed,1000816658
sk8s,1.0,THERE WAS A HAIR ON MY WING DUDE . IT TOOK AN HOUR AND 30 MINS TO DELIVER WINGS,3 years ago,Closed,1000816658
kimberly azpeitia,1.0,This has to be the worst pizza hut location. We ordered and they messed up our order. The workers are to lazy and had us on hold for 10 min yess just to speak to a manager. There was no one at this kocation so they were not busy. I am very …More,3 years ago,Closed,1000816658
Nemesy Aguilar,3.0,I only like the wings and stuffed crust pizza. Didn't really asked for drinks staff was nice.,3 years ago,Closed,1000816658
baloyevolution8,1.0,45 min to jet my pizza,a year ago,Closed,1000816658
Henry Asmal,1.0,you have to wait 2 hours for a pizza,a year ago,Closed,1000816658
Carlos Cordero,4.0,It was good pizza and pretty chill,2 years ago,Closed,1000816658
Ash Mat.,1.0,Don't even bother with this place. Waited two hours for an delivery....Called two times. Never got an apology or anything. I live 10 mins away >_> very disappointed. This place need new management.,6 years ago,Closed,1000816658
Mireya Carrera,1.0,Rebecca the opening manager is not fit to be a manager. Doesn’t now how to be respectfully to costumers and doesn’t know how the run the restaurant,2 years ago,Closed,1000816658
Dyone Dorsey,3.0,The pizzia is ok here..,2 years ago,Closed,1000816658
Tabatha Parks,5.0,Food was fresh.,a year ago,Closed,1000816658
Ashley Ciriaco,1.0,They take 2 hours to deliver food and are super rude. I will never be ordering from here again.,3 years ago,Closed,1000816658
marilyn Cruz,1.0,"Worst services ever call @ 8:47 said im 25 mnts
Call back @9:30 said was in my way calll bak @ 10:  they said cnt fiebd my order talk to the supervisor she apologys ns ask if i can wait for mnt nothin call …More",4 years ago,Closed,1000816658
bone yungmoney,5.0,One of my fave pizza joints,2 years ago,Closed,1000816658
better late than broke,3.0,Good food,a year ago,Closed,1000816658
Giselle Perry,1.0,Just get a new staff because they're horrible,2 years ago,Closed,1000816658
Josette Miller,4.0,Good pizza,a year ago,Closed,1000816658
Erik,1.0,We have no idea how corporate has not shut down this location.  How hard is it to not burn a pizza and breadsticks?  Trust the reviews you see here and on yelp.   Somebody call the health inspector,4 years ago,Closed,1000816658
Tony anderson,2.0,"They don't cook the food right, and their service is horrible. Close this place down!",8 years ago,Closed,1000816658
DL Weems,1.0,"i wish had read the reviews before i came here. but when kids are out with you,theyare hungry the commercial kicks in...You Stop...     IF I HAD IT TO DO OVER....i CERTAINLY WOULD NOT HAVE PAID THEM A DIME( but didnt want to spoil the great …More",5 years ago,Closed,1000816658
Nicholas Mack,1.0,Dirty and trashy establishment....food not the best at all! Dine in experience is horrible!,2 years ago,Closed,1000816658
Noctis,1.0,Horrible service and delivery sucks. You'd be better off buying frozen pizza.,3 years ago,Closed,1000816658
John Elias,2.0,Come on its pizza hut. You know exactly what you are going to get.,a year ago,Closed,1000816658
Khallid Muhammad,3.0,Decent pizza,a year ago,Closed,1000816658
Lionell Gowdy,5.0,The food was good,a year ago,Closed,1000816658
Oscar A.,1.0,"Waited almost 3hrs. And yet i never got my pizza and this manager said she called me mulitple times just to say the order was cancelled... yelled at me, and hung up at me",3 years ago,Closed,1000816658
dayona jenkins,2.0,One Person Had A Attitude  And They Burned My Pizza🙄,a year ago,Closed,1000816658
Melissa,1.0,I've tried ordering from this Pizza Hut twice and I've never gotten my food. After 2-3 hours I just give up and call to cancel my order. They didn't even apologize when I called to cancel.,5 years ago,Closed,1000816658
cesar ortega,1.0,Worst service ever and all tables dirty af*,2 years ago,Closed,1000816658
Dawn Jenrich,1.0,"Wish i can give negative stars. Absolutely completely the worst place. Walked in the order out and took almost 10 minutes to get started with my order.  Ordered 3 pizzas and only got 2. As they were making the pizza,  I saw an employee grab …More",5 years ago,Closed,1000816658
LaTasha Ranson,1.0,"My daughter, mother & myself decided to eat lunch there one day. It was 2pm and we ordered pizza, pasta, breadsticks & wings. 30 mins later...here come the wings. How does wings come our the oven b4 breadsticks!!!! 15 mins later came …More",8 years ago,Closed,1000816658
Elizabeth Torres,3.0,Not the best .. but ok,a year ago,Closed,1000816658
Noga Robertson,5.0,Great place,a year ago,Closed,1000816658
kiarra brown,5.0,Cool food,a year ago,Closed,1000816658
Lilybelsky,1.0,This place is sooooo bad the employees are so unprofessional you make a order dont get it till 2 hours almost 3 hours later then don't even get your whole order then you call them they have attitude horrible you go there its even worse never ordering from here again I hope no one does if you want a messed up order then be my guest,3 years ago,Closed,1000816658
Koeysha Press,1.0,I ordered a pizza online and got a text saying that my order is being delivered 20 minutes after. I live 6 minutes away it's been 35 minutes I called and the lady said that my order will be delivered when the driver gets back.  It has now been a hour and we have no food... Don't order from here,3 years ago,Closed,1000816658
Jamila Khan,1.0,Nasty and RUDE people,a year ago,Closed,1000816658
Cassandra Salgado,1.0,So apparently you can’t order if you aren’t an adult and when I went to go eat there the service was trash ::,2 years ago,Closed,1000816658
Jimmy Smith,1.0,Disgusting pizza and employees!,a year ago,Closed,1000816658
Ms Juicy,5.0,Great tasty pizza,a year ago,Closed,1000816658
Mario Pons,1.0,This place truly sucks! My pizza was stuck to the cardboard box!,4 years ago,Closed,1000816658
FoxChambers,1.0,ALWAYS mess up your order! Picked up from here twice and they hadn't put my extra sauce or extra pepperoni then tried to low and say 6 pieces of pepperoni IS extra...AVOID THIS LOCATION.,2 years ago,Closed,1000816658
Victoria Gonzalez,1.0,RUN.. THIS PLACE IS DIRTY AND UNPROFESSIONAL,a year ago,Closed,1000816658
Jose Gonzalez,1.0,Short staff and the employee at register was a bit rude.,a year ago,Closed,1000816658
Terina Buckley,1.0,Like who ever makes the pizza must can’t read they never put what u orderd on the pizza.,2 years ago,Closed,1000816658
Jay Flores,1.0,"2 hours for a delivery...lol
Plus rude people on the phone. No thanks",3 years ago,Closed,1000816658
Kynisha Greene,1.0,Tenisha the Manager very unprofessional..If she remove that nappy ass weave from over her eye she would be able to see,3 years ago,Closed,1000816658
Marcellus Dean,1.0,They can’t cook and then they’re late asf with delivery just go to another one,2 years ago,Closed,1000816658
Carolyn Kearney,1.0,Don't eat pizza,a year ago,Closed,1000816658
Greyz Ciriaco,1.0,"Worst service ever! I order my food and it took almost 2 hours to bring me my food, when i called to complain and cancel my order they just told me over the phone that it would take 5 to 7 days for them to replace my money back in my acc!! Rude people, horrible service,  they should close down this place!",3 years ago,Closed,1000816658
ROMULAN96,1.0,This place is bad. If you can pass and go elsewhere... please do.,2 years ago,Closed,1000816658
Luis Miranda,4.0,Great food,a year ago,Closed,1000816658
lawrence sandifer,5.0,Good pizza,a year ago,Closed,1000816658
Brandon Capalot,3.0,Bc the pizza is okay,a year ago,Closed,1000816658
Elizabeth Sanchez,1.0,"Very bad service
Order online paid
Not here on time",3 years ago,Closed,1000816658
Ronald Gaming 271,5.0,Good,a year ago,Closed,1000816658
Maria Rosario,3.0,Ok,a year ago,Closed,1000816658
Brian Hale,3.0,Good pizza,a year ago,Closed,1000816658
Jamar Jackson,5.0,Good,a year ago,Closed,1000816658
Montez Everett,5.0,Delicious,a year ago,Closed,1000816658
Rocio Mendoza,1.0,Low quality food...,a year ago,Closed,1000816658
terence williams,2.0,The quality of pizzas have went down,2 years ago,Closed,1000816658
A D AD,5.0,Love everything about it,2 years ago,Closed,1000816658
Brandon B,5.0,Good sauce,2 years ago,Closed,1000816658
LaMicShaya Kelly,4.0,No complaints,a year ago,Closed,1000816658
Lakesha Holmes,5.0,I love pizza,2 years ago,Closed,1000816658
Hunda Civic,5.0,Love it,a year ago,Closed,1000816658
Joan Lowe,3.0,It's ok,a year ago,Closed,1000816658
Aarron Van Buren,5.0,Came within the time frame!,a year ago,Closed,1000816658
king spanky king love,5.0,Love it,a year ago,Closed,1000816658
Kevin Carrillo,1.0,"Ordered a pizza, gave my CC and waited for 30 mins on hold- then they hang up on me. Called them back and they claim they never placed the order and I never called them. (There's phone records on cell phones with time stamps!) This Pizza Hut commits fraud!!!",3 years ago,Closed,1000816658
sergio jimenez,5.0,Good.,a year ago,Closed,1000816658
Denise Dorantes,1.0,HORRIBLE PLACE....TAKE FOREVE TO DELIVER AND PERSON PICKING UP THE PHONES IS SUPER GHETTO!!! DO NOT EAT HERE.....,6 years ago,Closed,1000816658
Carol Casual,1.0,Waited forever for a thin slice of pizza. Not worth it.,2 years ago,Closed,1000816658
Gwendolyn Wright,1.0,Dry as hell and burnt,2 years ago,Closed,1000816658
Deon C,1.0,Wordt pizza hut ever they get your order wrong then wont send you the pizza you order back this place should be shut down asap,4 years ago,Closed,1000816658
Kleber Paguay,1.0,No good,a year ago,Closed,1000816658
Em Jmagik,1.0,Horrible took 2hrs for delivering and plus i would call for info on my order and kept putting me on hold and hung up,4 years ago,Closed,1000816658
nassoro ally,3.0,Good pizza,a year ago,Closed,1000816658
Taylor Schulhof,1.0,Horrible experience. Waited over 2 hours for our pizza.,2 years ago,Closed,1000816658
J Drummer,3.0,Great pizza,a year ago,Closed,1000816658
Fabian Delgado,5.0,Good,a year ago,Closed,1000816658
Barbara Hardy,5.0,Good,a year ago,Closed,1000816658
sonny baez,1.0,"Crappy pizza, establishment wasn't ready for sit in customers, took long to get refills..... very ghetto.",2 years ago,Closed,1000816658
blankmanh,1.0,Terrible service,a year ago,Closed,1000816658
claudette cobbins,4.0,Gooooopd food,a year ago,Closed,1000816658
Marvin Helton,2.0,Don't like,a year ago,Closed,1000816658
Angela Parker,5.0,Nice and hot,2 years ago,Closed,1000816658
Nicole Jones,5.0,Love it,a year ago,Closed,1000816658
Lavonda Brown,5.0,Very nice,2 years ago,Closed,1000816658
Lick You,5.0,Love it,a year ago,Closed,1000816658
Christine Prado,4.0,#bestservice,a year ago,Closed,1000816658
Julio Rodriguez,3.0,Good food,2 years ago,Closed,1000816658
Rich Walas,5.0,Awesome,a year ago,Closed,1000816658
Marcus Stokes,2.0,Cool,a year ago,Closed,1000816658
James Sloane,5.0,Need more pizzas,a year ago,Closed,1000816658
CODM,5.0,Best pizza ever,2 years ago,Closed,1000816658
Miguel Banegas,1.0,"I ordered 2 pizzas that never came, I was waiting for hours. very poor service",3 years ago,Closed,1000816658
Carolyn Hardnick,1.0,Too long of a wait,a year ago,Closed,1000816658
maureen mendiola,5.0,SOOO DELICIOUS !!!!!!!!!!,a year ago,Closed,1000816658
Jocelyn Perez,5.0,😀😁,a year ago,Closed,1000816658
Sammie Lane,5.0,",",a year ago,Closed,1000816658
Aj Sneed,1.0,Ghetto,a year ago,Closed,1000816658
Ronald Wilson,1.0,No way,a year ago,Closed,1000816658
E.Honcho Slime,1.0,Never answer 😡,2 years ago,Closed,1000816658
Fredrick Fleming,5.0,Great!!!,2 years ago,Closed,1000816658
CLEVELAND WILLIAMS,5.0,Good,a year ago,Closed,1000816658
Tawana Elam,3.0,Cold pizza,a year ago,Closed,1000816658
Barbara Boyce,5.0,Good,2 years ago,Closed,1000816658
Jenny Ramirez,1.0,"Very poor customer service. Not only was my order incorrect, but not once did the serve ask if we needed anything else.",3 years ago,Closed,1000816658
Jose Perez,1.0,Rude staff and when standing there they don't acknowledge you.,3 years ago,Closed,1000816658
wilghem pitre,1.0,Its unbelievable that a customer got to WAIT 2 HOURS ! for a pizza delivery I called more then 2 tines a week so make the number and sew the loss.,3 years ago,Closed,1000816658
jose palencia,1.0,This place stinks rude employees Becky!!!!,3 years ago,Closed,1000816658
Eliana Najera,1.0,Worst experience with service!!!,3 years ago,Closed,1000816658
TheAlphamale4,5.0,Very Professional Service,2 years ago,Closed,1000816658
Camerino Izaguirre,1.0,"In my 8 year old son words ....""pizza is garbage""",3 years ago,Closed,1000816658
Jordann Thomas,1.0,Terrible customer service. Manager always has terrible attitude towards customers. Dirty establishment. Very disapointed.,4 years ago,Closed,1000816658
Kharisma lawrence,1.0,I've ordered from this Pizza hut at 6:10pm... It is now 9:05pm and I still haven't gotten my order. I literally live less than 5 minutes from pizza hut. This is just ridiculous.,2 years ago,Closed,1000816658
Mary Nunes,1.0,Ordered my pizza online at 9:58 PM. Still haven't received my food and it's ten minutes to one. I'm 6 months pregnant and starving. Why me,3 years ago,Closed,1000816658
weird things,4.0,Good service,3 years ago,Closed,1000816658
Fanny OG,1.0,Delivered me a cold pizza ! After 1 hour,3 years ago,Closed,1000816658
ANNIHILATOR 1000,1.0,Delivery is the worst I've ever had the food arrived cold and 2 hours late if there was an option to give them 0 stars I would choose it dont waste your time call somewhere else period,3 years ago,Closed,1000816658
Rosario Jula,1.0,Not good😣😣😣😣the service,3 years ago,Closed,1000816658
Karen Rucker,1.0,Ordered online at 4:44pm for a delivery.....it is now 6:58pm...still no pizza!! Expected delivery time was 5:35pm! Unacceptable!,3 years ago,Closed,1000816658
Rosie Pippens,2.0,Service is slow,3 years ago,Closed,1000816658
K,1.0,no stars never got my order for delivery thats just bad service,3 years ago,Closed,1000816658
Tania Hernandez,1.0,Have really bad service just rude!!!,3 years ago,Closed,1000816658
Jonathan Nagy,1.0,Delayed pizza and no customer service. Pick another Pizza Hut.,3 years ago,Closed,1000816658
B K,2.0,Kinda rude,3 years ago,Closed,1000816658
Deboraha Brown,1.0,The customer service here sucks the manager Becky does not realize that the customer is who she needs to satisfy not her fat pockets you can't make a customer buy something they didn't order and refused to give them the order they did make Pizza Hut on North Avenue and Cicero bad idea poor customer service very very slow,3 years ago,Closed,1000816658
Sheree Kemp,3.0,It okay,3 years ago,Closed,1000816658
Dominique Jackson,1.0,Worst place ever,3 years ago,Closed,1000816658
Adriana Fernandez,1.0,I called like 6 times and they kept leaving me on hold and hanging up!,4 years ago,Closed,1000816658
Richard Aguilar,1.0,This place ratchet ratchet,4 years ago,Closed,1000816658
Vectormx 01,1.0,This place really sucks...they got my whole order wrong and put whatever order they want not yours this place needs to be shut down or get a entire new staff because I don't know how this place is still there,4 years ago,Closed,1000816658
Bulin Larrasolo,1.0,"GARBAGE SERVICE,  GARBAGE DELIVERY, GARBAGE SERVICE BY PHONE, ..........",4 years ago,Closed,1000816658
Lucy rodriguez,1.0,I called and was on hold for 20 min and then they hanged up..the service is horrible and they are never polite..and they take to long..,4 years ago,Closed,1000816658
Brandon,4.0,Kids fav pizza place,4 years ago,Closed,1000816658
Jeranjelis Barrandey,1.0,"Shouldn't even have a star I just called and asked a question for my order the "" manager"" wants to ask where's my mom ,so what now teenagers can't order food ? What a lack of attitude from a grown women as a manager .",4 years ago,Closed,1000816658
Tania Rivera,1.0,Worst service ever call for pickup at 8:30 is 9:20 n still here BS,4 years ago,Closed,1000816658
