name,stars,text,timeSince,openStatus,key
Jessica Eiswert,4.0,"More food choices...maybe a quesdillia or nachos. Pizza is good but if there are people in the house that dont eat pizza, you are FORCED to go elsewhere. Would love to just go to 1 place.",6 days ago,Open,1000817902
Kathy Cramer,4.0,Usually pretty good here. But last time i ended hanging up on the employee while placing my irder bc it was going on 9 min of placing an order for 2 pizzas! Tried again a couple days. Ordering was fine (carry out). But when i picked up my …More,a year ago,Open,1000817902
lana tr,1.0,"Their pizza tasted cheaply made. The crust was horrible. I am not a fan of most frozen pizzas, but they are generally better than Pizza Hut’s.  In the old days (plus 15 years) this used to be a great place for delicious pizza, but the taste …More",4 days ago,Open,1000817902
tyre jay,5.0,"I have been a customer since 1976.  Have taken out and eaten in, food always of high quality, hot and friendly service.  People at Havre de Grace Hut are great.",3 weeks ago,Open,1000817902
Linda Eaton,5.0,Take my great neice and nephew here a few times a month. Food is always great here...,2 years ago,Open,1000817902
Erin N,1.0,"I ordered breadsticks with cheese, which is a favorite for my family, and they were TERRIBLE!  They were overcooked, dry, and only had cheese dumped right in the center.  There was no cheese on the two outer sticks and only cheese in the …More",4 weeks ago,Open,1000817902
James Kotz,4.0,"Open inside for socially-distanced dining, fast service, good pizza.",3 days ago,Open,1000817902
Larry Souder,5.0,We love the Thin & Crispy with 2 or more extra topjngs. We've not had any problems  with these pizzas ... great tastes ...real consistency.,3 months ago,Open,1000817902
Kathy Roupe,5.0,Asked for extra sauce on each pizza and each one had it. Ask this constantly at other places and never get it.,a month ago,Open,1000817902
Alec Rollins,1.0,"Curb side delivery was a failure. The app was asking me to notify when I arrive. It then suggested I call the store, which I did. 25 minutes later, I walked in, to be informed they were waiting to see my pickup on their screen. …More",5 months ago,Open,1000817902
Alicia Erion,5.0,"Food is good, hot, employees are friendly and efficient",3 weeks ago,Open,1000817902
Christina Lester,1.0,"I ordered from here today my lunch was late. I called the first time the girl on the phone said she was new when I asked about my order and asked if they could call the delivery driver. She put the manager on the phone, whoever she was; she …More",7 months ago,Open,1000817902
Jedidiah Brown,2.0,"When calling Pizza Hut to inquire on deals and place a delivery order, I never thought I would have been greeted by someone that was agitated to take my call. Evan seemed very irritated that I asked question about deals found on the website …More",8 months ago,Open,1000817902
victoria shores,5.0,Nice I don't want to cook EVERY SINGLE MEAL,6 months ago,Open,1000817902
Aaron Moore,4.0,"Great service. Menu is condensed and easier to find your choices. Drink choices are not listed, as they differ by location.
Visited near Halloween so their decorations are on Display. Nice and scary. Mints are available for the kids.",a year ago,Open,1000817902
Michael Herrin,5.0,"This place is so under rated. Its a great place. Great pizza and reasonable prices. Staff is always friendly. The restrooms are clean. Stop in and have a meal, you will not be disappointed.",a year ago,Open,1000817902
Timothy Morgan,5.0,"Great pizza, and atmosphere for your family or friends. Many times I would take my date there and the night would be a true success! Casual dining with the best pizza lunch specials .",a year ago,Open,1000817902
Wensday Duncan,4.0,kind of hit or miss. sometimes my food comes out correctly and sometimes the bread sticks or pasta is missing the topping. the employees are friendly though and it is always done in a timely manner.,a year ago,Open,1000817902
Frank Jackson,4.0,Takes like a pizza hut.  You can walk in for pickup on either side,5 months ago,Open,1000817902
Gordon Dix,4.0,Great place to get a pizza!,4 months ago,Open,1000817902
Janella Johnson,4.0,Carry out and pizza was ready and very hot when I got home.,11 months ago,Open,1000817902
Glenn G,5.0,"Called our order in, it was ready when we arrived. Pizzas were prepared correctly and not burnt. Pizzas were very good, and order was accurate.  Staff was presentable and friendly, restaurant was clean, did not visit restroom.  Would recommend,  this location has greatly improved.",a year ago,Open,1000817902
David palm,5.0,tasty food,3 weeks ago,Open,1000817902
Katina Copeland,5.0,The food was good a d hot and the people  was nice,a year ago,Open,1000817902
erica johnson,3.0,I love this pizza more than any other! However I always get delivery and it cost just as much as the food. I order two $6.00 pizzas and my total was $18.94 plus the drivers expect a tip. One day the driver was a older person and just keep …More,a year ago,Open,1000817902
Sandra Catinello,3.0,"This restaurant was as expected. First of all, when we initially ordered water, the waitress said the water in the restaurant was not running and they were out, which is concerning. Therefore, she made us order fountain drinks only to come …More",a year ago,Open,1000817902
Shawn Buchanan,5.0,Service was excellent staff was very pleasant and pizza was good.,10 months ago,Open,1000817902
le souder,5.0,Good pizza ... great options ... have a salad too. We go there often for carry-out. But you can eat right there!,a year ago,Open,1000817902
Charles Collins,4.0,Good service,a month ago,Open,1000817902
Mel Knight,5.0,"Great food, reasonable price and fantastic service! Evan provided excellent service!",a year ago,Open,1000817902
Kevin Derr,3.0,"Standard Pizza hut fare, decent service.  Nothing exceptional.",9 months ago,Open,1000817902
loving life,5.0,Such an amazing classy place first single or family dining in it is a remarkable establishment fivestars all the way the employees greet you the service is outstanding truly remarkable,a year ago,Open,1000817902
Marcus F,5.0,"Perfectly cooked food. A little off in regards to picking up my order, however the pizza was excellent",a year ago,Open,1000817902
Chris FrmdaViLL,1.0,Terrible service waiting 45 mins on a pick up order an my pizza was cold,10 months ago,Open,1000817902
Tiana Martin,5.0,Super impressed by Jeremy's professional attitude to me! I had a question regarding online out of state orders and processing. He was professional with me from the start of the phone pick up as well as made me feel extremely comfortable …More,3 years ago,Open,1000817902
Churon Ringgold,4.0,Went to celebrate my 5 yr old granddaughters Birthday. Service was great! Wings were very tasty!,a year ago,Open,1000817902
Candace G.,1.0,The staff at this location have 0 customer service skills and have no idea what they are doing. I called tonight to try to place an order for delivery. The phone rang for a very long time before someone answered very rudely and said …More,a year ago,Open,1000817902
Randall Testerman,5.0,Nice environment very friendly great service excellent pizza.,a year ago,Open,1000817902
#DADDYLIFE #S2BBDAD,3.0,Only hand tossed an thin crust is good everything else sits in oil overnight,a year ago,Open,1000817902
Abdul Waseh khan,5.0,Excellent dine in experience. The waitress was amazing,a year ago,Open,1000817902
LaAEnDiamante Ace,2.0,"I order food here all the time maybe 3 time per week, today I got my food and the 2 pasta was cold the breadsticks were not done at all which this is unusual so was my pizza😣 not what I expected.",a year ago,Open,1000817902
Allan Crabb,3.0,"Food was ok, service was good, table was sticky and dirty",a year ago,Open,1000817902
Jean Duciau,5.0,The evening staff was awesome,10 months ago,Open,1000817902
Unapologetic Woman,1.0,"If you dine inside the pizza is awesome, but when you get carry out it's the complete opposite. Hardly no cheese or sauce. I think the owner tells the employees to skimp on the ingredients. Even though I live literally seconds away I don't …More",2 years ago,Open,1000817902
Ed Suitt,3.0,It's pizza hut. First time at this location. Food and service was good. It seems though most pizza huts are stuck in their 80s decor.,2 years ago,Open,1000817902
Kayla Hardy,5.0,Pizza came out fast and very friendly staff. I enjoyed my food and time spent.,a year ago,Open,1000817902
Antonio Rivera,5.0,Went in sat down had a good dinner with my wife and kid good service nive people.,a year ago,Open,1000817902
Marilou Scott,5.0,This was the very first place I ate out when we arrived the USA. The pizza was of very good quality with fresh ingredients. The service was excellent and courteous. There weren't so many people when we had our lunch at that time. I highly recommend this place. We ordered a vegetarian pizza too.,3 years ago,Open,1000817902
Luke E,1.0,Waited for 20 minutes and still didn’t get drinks. Ended up walking out. There was only 1 other table in there. The manager needs to be fired at this place period.,a year ago,Open,1000817902
Michael Harris,5.0,Clean place and the employees are very polite.,a year ago,Open,1000817902
Mary Schaefer,4.0,Great BBQ chicken pizza....tables always greasy,a year ago,Open,1000817902
Courage Cowardlydog,5.0,Wonderful service and very friendly environment.,a year ago,Open,1000817902
Robert Yawn,4.0,"Very nice meal.  Hot hot pizza, wings.  Great service.",2 years ago,Open,1000817902
Pennie Weir,3.0,Service slow. I ordered cheese sticks but got cheese bread instead. They did not charge me for it so that was nice.,11 months ago,Open,1000817902
Adrienne Wooden,5.0,Great and Always Here At A Reasobable Time They Give You And Picking The Food Always Ready,a year ago,Open,1000817902
Alton Morgan Jr,5.0,"Always find the Personal Pan Pizzas and salads to be the best.  The wait staff is friendly, efficient, neat and timely.  Nowhere do I enjoy having lunch more.",3 years ago,Open,1000817902
TJ Forbes,5.0,Everything was fine.  Good food and good service.  No issues.,2 years ago,Open,1000817902
Mrs.roman Roman,5.0,"Always come to Pizza hut with family and friends, workers are just amazing there customer service is awesome 🤗",a year ago,Open,1000817902
Stacie Mitchell,5.0,Awesome workers and great service every time I go in there!,2 years ago,Open,1000817902
Mark Farro,4.0,"Good pizza, bottom needed to be crisper. Service lil slow but, friendly.",a year ago,Open,1000817902
Lyles music,4.0,Larry Peterson was the best server please go check out Pizza Hut it was extraordinary awesome,a year ago,Open,1000817902
Barbara Kell,4.0,"Quiet enjoyable  good ""service""and food !",a year ago,Open,1000817902
Heather Krol,5.0,"Very friendly atmosphere, cozy place to eat.",a year ago,Open,1000817902
vicky standiford,1.0,The service was horrible we asked for fries with our meals and they brought them out cold and we asked for no onions,a year ago,Open,1000817902
Herb Tudor,1.0,I think I'll stop getting pizza ffrom there . That's the 3rd time over the last 7 months and the crust has no taste and not cooked.. It missing sauce also.. The owner should be checking up on their business before it goes down the drain.. Really disappointed.. To many young people working there.. Probably is the problem. .,2 years ago,Open,1000817902
Kim Ream,5.0,Good lunch deal. Pick 2 for $9 and drink,a year ago,Open,1000817902
Sharon Thompson,5.0,What can I say they're pizza excel over all!,a year ago,Open,1000817902
Brandi Cuthbert,5.0,Very laid back relaxing atmosphere,a year ago,Open,1000817902
Barbara Gemmill,5.0,Free pizza when you have enough points,9 months ago,Open,1000817902
Ethan Griffith,4.0,"The pizza is very good, don’t get me wrong, but one time I went here I ordered a personal pan pizza, and I had to wait over two hours for my food because they were out of pizza pans or something. That wasn’t a very good experience but every other time I’ve loved it.",2 years ago,Open,1000817902
Robert Jordan,5.0,Great food. Friendly Staff. The wait was short.,2 years ago,Open,1000817902
Nelson Neal,3.0,I do like their Pizza,a year ago,Open,1000817902
maria aviles,5.0,Very good service,9 months ago,Open,1000817902
SadIsolation,3.0,Not the best but still good,a year ago,Open,1000817902
Marcy Bachelor,2.0,Order was mixed up. Food not as fresh or cooked fully. Salad looked like right out of a bag and tasted like it too. Not worth the amount of money they charge. But there have been some past visits where pizza wasn't too bad. Wouldn't recommend this place.,3 years ago,Open,1000817902
Jim Ahern,4.0,Great. Love deep dish pan pizza.,a year ago,Open,1000817902
Danny Blackburn,3.0,"Service was slow, food was expensive",a year ago,Open,1000817902
Jay C.,5.0,Love this place!,11 months ago,Open,1000817902
Kelly Raymond,4.0,"Im very picky when it comes to pizza, I think their pizza is the best for a restaurant food chain.",a year ago,Open,1000817902
Charlie O'Dell,5.0,The girls was very nice,a year ago,Open,1000817902
Danielle Dixon,3.0,Food was great but the server told us about a special that wasnt really a special and the manager had to readjust our bill.,2 years ago,Open,1000817902
Mary Burke,1.0,Everything about it sucked the food so prices all of it,a year ago,Open,1000817902
Mabel Zabinski,2.0,"Very slow. Pizza was not hot, I believe they forgot us because everyone around us who ordered after us got their pizza first. The wings we ordered came when we had finished eating. We were not very pleased with the service.",3 years ago,Open,1000817902
Jennie Hall,5.0,"Love their salads, defeating the purpose with awesome creamy Italian dressing",2 years ago,Open,1000817902
Britny B,1.0,Got wings about 30 mins ago. Got them home and they had no sauce. They were dry! Called Pizza Hut to speak to a manager. She was VERY rude and told me they only put a tablespoon of sauce on the wings and to order them with extra sauce next …More,2 years ago,Open,1000817902
Kathleen Mader,4.0,"Reliable, consistent, friendly",9 months ago,Open,1000817902
Cynthia Mowery,5.0,Zachary is an outstanding server!  Thank you for making it a great visit. Pizza was excellent.,3 years ago,Open,1000817902
Scott Palcher,1.0,Very slow!  Took 15+ min just to get drinks and wasn't busy. Took 45+ min to get pizza.  Not sure the issues but it was akward just how long waits were.  May need a new manager. Also hard to get in and out of!,2 years ago,Open,1000817902
Mark Shires,5.0,Everything everything was wonderful the stat is very helpful and all the food is very good,2 years ago,Open,1000817902
Crystal Díaz,5.0,Love Pizza Hut! @_crysdiamond_,a year ago,Open,1000817902
Terry Stallings,5.0,Love them! Always great customer service,2 years ago,Open,1000817902
Morris Chapman,4.0,Outstanding deal on Pizza and very good service,2 years ago,Open,1000817902
Mama Moon,5.0,Yummy and cozy with a side order of yummy and friendly! Never had a bad moment and I have spent quiet time here often.,4 years ago,Open,1000817902
Larry Arnold,5.0,A very nice establishment the people were friendly the service was great well worth the trip,2 years ago,Open,1000817902
Rita Johnson,1.0,So many spiders all over the place as you walk through the door and on the windows.,2 years ago,Open,1000817902
AngelnLaine Warner,5.0,Best pizza ever and truthfully this is the best Pizza Hut I've gotten food from. My number one pizza restaurant !,2 years ago,Open,1000817902
S. Brown,3.0,The service and food was good.,2 years ago,Open,1000817902
Petr Buno,3.0,Just ordinary fast food with pizza I would say.,2 years ago,Open,1000817902
Florence C.S.,5.0,Great tasting pizza.,a year ago,Open,1000817902
Miriam Shires,5.0,Always good food and service,2 years ago,Open,1000817902
Cynthia Paul,5.0,I'm a Pizza Hut fan,5 months ago,Open,1000817902
Angela Huff,3.0,First time I ever are in Maryland. Was satisfying.,2 years ago,Open,1000817902
Richard Fincham,4.0,Good food and not a long wait time either.,3 years ago,Open,1000817902
Sherri Ratliff,3.0,"It was good food, great waitress",2 years ago,Open,1000817902
Lara Machin-Truskowski,4.0,Nice food but insanely over priced,2 years ago,Open,1000817902
alphonza askew,4.0,"Only one waitress working 6 tables, she was very polite and professional",3 years ago,Open,1000817902
George Robertson,5.0,Its pizza hut it deserves five stars,2 years ago,Open,1000817902
david cockrell,5.0,Great location. They have the best wings!!!,2 years ago,Open,1000817902
Stephen Dennis,5.0,Clean fast and friendly service. I have been going to this location for over 20 years and will keep coming here.,4 years ago,Open,1000817902
Akshay Bhat,4.0,"Decent pizza, what you would expect out of a chain restaurant",3 years ago,Open,1000817902
Janet Murphy,4.0,It's a good Pizza Hut. They always get my order right.,3 years ago,Open,1000817902
kevin simons,2.0,Slow service.   2o minutes to get drinks,a year ago,Open,1000817902
Jim Rupp,4.0,Consistently good pizza with adequate toppings ...well worth the price!,4 years ago,Open,1000817902
donald hammons,5.0,Great pizza as usual!,a year ago,Open,1000817902
Karan Patel,1.0,Very very poor service and no proper management,a year ago,Open,1000817902
Tom Godfrey,5.0,always good food and pleasant place to visit,3 years ago,Open,1000817902
Robert Tuck,5.0,Wait staff friendly place is clean bathroom s are to,a year ago,Open,1000817902
Steven Schwartz,1.0,Pizza was horrid.Made a second one which was much better.Took almost a half an hour to get it.Usually The Havre De Grace Pizza Hut is great but tonight it sucked.,2 years ago,Open,1000817902
Charles Henry,5.0,"Best pizza,large up to almost.  20.00",2 years ago,Open,1000817902
seon st bernard,2.0,The people on the phone were not very helpful. Kept getting my order wrong,3 years ago,Open,1000817902
David Turner,3.0,Good ol' pizza hut,2 years ago,Open,1000817902
Bijay Pandey,3.0,Good interier and sitting arrangements,2 years ago,Open,1000817902
Shadow Buchanan,4.0,The workers was ok.,a year ago,Open,1000817902
Janice Granger,5.0,Best,9 months ago,Open,1000817902
Teresa Adams,5.0,Food is great. Employees are very friendly,4 years ago,Open,1000817902
Tj Schlegel,5.0,Awesome food! Amazing service!,4 years ago,Open,1000817902
Matthew Roach,5.0,Fast and friendly service,a year ago,Open,1000817902
Marcia Wilson,1.0,"Dirty, slow",a year ago,Open,1000817902
Jennifer Davidson,5.0,Pizza and Service Were Great,3 years ago,Open,1000817902
Michael Long,4.0,No buffet.,a year ago,Open,1000817902
Sean Harvey,5.0,Perfect every time,a year ago,Open,1000817902
Jeremiah Michael,4.0,Order was wrong but still delicious!!!!,a year ago,Open,1000817902
Jason Blackburn,5.0,Love this place,a year ago,Open,1000817902
Ivy Liz,3.0,Pasta was cold!,a year ago,Open,1000817902
Alexander Alviarez,4.0,Good,a year ago,Open,1000817902
Katelyn Godfrey,4.0,Clean and quick service.,2 years ago,Open,1000817902
Andrew Landers,3.0,It's Pizza Hut.,a year ago,Open,1000817902
MARGARET STEINER,5.0,I work there,2 years ago,Open,1000817902
Isiah Nelson,4.0,Great food,a year ago,Open,1000817902
Clarence Ross,4.0,Problems with the phone line when calling in orders.,a year ago,Open,1000817902
Ellen Richard,5.0,"Cleanest, nicest, friendliest Pizza Hut we have ever been to.",6 years ago,Open,1000817902
Mike Mcmillion,5.0,Good food,a year ago,Open,1000817902
Patrick Griffith,5.0,Quick,2 years ago,Open,1000817902
earnest fulcher,5.0,good,a year ago,Open,1000817902
Mark Schlenker,4.0,Quiet. Good food. Plenty of choices.,3 years ago,Open,1000817902
Mike C,4.0,Its alright,a year ago,Open,1000817902
Tammy Long,5.0,"Very clean, friendly staff.",a year ago,Open,1000817902
Tina Scarlato,5.0,Not so good,a year ago,Open,1000817902
Burnette Family,4.0,🍕🍕,2 years ago,Open,1000817902
Kevin Lewis,5.0,Good,2 years ago,Open,1000817902
Jet Black,4.0,Grear,2 years ago,Open,1000817902
woody32261,4.0,Good pizza,2 years ago,Open,1000817902
Will Stevens - Abstract Artist,2.0,Screwed my pizza up,2 years ago,Open,1000817902
Norman Williams,5.0,It was nice,2 years ago,Open,1000817902
Donald Stevenson,5.0,The greatest pizza ever,2 years ago,Open,1000817902
Ki Ko,5.0,Always enjoy!,2 years ago,Open,1000817902
Peggy Steiner,5.0,Best place to work,2 years ago,Open,1000817902
Hector Pimentel,5.0,Good service,2 years ago,Open,1000817902
Imperial,3.0,It's kind of dirty,2 years ago,Open,1000817902
Jason Jenkins,1.0,Puking sound,3 years ago,Open,1000817902
Robert Ignozzi,4.0,Good pizza,3 years ago,Open,1000817902
Chris DeWitt,3.0,So so,3 years ago,Open,1000817902
Barbara Craigen,1.0,I don't know wasn't there,3 years ago,Open,1000817902
Lance Walker,1.0,I ordered multiple pizza at 5:30 I had to call back because they didn't charge me they told me they left with a driver an hour later I received my food never again,3 years ago,Open,1000817902
regina meninger,5.0,Good service and fast,3 years ago,Open,1000817902
Rob White,5.0,Yummy !!!,3 years ago,Open,1000817902
Richard Scaffidi,5.0,Great food,3 years ago,Open,1000817902
Frank Green,5.0,"It's pizza hut,  good pizza",3 years ago,Open,1000817902
Danielle Scott,5.0,Clean and good service,3 years ago,Open,1000817902
Karl miller,1.0,Extremely long wait,3 years ago,Open,1000817902
R. Brian Frearson,2.0,Not much business,4 years ago,Open,1000817902
AL HOWELLTHREE,4.0,great food..,4 years ago,Open,1000817902
Kim Reichert,4.0,Pleasant & cleanliness & quick,3 years ago,Open,1000817902
Emmy AREVI,5.0,"(Translated by Google) Very good food and adequate time is delayed. If I had to make a suggestion it would be that the tables are sticky, but I think it's the material. …More",a year ago,Open,1000817902
Bernard Talou,4.0,"(Translated by Google) Heartwarming welcome. Correct service.

(Original) …More",2 years ago,Open,1000817902
efrain ramos,5.0,"(Translated by Google) I love the services and their food

(Original) …More",3 years ago,Open,1000817902
eds films,4.0,,2 years ago,Open,1000817902
Lisa Vespucci,5.0,,9 months ago,Open,1000817902
Robert Taylor Sr,5.0,,a year ago,Open,1000817902
Cheyenne Singleton,1.0,,a year ago,Open,1000817902
ashanti rankin,5.0,,2 years ago,Open,1000817902
Monique Brown,5.0,,a year ago,Open,1000817902
Hdududi Fhyxnrjhhe,1.0,,10 months ago,Open,1000817902
Amy McAllister,1.0,,a year ago,Open,1000817902
Dale Lofthouse,2.0,,a year ago,Open,1000817902
Becca Traenkner,5.0,,2 years ago,Open,1000817902
Patrick Holvey,5.0,,3 years ago,Open,1000817902
Marianne White,4.0,,a year ago,Open,1000817902
Suzanne Greeley,5.0,,2 years ago,Open,1000817902
Belinda Mier,4.0,,2 years ago,Open,1000817902
Shay G.,5.0,,2 years ago,Open,1000817902
Tammy Bibey,4.0,,2 years ago,Open,1000817902
Jr Hammond,1.0,,a year ago,Open,1000817902
Boaz Gilad,3.0,,a year ago,Open,1000817902
Alexander Guckenberger,5.0,,a year ago,Open,1000817902
anthony hawkins,5.0,,4 years ago,Open,1000817902
The Lidke's,3.0,,a year ago,Open,1000817902
Boobie Big Man,3.0,,3 years ago,Open,1000817902
Ashley Casas,5.0,,a year ago,Open,1000817902
Joe Stotler,4.0,,a year ago,Open,1000817902
Broegan Everett,5.0,,3 years ago,Open,1000817902
brittany ratledge,5.0,,2 years ago,Open,1000817902
Keyon Mason,3.0,,2 years ago,Open,1000817902
Miguel Deleon,4.0,,2 years ago,Open,1000817902
noel Alvarado,5.0,,a year ago,Open,1000817902
steven pomeroy,4.0,,a year ago,Open,1000817902
Janice Clark,5.0,,3 years ago,Open,1000817902
burt ruffner,3.0,,3 years ago,Open,1000817902
A Google User,3.0,,a year ago,Open,1000817902
Emma Lowery,5.0,,a year ago,Open,1000817902
Peter Hudson,3.0,,2 years ago,Open,1000817902
Paul Orem,5.0,,3 years ago,Open,1000817902
Kevin Whetzel,5.0,,a year ago,Open,1000817902
Chelsea DeFelice,5.0,,2 years ago,Open,1000817902
LeShawn Thomas,3.0,,a year ago,Open,1000817902
Iris Chacon,3.0,,a year ago,Open,1000817902
Rochelle Darryl,5.0,,3 years ago,Open,1000817902
Hugh Hooks,5.0,,3 years ago,Open,1000817902
Jun Carlos,3.0,,10 months ago,Open,1000817902
wendy. louthian,4.0,,3 years ago,Open,1000817902
amanda medelez,2.0,,2 years ago,Open,1000817902
Megan Bailey-Hall,5.0,,a year ago,Open,1000817902
Janos Zona,5.0,,a year ago,Open,1000817902
Adam Magness,4.0,,a month ago,Open,1000817902
Crystal Miller,5.0,,4 years ago,Open,1000817902
Allen Todd,5.0,,2 years ago,Open,1000817902
Wilfredo Marquez,5.0,,a year ago,Open,1000817902
Andrea Smeltzer,1.0,,a month ago,Open,1000817902
pamela bartom-james,3.0,,a year ago,Open,1000817902
Cynthia Cox,5.0,,a year ago,Open,1000817902
Juan Soto,5.0,,a year ago,Open,1000817902
vinny DeBeauvernet,2.0,,3 years ago,Open,1000817902
A Google User,4.0,,a year ago,Open,1000817902
Evelyn Garner,4.0,,3 years ago,Open,1000817902
Dawn Cheikh,5.0,,3 weeks ago,Open,1000817902
Rebecca Broadwater,5.0,,2 years ago,Open,1000817902
Gregory l Stewart Sr,5.0,,2 years ago,Open,1000817902
Erin Conner,5.0,,2 years ago,Open,1000817902
Ariane Holmes,5.0,,2 years ago,Open,1000817902
Evan Nesbit,1.0,,a year ago,Open,1000817902
Sundris Ataris,3.0,,a year ago,Open,1000817902
steven slevin,1.0,,2 years ago,Open,1000817902
Anthony Renna,3.0,,2 years ago,Open,1000817902
Nicole Harris,4.0,,2 years ago,Open,1000817902
Christoph Wichmann,5.0,,a year ago,Open,1000817902
Will Dyals,4.0,,2 years ago,Open,1000817902
Mr.Aquafy,5.0,,2 years ago,Open,1000817902
Benito Muniz,3.0,,a year ago,Open,1000817902
Charone Prewitt,4.0,,2 weeks ago,Open,1000817902
Akshika Jain,3.0,,a year ago,Open,1000817902
Michael Davis,3.0,,3 years ago,Open,1000817902
tashawn watters,4.0,,a year ago,Open,1000817902
Tim Meyers,5.0,,9 months ago,Open,1000817902
Aubrey LeBon,5.0,,6 months ago,Open,1000817902
Dorishsehdbd6bun7 McMaster,5.0,,2 years ago,Open,1000817902
Shayla Sumter,3.0,,a year ago,Open,1000817902
Ben Jankosky,4.0,,2 years ago,Open,1000817902
Sheri Haupt,5.0,,2 years ago,Open,1000817902
Joshua Bowman,4.0,,a year ago,Open,1000817902
Romando Escalona,5.0,,2 years ago,Open,1000817902
Mike Loney,4.0,,a year ago,Open,1000817902
