name,stars,text,timeSince,openStatus,key
Janna Vittoria,1.0,"To write this bad review is very upsetting to me because back in the early 2000's I worked at this location. I was manager, cook, waitress etc. I did it all. As I read  all the reviews I see a lot of disappointment in the food and the …More",2 weeks ago,Open,1000817329
V B,4.0,"Reviewing the sit down experience and not the delivery/take out - the food is good, our server was friendly, attentive, and polite, and the restaurant was clean. Being this is the only Pizza Hut restaurant in the area, it definitely holds …More",3 years ago,Open,1000817329
Jose Meneses,1.0,"The staff is very rude and unprofessional, they pretend to be the manager and give you fake names to cover for each other, they are lazy and do not want to lift a finger, this is today's generation, they do not want to work for their pay.  I wish you could give zero stars.  YOU NEED OLDER EMPLOYEES",a week ago,Open,1000817329
Harrison Kanarick,4.0,Haven't seen a restaurant style pizza hut in a long time since I'm used to going out to the takeout only ones. I'm sure it is nice to eat their for dinner when they allow it but I got the stuffed crust pizza to go and was happy as usual.,2 weeks ago,Open,1000817329
TOMASZ JANCZY,1.0,Fire all the staff and rehire new people. I remember when this was a great restaurant with amazing staff and food. Now that new employees have been hired the restaurant is being driven down to the slums. Waiting for an hour for a simple …More,2 years ago,Open,1000817329
Kaci Hall-Lagha,1.0,We’ve ordered from here many times and usually something is forgotten. No biggie since it’s a quick drive to get it. But last night the breadsticks were greasy and had a slab of butter right in the middle of it. Plus the pizza wasn’t fully …More,a month ago,Open,1000817329
Joseph Obiso,3.0,"Could not find my order to bring out to the car. The person kept calling me ""hon"" when I had told her my name. Felt weird and comfortable.",2 months ago,Open,1000817329
theusagirl,3.0,"This Pizza Hut could be better, but it chooses not to be, they hardly clean the restaurant, this was long before Covid, I remember the last time I was there for Dine In, they never wipe the dust from the windows, and they never properly clean the restroom, and ordered the Pan Pizza, and it wasn't fully cooked...",a month ago,Open,1000817329
Danielle McGuire,1.0,I am very DISAPPOINTED and UNHAPPY With the service I received today ! I placed an order around 8:30ish online and they said my food would be ready by 9:05pm and when I arrived and click “ I’m here “ . It said to call and I had to call over …More,4 days ago,Open,1000817329
Twiddledee Barna,2.0,I have gone here several times throughout the years but recently 2020 has not been like it had been previous. I don't know if it is due to the virius or something else . But quality is way down.,a month ago,Open,1000817329
Bridget Fortunato,1.0,My pizza came with all the cheese and toppings all slid to one side like the driver was speeding around corners..I was told it would take to long to get another pizza if I wanted a refund.  I haven't gotten my refund.,5 months ago,Open,1000817329
sarah stein,5.0,Friendly and still love the pizza,3 weeks ago,Open,1000817329
Dee Nunyabiz,5.0,"Clean, friendly and fast service. Also, Pizza Hut classic and consistent flavor. This location never disappoints. Also, special thanks to Anna. Besides making my night, she is super awesome.",a year ago,Open,1000817329
Raisa Brown,2.0,"Take out is always best. Very low staff, always cold and there wasn't even a salad bar put together. No point in dinning in anymore.",10 months ago,Open,1000817329
Private Consumer,1.0,What happened to the Pizza Hut of the past? Nice crispy pan pizza was crispy. Extra cheese was extra cheese. My pizza was supposed to have extra cheese (which is now not an includee topping) and pepperoni. I asked for the pizza to be cooked …More,a year ago,Open,1000817329
Carlos Morrison,5.0,"This place is one of my favorites! Affordable rates, considerable dishes and the staff are constantly welcoming.",9 months ago,Open,1000817329
Blue Sky,1.0,Expensive and tricky. The alleged deals are no deals and they always manage to charge you more. They mess with your order. People with attitude too. Very cold place.,3 months ago,Open,1000817329
Familia Unida,5.0,Great service,2 weeks ago,Open,1000817329
Shanta R,1.0,This Pizza Hut has deteriorated so much in the past few years. New management/ owner took over and the service and quality is below standard. The pizza used to be good. The eat in was almost always filled now there’s like 1 or barely 2 …More,a year ago,Open,1000817329
King's Heir,1.0,I felt insulted after purchasing over 100 dollars worth of food they sent me burnt cheese pizza ( how do you mess up plain pizza) and the bbq chicken pizza was burnt and messily made. Do better Pizza Hut. On top of that answering service to order was flat and not very friendly and took me nearly 20 minutes just to complete the order.,10 months ago,Open,1000817329
Sean Curtis,5.0,Clean friendly place,2 months ago,Open,1000817329
yudi tatiana Diaz Gomez,5.0,Very good,4 days ago,Open,1000817329
Maximum Vibration Music Dj Maximum5868,5.0,Great costumer service great place to dine with family and friends.,9 months ago,Open,1000817329
Sami Afzel,1.0,Coming from far away and they didn't let us eat inside eventhough all the seats were empty. Amanda is the worst server ever I have witness in my life.,a year ago,Open,1000817329
Katherine Perez,1.0,"Terrible. Pizza came undercooked, a little doughy, lots of cheese and little marinara sauce. They also didn't cut the pie through. Probably one of the worst pizzas I've ever had. Makes Pizza Zone (Lodi) taste luxurious.",a year ago,Open,1000817329
Junior Emon,1.0,"Come here often with the family. Every time we come here, their service keeps getting worse and worse. While entering the place, no one acknowledged us. Server walks by didn’t even say anything. So I had make an approach saying “ I need a …More",10 months ago,Open,1000817329
PJ Haas,3.0,"Service is slow when the dining room is empty, you have to ask multiple times for drinks, appetizers to come out first, the check...... Too much work",a year ago,Open,1000817329
bryan adams,3.0,Often running behind and last couple orders have been over cooked,4 months ago,Open,1000817329
Ms McGraw,1.0,The smell when you walk in is horrible! It smell like mildew wet carpet or old wet carpet. The table was unkept the floor as well. There was no one in the restaurant when my fiancé son and I came there about two months ago. There was 3 …More,a year ago,Open,1000817329
Yanelis Lorenzo,4.0,Its awesome,a month ago,Open,1000817329
Chirag Rana,2.0,"No napkins, condiments or dishes",3 weeks ago,Open,1000817329
rhina rodriguez,3.0,For the most part the service is good but the food is 60/40  I been ordering here for almost two yrs and there is days the food comes out great but the other 40% of the time it’s not even eatable they need to stay consistent or there gonna …More,a year ago,Open,1000817329
Sandra Reynoso,1.0,So disappointed! My family loves pizza but last night was horrible.... first it was a party of 7 they told us we can sit anywhere you like( there wasn't a table for 7 setup) we put them together ourselves. We order place our order.... no utensils 🙄. Pizza looked HORRIBLE AND TASTED WIERED... PIZZA HUT SUCKS!!!,a year ago,Open,1000817329
ebenezer Scrooge,5.0,Dining in way better than delivery 👌,9 months ago,Open,1000817329
Shawn Howes,2.0,"Was craving stuffed crust pizza for some reason, nostalgia from when I was a little kid I guess. Pizza was wayyyy below average... greasy, soggy, ""floppy"" tiny amount cheese and sauce tastes like a tin can... Better off getting real pizza …More",a year ago,Open,1000817329
Loco Local,4.0,"I don't understand why ordering online is cheaper than ordering at the counter...
You save a few dollars.  . …More",a year ago,Open,1000817329
Jose Celleri,3.0,"Customer services need to improve,  delicious pizza.",11 months ago,Open,1000817329
MR. MALIK,5.0,Nice place to enjoy pizza with family n friends. They should hire more staff to make the service faster.,a year ago,Open,1000817329
ABIR Abou Askandar,1.0,"I ordered two pizza veggie one and ham and cheese .we hardly tasted the cheese with micro slice of everything waste of money for Dow and tomato I hope only this branch do this
No more order from them",7 months ago,Open,1000817329
Stephanie Robalino,4.0,The food was good and the cheez it pizza were good.,a year ago,Open,1000817329
Cyno God,5.0,"Pizza was amazing and very quick. Was served by Rosie who was very kind, respectful,   visually appealing, and her service was unmatched. She could practically read minds as she was at our table whenever we needed her without even calling …More",3 years ago,Open,1000817329
Kathy Nunez,4.0,I used to loveee that pizzeria but I don’t know why I stopped going here.,9 months ago,Open,1000817329
Luis Casiano,5.0,I had a concern today about how long the food took to get to the location of delivery once the person who received it told me it took awhile. I called in about my concern and spoke to the general manager at the location. She gave me an …More,2 years ago,Open,1000817329
James Gaffney,2.0,Looks like a shell of what it used to be 10 years ago. No salad bar. Empty. Pizza is still good. Place used to be packed in its hey day. Good service . I wish it well.,2 years ago,Open,1000817329
Stefanie Ernst,2.0,"Its was ok, very empty. Pizza was ok and there were I think a few people there.",a year ago,Open,1000817329
Naruto Yolo,4.0,"The workers are polite and get the order right.  The pizza tastes good depending on what type you order such as hand tossed. The interior is nice to dine in as well.  It's no Michelin Star restaurant but their fair prices.  All that matters is that each pizza has a even plentiful spread of toppings, cooked right, and served on time.",3 years ago,Open,1000817329
Rocio Cedeno,2.0,It’s a Pizza Hut...no big deal. The bathrooms are disgustingly dirty. Waiter was super nice & helpful. Fryer wasn’t working correctly so we had to eat with a loud clicking noise. Hopefully we won’t get salmonella after eating the buffalo wings made in that fryer! Definitely due for a remodel!!!,2 years ago,Open,1000817329
Tom M,4.0,Not as good as it used to be. Think they changed the recipe. The crust and bottom are no longer crispy. The pan the pie came in is different. I thing that's the reason for the soft crust.,a year ago,Open,1000817329
Carolina Flores,1.0,"Horrible place to eat, i had to wait 10 min to be seated and the place was empty, i finally get a table to sit with my kids and family and i had to wait over 30 min to be asked what i would like to order, waited an hour later so they can …More",a year ago,Open,1000817329
wandry,5.0,The shop is quite and the people are nice,a year ago,Open,1000817329
BLACK KING,5.0,The Best pizza other than Brick oven,a year ago,Open,1000817329
Laura Ajdari,1.0,Ordered over 1 hour ago and you guys are 6 mins away.  This will be the first and last time we order from here. …More,a year ago,Open,1000817329
Michael Cohen,5.0,Used the app for the first time and it went great! Very easy to use and the delivery guy was kind,a year ago,Open,1000817329
Daniel Ledesma,5.0,"Order was ready to pick up within specified times and was prepared as requested. All looked and tasted good. During pick up I observed the restaurant to be clean and organized as well as the environment was welcoming, although I should …More",3 years ago,Open,1000817329
Noemie Montoya,1.0,"WORSE PLACE EVER. food? Disgusting. Waiting time? Unbelievable.
Paid for TWO pies only received one. We called and she said she was gonna get the manager but she came back to the phone like ???? what happened to the manager. …More",2 years ago,Open,1000817329
USA2K,1.0,"Service is terrible. They we're trying to charge me for something I didn't order. They don't care if you show up and wait for them to take your order. When I got here, I was the second table waiting for service. After 8 or 10 minutes the …More",2 years ago,Open,1000817329
Kristie Bednarz,5.0,Its pizza hut pizza.  Staff is friendly place is clean.,11 months ago,Open,1000817329
A. Sharif,5.0,"This place is always super busy. Busy preparing take out that is. If you want to eat in, you'll find plenty of seats. Best thing to do is order online and pick up 25 minutes later.",2 years ago,Open,1000817329
Andżelika Surdyka,5.0,Placed an order here once in store for carryout a few months back and had no problems. The pizza was good and made in a relatively timely manner so I did not have to wait long. The staff was friendly and polite.,3 years ago,Open,1000817329
Desiree Reyes,4.0,Bathrooms are dirty! The first time I went to this Pizza Hut the cashier was very rude but the second time I had a different young lady and her customer service was absolutely great! Food was ok🤷‍♀️,a year ago,Open,1000817329
Mrafaelperez Perez,1.0,This pizza hot is the worst in the us service is really really poor 40 minutes for a pizza insane,a year ago,Open,1000817329
Buffie Galifi,4.0,"Our waiter Dan was great!  He did a great job being alone with half a dozen tables, the phone ringing off the hook and busing. The cook made our pies incorrectly; Dan brought the pies to the table so we had something while we waited.   Our …More",3 years ago,Open,1000817329
Alison O'Sullivan,1.0,"Dirty unbussed tables, slow service, and cheese pizza missing the cheese (and sauce). Not worth the heartburn.",a year ago,Open,1000817329
M M,5.0,Great experience.. yummy food .. Good environment.. nice staff,2 years ago,Open,1000817329
Independent Taco,1.0,Order placed 8:25 ...currently 9:41 still no pizza...decided didn't even want it anymore ...had multiple time problems before but not this bad usually just 45 min ...anyways clintons a great worker and this waitress With R name didn't catch …More,3 years ago,Open,1000817329
Marcella Choina,1.0,"I ordered a pizza. It  was a complete mess. Completely unacceptable. The dough looked half raw, the cheese didn't look like it even melted all the way, and the dough was just bland. We called to complain and your servers told us we were …More",2 years ago,Open,1000817329
Gabriela C.,2.0,Don't know how long these people work for but once I got there at 9:30 I got some not so pleasant looks from the employees. The place closes at 11 and I guess they wanted to get out as quick as possible.. waitress was nice,4 years ago,Open,1000817329
cesar demoya,1.0,Slow service waiting for more than 25 minutes for a cinnamon rolls,a year ago,Open,1000817329
Rocco Notarfrancesco,5.0,Friendly staff good food I like the buffet,a year ago,Open,1000817329
WrightHomeRealty,3.0,"Nice place , pizza was extra grease , did not enjoy",a year ago,Open,1000817329
Erkan Gundogdu,1.0,This is the second time i am having a problem about delivering. I just wanted to give them a chance. Did not work! When i ordered pizza from website it says delivery will take 1 hours 20 minutes. I called that place after i ordered to make …More,4 years ago,Open,1000817329
Sandra O,4.0,A bit on the pricey side. But family enjoyed the food.,a year ago,Open,1000817329
A D,5.0,Store has been remodeled. Staff was nice and food was finished in a timely manner.,a year ago,Open,1000817329
Dawud R.,3.0,"I called at 10:15 PM to place an order to pick up… They told me they were not taking any more orders for the night. They close at 11 PM! They advertise it only takes 10 minutes to make your order. That sucks because in a pinch, a lot of …More",2 years ago,Open,1000817329
Sam,1.0,Will never return to this location just horrible.  We went in and sat down and ordered two pies wings and soda . Not to busy night . Couple other people was being sat down after us . About 4 other tables. So the other tables waited …More,2 years ago,Open,1000817329
Axutecojr Garcia,5.0,Excellent food and fast service,a year ago,Open,1000817329
Monkey Cain,5.0,"Great staff, very friendly.",a year ago,Open,1000817329
Ryan G,4.0,"Great food here, but the service from the employees are a bit slow. I love the buffet where you pick your own pizza! It's awesome!",4 years ago,Open,1000817329
Erum Maqsood,1.0,Pizza came burned with hair all over. Discussing place. We called to complain. They gave us a credit for next time and apologized. But I didn’t expect that kind of service from Pizza Hut. Well I will definitely take my business some where else. God knows how they make it yuck... disappointing,2 years ago,Open,1000817329
Dennis Kokkinos,1.0,Stay away from this location. Especially if you're getting delivery when they have deals. Be prepared for over an hour wait with a side of room temperature burnt pizza. Seriously frozen pizza would be better than this cold greasy mess.,2 years ago,Open,1000817329
Harut Berberyan,1.0,Order Time estimates never accurate.  My last order had 2 errors.  I never get a warm welcoming feeling here when I enter.,2 years ago,Open,1000817329
Kisha Munson,4.0,Decent pizza. Very good service.,a year ago,Open,1000817329
Kim L Edwards,4.0,Personal pan pizza was good this time.,a year ago,Open,1000817329
Dennis Klinger,1.0,". Wasnt cooked thru had to put it in my oven to finish cooking it
Worst i have ever had .",a year ago,Open,1000817329
Rich O,5.0,Try the wings..delicious,a year ago,Open,1000817329
Laljibhai Ahir,1.0,This is a worse place that I have ever seen. Pizza was tasteless and too much oily. It’s slight cheaper than dominos but not worth it.,2 years ago,Open,1000817329
Gabe Pajaro,1.0,"I order for their specials and such because my brother is picky, but their food always arrives cold, as if they simply defrosted it. The cheese is never melted, it feels like rubber from how cold it comes. I always try and give it a chance, …More",5 years ago,Open,1000817329
katarina jevtic,1.0,"If they didn’t offer a buffet I wouldn’t come, they don’t open on time and the service is slow.",a year ago,Open,1000817329
Angelica zapata,1.0,"My second time here and pizza is ALWAYS BURNT! took forever to get served katie that worked in the front register didnt ever try to help up while i was tryin to pick up a online order,she serve people thar came after us it was just so disrespectful. my point is food is awful so are the employees smh",2 years ago,Open,1000817329
scarlet ohara,5.0,Hackensack location is the best,a year ago,Open,1000817329
Liz Gizelle Rodriguez,2.0,"Walked in 5 minutes ago.  I was never greeted.  There was no one to take my order.  The cook is arguing with the girl that should be taking my order.  However, she is checking the food orders for the clients that have been waiting for what …More",3 years ago,Open,1000817329
Daniel Rodriguez,2.0,Ordered from this place a lot online and got the food delivered to my address no problem. But now that I call and place an order they're saying they don't deliver to my area now? …More,2 years ago,Open,1000817329
Brian,3.0,Staff is very nice. Place usually empty though. Its average pizza but very nice wait staff.,2 years ago,Open,1000817329
Samantha K,1.0,"Horrible service screwed up my order and lost it when it was placed 1 hr ago for pick up, when I got there did not tell me they are redoing the order instead completely ignored me and helped others. The place is run by a bunch of rude …More",2 years ago,Open,1000817329
Aphter Lyphe,4.0,Newly renovated. Inside looks very nice. 3 flat screen TV's and they still have their lunch special.,4 years ago,Open,1000817329
Jose Cruz,1.0,"Crappy Service. Ordered two pies and waited half hour. Waiter comes with one pie and says that they accidentally gave my other pizza to another table. That took another 15 minutes. Once I received our second pizza, the waiter never came to …More",3 years ago,Open,1000817329
Nevil Rana,1.0,Quality of pizza too bad and all young staff need to be train they always forget somethng and customer service very poor they talk to you very rudly,a year ago,Open,1000817329
Keisha Crenshaw,1.0,"So while my family and I general love Pizza Huts food and so I don't hold them responsible for one individuals poor customer service, that one incompetent employee will cost them long time customers. I placed an order online as I have done …More",2 years ago,Open,1000817329
Great Citizen,1.0,"The worst experience in the world. The service was slow as hell. But you can't complain otherwise the 19 yr old store manager ""Chris"" will call cops on you. Now I know why it is kid friendly because bunch of kids are running it or pretend …More",3 years ago,Open,1000817329
Boris Nemkovsky,5.0,Good individual pizza,a year ago,Open,1000817329
Nina Gonzalez,1.0,The worst experience of my life. This place was disgusting. The bathroom was so nasty and the floor was sticky. The tables still had the previous customers scraps and dirty plates. On more than 3 tables horrible service. My family and I left after waiting for 20 minutes and the waitress did not even ask us for any drinks.,3 years ago,Open,1000817329
Nala Monopoli,1.0,This place use to be so nice when they use to have when I was a hot Pizza Hut kids pins that you would get stars on the pins and depending on how many you got from school you got a free pizza the pizzas aren't as great as they use to be …More,3 years ago,Open,1000817329
Rashiyma Peace,5.0,Awesome pizza nice clean place great customer service,2 years ago,Open,1000817329
MR. E,1.0,"First time writing a review ever. It was sooo bad I HAVE to write a review on this this. 2 large pizzas took 1 hour and 20 minutes for delivery, and they were around the block. Pizza tasted like cardboard. Pizza from a frozen box tastes better. Bad food, bad service, bad experience",4 years ago,Open,1000817329
Jose Cotto,5.0,Excellent service and great employees,2 years ago,Open,1000817329
Bill Scully,1.0,The place was a pig sty! Every booth was unoccupied and covered in food and debris. We walked out!,a year ago,Open,1000817329
Anthony Ramos,2.0,Food is usually ok but service is slow. Just about every time I'm here there are loud customers. It sounds ridiculous but that's what happened multiple times. Never ordered to go. Stopped coming here. Now I drive a good 20 minutes up 17 to Ramsey if I crave this.,4 years ago,Open,1000817329
Ghanshyam Sakhareliya,4.0,Long wait time.. when you order online they say 10 to 20 min but need to wait 40 to 50 min.,2 years ago,Open,1000817329
Chris K,5.0,"Great service and manager Jennifer was so kind, so is the staff there",2 years ago,Open,1000817329
Bria Lightsey,1.0,This location is absolutely horrible . They have messed up my order several times with no rectification . The last time they sent me the  order incomplete and said that they did not have the ingredients to correct my order and could give me …More,2 years ago,Open,1000817329
Ricardo Cruz,1.0,Worse pizza hut ever!! Ordered around 4pm and at 731pm I still have not received a thing. I called to speak to someone and before i was done the manager just flat out hangs up on me. What the hell kind of service is this where they straight …More,3 years ago,Open,1000817329
A. Sharif,4.0,This place is very busy even though it may not seem that way if you look at their dine-in area. I would say typical wait time for pick up is at least 40 minutes.,2 years ago,Open,1000817329
Jessica Lugo,1.0,This has to be the most ghetto pizza hut in the country. No costumer service and they hired highschool girls with attitude who will hang up the phone on you. I have walked in and had the manager come up to the desk ignore me and go straight …More,2 years ago,Open,1000817329
Katherine,1.0,"I would never eat here again.The service was terrible, but most important the food had to be outdated and gave me food poisoning. Don't eat here you'll be disappointed.",4 years ago,Open,1000817329
Hershil Patel,2.0,Terrible customer service made me wait more than an hour. I waited so long I puked on the guy taking orders. The dude was walking around with puke for a good 10 min until someone asked when you cleaning the vomit off your face? He said 10 …More,4 years ago,Open,1000817329
Sarah Kiefer,1.0,"Literally the worst pizza I've ever had. No idea what they did to the Pan Pizza, but its not the same as I remembered",a year ago,Open,1000817329
Verinder Singh,4.0,Went in with a group of six we were served quickly and had a great time,3 years ago,Open,1000817329
Lisbeth,5.0,They are great and the people the work there are too💯💯💯💥💥💥💥😀,3 years ago,Open,1000817329
Jose Flores,2.0,"Idk but I've order twice recently from this location And both times the pies come out very soft, soggy like. Not like the deep dish I'm used to from them.",3 years ago,Open,1000817329
Lizbeth Gomez,4.0,Pizza is perfect and the place is very clean but the staff moves a little slower than I would like.,3 years ago,Open,1000817329
Giovanni Perez,3.0,"The food great and hot, the service can be better",2 years ago,Open,1000817329
Levon Yenikomshuyan,4.0,Good wing's good pizza just to much marinara sauce on the pizza late night pick up or deliveries double check food cuz most of the time there's a mess up,2 years ago,Open,1000817329
habiba ahmed,5.0,The awesomest staff ever,a year ago,Open,1000817329
Matthew Zaczeniuk,5.0,"this place is nice l, average pizza hut.",2 years ago,Open,1000817329
Michael Albelo,5.0,"Wonderful service
Very Friendly waitresses
Exelent Food, specially the Pizzas !!
Plenty of Parking space, and a good location!!",3 years ago,Open,1000817329
first 48,1.0,Ate some wings from here. Stomach was killing me the whole day! I was in and out the bathroom. Also really bad service. The pizza is good tho,3 years ago,Open,1000817329
Geo S,3.0,So so I prefer dominos,2 years ago,Open,1000817329
