name,stars,text,timeSince,openStatus,key
caligirl lovesmusic,4.0,Got my order Perfect & delivered hot & fresh within 30mins!! Of course it was a Monday night but it was a great night!!,a month ago,Open,1000818255
Auntie Lisa,5.0,"In Pizza Hut's franchise category, tonight they and the food deserved five stars!! Accuracy:5⭐ Time from order to arrival: 5⭐ Regular Customer Recognition and Service!: 5⭐ Taste: Above and beyond! Five very smiley stars.⭐",11 months ago,Open,1000818255
Ronnie Smith,5.0,I have been eating there pizza before I got out of high school and I am still eating it now and they don't disappoint it is always great. 👍👍,2 months ago,Open,1000818255
Ben Kline,1.0,Sat in the drive-through for a while before anyone came to the window. A lady was standing IN the back door smoking a cigarette when I pulled up. ZERO customers in the building. …More,a year ago,Open,1000818255
Steven Gates,2.0,"I ordered a pizza with Buffalo sauce, chicken, beef, and olives along with some other items and the buffalo pizza had what appeared to be no sauce at all. The only reason it gets 2 stars is the boneless wings were fresh and good but those were for someone else. The pizza was bad.",5 months ago,Open,1000818255
Neobot21,5.0,Service was awesome! We (Me and my family) waited a few minutes before getting served and they gave us a free dessert for the wait. …More,9 months ago,Open,1000818255
Donna Burns,1.0,"On 4/30/2020, I ordered a large sausage.beef, and cheese pizza.
The person that took my order was pleasant and helpful.
Delivery was prompt. …More",7 months ago,Open,1000818255
Mr Dylan,5.0,"Excellent customer service! The staff are great! There was a mixup with our order, but the manager fixed it AND threw in dessert. She was very pleasant and helpful. 10/10 will stop here again!",9 months ago,Open,1000818255
David Ready,1.0,"I had a delivery made to Walnut Grove Nursing to the staff for taking care of my mother this evening. The delivery person was on time and polite. However, the order for two large pizzas was $17.99 each and a total of $50 total. I fully …More",a year ago,Open,1000818255
Ashley Nicole,5.0,"Listen, I called Dominos before I called Pizza Hut and I don’t know what trip they were on but they were hateful. When I called Pizza Hut I was sick and starving and just wanted food. The people were so nice. They explained what they had …More",10 months ago,Open,1000818255
Matthew Putney,1.0,One thing you don't do is mess with somebody's food. I can't believe the nasty disgusting food that this place is serving to people and during the cov19 outbreak. This place will make you sick do not under any circumstance eat food from …More,6 months ago,Open,1000818255
Gurmehar Singh,1.0,"Ordered a large pizza and fries. The fries were the worst I ever had in my life, they were squishy as if they were expired and were fried wrong. Was traveling on hwy 69 and couldn’t go back to them. Had to just toss them off in trash.",5 months ago,Open,1000818255
Iqbal Singh,1.0,"This pizza hut food is garbage
Don't order food from this place",2 months ago,Open,1000818255
peyton jameson,5.0,best pizza place in town please eat here and NOT dominos!!!!,6 months ago,Open,1000818255
Kristen Lane,2.0,"Pizza Hut always has good deals.  Their pizza is usually good.  DON’T DINE IN!  The employees are extremely unprofessional.  They have friends come in and bring their children.  They yell at each other from across the dining area.  Get delivery or pick up, but I WOULD NOT recommend dining in!",a year ago,Open,1000818255
Freewilloutlaw,5.0,I buy pizza here a lot. Don't call and order get online and look up the deals they have. Way way cheaper ordering online,a year ago,Open,1000818255
javonne eddington,1.0,The food is great and all that but they can't even spell my name right when i order the pizza to carry out smh,11 months ago,Open,1000818255
Wendol Rice,3.0,"As per.the norm slow service, not so hot pizza and high prices!",10 months ago,Open,1000818255
zac stainkamp,1.0,I cannot put into words how horrible this delivery really is. I am unsure if the driver dropped the pizza before he delivered it or if the cook just decided to make my order on his way out:/ ugh such a disappointment,a year ago,Open,1000818255
Debbie Miller,3.0,It's okay but the salad bars wasn't really a salad bar not much there,9 months ago,Open,1000818255
Amber Mullins,5.0,We love our pizza hut. They've always been accommodating with our birthday parties and great pricing. Our latest fave is the $5 lineup,a year ago,Open,1000818255
Martha Cantrell,2.0,The salad bar was nasty and old. Service was way too slow.,a year ago,Open,1000818255
Mandy Coplen,4.0,"Food was good, staff was friendly, but frazzled. No clean dishes.  The dish washer broke down and I guess no one was trained in how to use a three compartment sink. The food was great though.",a year ago,Open,1000818255
NUGGS GAMING,2.0,"Was decent,  fast, somewhat clean,  semi friendly,",a year ago,Open,1000818255
T Helms,4.0,Bought a pizza for work. When I got back the pizza was paper thin and the crust was tough. I called and spoke with the manager and she quickly had a new one made and sent to my work.,a year ago,Open,1000818255
John Camfield,5.0,"I had their Pizza Supreme with everything and jalapenos. It was great, my only complaint is that they don't serve beer. I remember Pizza Hut used to sell beer and they don't anymore.",a year ago,Open,1000818255
wendi blanco,1.0,Ordered pasta and wings and they can’t even give me plastic fork with it to eat it. My delivery man was decent however but it still remains. Pull your head up out of your butt and send what needs to be sent for folks to eat their dinner. Am I supposed to eat this with my fingers?,2 years ago,Open,1000818255
Michael Brown,5.0,Good food excellent service great atmosphere,9 months ago,Open,1000818255
bob treslar,4.0,Good food.  Friendly staff.  Quick service.  Could be cleaner- pictures & decorations in dining area desperately need to be dusted.,a year ago,Open,1000818255
Mom Hough,4.0,Great coupon,2 months ago,Open,1000818255
Ingrid Kimbrough,5.0,Ordered Carry out. It was absolutely delicious. Hot and fresh. The workers very nice. Will go again.,a year ago,Open,1000818255
Tomas Torres Jr,4.0,Good and friendly awsome customer service.,a year ago,Open,1000818255
Nicholas Brown,1.0,So when I ordered the pizza is gave me a time frame of when I would arrive. I said between 20-30 minutes. My pizza arrived an hour and a half after I ordered it. Then my wife called up there to speak to a manager and the kid on 3-23-19 at …More,a year ago,Open,1000818255
Jason Bruce,4.0,"1st time ordering here. Order was correct, the staff was polite, and pizza arrived fast and hot.  I would have given 5 stars but for some reason they were super skimpy on mushrooms.",2 years ago,Open,1000818255
Rose Browning,1.0,"Got home with carry out pizza, opened box and a big roach ran out into my home. Will not be eating at this location again and that's a shame because they always had the best pizza.",a year ago,Open,1000818255
Marian Wright,5.0,Great pizza buffet and great service! Love this place!,a year ago,Open,1000818255
Mr Sandman,1.0,Didn't give plates took to long to come give refills,a year ago,Open,1000818255
Jason Adsher,3.0,It was ok took awhile to get food. If you have 1hr to spend there I would recommend it,a year ago,Open,1000818255
Jesse Cross,5.0,Best PIZZA buffet ever,9 months ago,Open,1000818255
Ursula DeLoach,1.0,"Ate the lunch buffet today. Horrible service, had to get our own drinks & the waitress never checked on us once. Very dirty! Thanks to this place I’m now home sick with food poisoning! I know I got it from here bc it was the first thing I …More",2 years ago,Open,1000818255
Zachary Rubin,2.0,"Pizza assembly seemed half-assed. I had ordered a pizza with extra marinara with mushrooms, spinach and pineapple. What I got was no extra marinara, a ton of mushrooms, some pineapple, and maybe 3 leaves of spinach. And some of the …More",2 years ago,Open,1000818255
Denise Van Brunt,1.0,"That was the worst pizza I have ever eatn. The meat was tough, the crust was crunchy. Did ya just heat it up n a very hot oven.",a year ago,Open,1000818255
Amy Bebermeyer,5.0,"Amazing!! Great service, friendly staff, welcoming environment! Definitely a must",a year ago,Open,1000818255
emmalenn,5.0,Pizza Hut has some good deals and great pizza. The staff is friendly and they also have pretty quick delivery.,2 years ago,Open,1000818255
Marc Izzabell,1.0,"Been there for lunch buffet twice in two months.  Did not even get silverware both times. Guess the salad bar is just for looks.  Needless to say, I am not a fan.",a year ago,Open,1000818255
Tana Newport,1.0,Placed order online with text message updates. Said our order was out for delivery ended up calling to find our order. When it did arrive was horrible. Ordered bone out wings with lemon pepper dry rub none was on the wings and the delivery driver was upset because we asked for our change back,a year ago,Open,1000818255
Devonna Easter,5.0,"Good pizza,service and deals.",a year ago,Open,1000818255
David Lynch,1.0,"Ordered 2 pizzas around 7pm on a Thursday to be delivered and paid online, it took 1 1/2 hours to receive them!  About 50min of waiting I received the order is on its way text, it took 40 min for them to deliver pizza. I live approximately …More",2 years ago,Open,1000818255
Kevin P,3.0,"It's  been a few years since I've eaten here.  I LOVED Pizza Hut's buffet even though the pizza quality is much lower than their delivery.  The service was horrendous, too.  My buddy had to go refill his own drink behind the employees only counter because lord knows no one was going to come refill it.",2 years ago,Open,1000818255
Gena Taylor,5.0,Fast friendly service. Great food.,a year ago,Open,1000818255
Gary Bordwine,1.0,Stopped in for the lunch buffet and happened  to glance into the kitchen and I saw a cook with his dreadlocks dangling only an inch or so above a pizza he was making. …More,a year ago,Open,1000818255
Swampin 321,4.0,Took me a while to get seated.  The pizza was cooked in a reasonable amount of time and was delicious.  Would be a 5 star rating if we would've been seated within 10 minutes.,3 years ago,Open,1000818255
MrsxBrownx,1.0,So when I ordered the pizza is gave me a time frame of when I would arrive. I said between 20-30 minutes. My pizza arrived an hour and a half after I ordered it. Then my wife called up there to speak to a manager and the kid on 3-23-19 at …More,a year ago,Open,1000818255
Jackie Richard II,1.0,Cinnebuns raw...callazone raw and wasnt what i ordered,a year ago,Open,1000818255
Ron Peloquin,1.0,Under staffed food quality not good. Ran out of buffetbuffet items. Slow to replace. Not pleased,2 years ago,Open,1000818255
Camellia May,4.0,One of the few Pizza Hu's still with inside dining.  We stop here for the M-F lunch buffet which is a great bargain when you're traveling.  They'll even make the pizza you want on the buffet.,2 years ago,Open,1000818255
Debbi Bittle,1.0,Horrible service. Waitress never even came back to make sure that everything was okay. Wouldn't recommend,a year ago,Open,1000818255
Tami Potirala,5.0,"Pizza was piping hot when it got to,my room. It was very good",a year ago,Open,1000818255
Jennifer Spangler,5.0,The pizza was really good and the place seemed nice and clean.,a year ago,Open,1000818255
Kevin Davis,3.0,The place was a wreak. Not enough wait staff. Everyone had buffet and they enjoyed it. I ordered a sandwich and waited almost 20 min. And it was cold,2 years ago,Open,1000818255
Chadette Hernandez,1.0,They close buffet at 1. Which to early !!! We went across the highway and ate at Carls Jr. And it was awesome...,2 years ago,Open,1000818255
Shannon Bowen,3.0,Good place,7 months ago,Open,1000818255
Pamela Snyder,5.0,Great for a quick dinner,2 years ago,Open,1000818255
ColorMaker 921,5.0,Love the buffet.  That's about all I have and most of the time it's all fresh salads and hit pizza. I have had their bread sticks and like them but thought they were too expensive for what we got.,2 years ago,Open,1000818255
Dakota Fowler,1.0,Worst Pizza Hut there is. Can't evan make a pizza right for the 4th time in a row. Simple directions when ordered online. Expect you to wait for them to fix another but why wait when they should have gotten right from the beginning. Very simple.👎,2 years ago,Open,1000818255
becky kuehn,5.0,Pizza was exactly what we ordered. Quick delivery friendly staff delicious pizza. Can't get any better,2 years ago,Open,1000818255
Carl Boddy,2.0,Service is good but not a good selection on the buffet and they don't put it our very fast.,a year ago,Open,1000818255
Karen Brojakowski,3.0,Waited FOREVER for 2 pizzas- Dining In!!! Waitress never refilled our drinks and my son had to go up & ask them for napkins! The wall decorations have about 1/4 inch dust accumulation & the signs inside on the wall had grubby handprints all over them + the dust!! Food tasted great though!,2 years ago,Open,1000818255
David Hamilton,4.0,"No coffee lol, salad bar was good",a year ago,Open,1000818255
Kellie Tiner,5.0,Lunch Buffett was wonderful,a year ago,Open,1000818255
Jerry Mayo II,5.0,Got it quickly and it was good,a year ago,Open,1000818255
Aubrey And Zachary Harper,2.0,"Haven't even got my food yet but I feel I learned all I need to know about this place. Called in an order for something very simple just two large pizzas. Was told it was going to take 45 minutes which is fine, but when an hour and 15 …More",4 years ago,Open,1000818255
nikki roberts,3.0,I love the pizza from here but we always get it delivered because in store the service is usually slow and the dining area is usually dirty and the buffet is so small when you're on a short lunch break it definitely lacks,2 years ago,Open,1000818255
darrell hause,1.0,I've contracted food poison. 2 eating the wings,a year ago,Open,1000818255
Diana Sutmiller,4.0,Food was good service good,a year ago,Open,1000818255
bryce farrell,1.0,"I was eating here least week and I saw an employee carrying a pizza to the buffet and when a few slices slid off the tray, she picked em up, blew them off, and put them back on the tray and put the pizza on the buffet line. I dont like snitching, but I like floor pizza a lot less.",a year ago,Open,1000818255
Shannon Mills,2.0,"Every time we get delivery, our order is wrong and always late. EVERY TIME!",a year ago,Open,1000818255
Angela Adams,5.0,Individual pan pizza great,a year ago,Open,1000818255
Angi Blehi,1.0,"Ordered 2 pizzas for takeout.  Both were burnt.  When I called to complain, I was told they would be credited to my phone number.  The rep I spoke to was in a big hurry & rude.  Two weeks later I tried to collect on this credited order and …More",9 years ago,Open,1000818255
jones 134,4.0,Nice quiet and calm environment.,a year ago,Open,1000818255
Toi Smith,5.0,"Always love this place also!! Great deals an friendly people, cept for the rude delivery guy who drives the white g6!",2 years ago,Open,1000818255
Gordon Johnson,3.0,Could be a 4 but I had to pickup my own pizza after a 16 minutecall hold. The gay was great at order desk. Took care of me and did everything GREAT. Pizza was gòod all turned outto be GREAT. Ty gal for your help on the order. Your great hope you get a raise.,3 years ago,Open,1000818255
Monica brownlee,3.0,Ehh not a very good lunch buffet.,a year ago,Open,1000818255
Mackenzi Garis,1.0,This is the worst pizza place you could possibly go to.If there was a 0 star that is what I would have rated it.They give half topped pizza and have horrible managers who will use inappropriate language and service towards their costumers.👎👎,a year ago,Open,1000818255
Erin Mosley,5.0,Had a party here. The employees were great. Pizza was excellent.,3 years ago,Open,1000818255
Jennifer Richey,5.0,When they get the order right it's great,2 years ago,Open,1000818255
Kimberley Williams,1.0,Called to order a personal pan pizza (cheese) at 5:30 the lady was rude when we arrived after 45 minutes we were told they lost the pizza and would have to remake it. It's now 6:32 and we're still waiting. Had the order not been for a child. We would have just left. Worst experience ever. Not worth it at all.,3 years ago,Open,1000818255
Mark Aumiller,1.0,Order was called in 1hour and 30 min before i went to pick it up  arrived and it was not ready they had it on the next day for pick up,a year ago,Open,1000818255
Anthony Bullock,1.0,"Waited 5 mins at door, was finally acknowledged and told to seat myself. Then waited ten minutes at table, had yet to be waited on or even see anyone waiting tables anywhere in the restaurant. Went somewhere else for lunch & will never go back to this establishment.",4 years ago,Open,1000818255
Jackie Gryder Jr,3.0,Thick crust pizza on Buffett. Cherries on Buffett. No Italian seasoning,2 years ago,Open,1000818255
Ashley Williams,1.0,"we had to sit at the window for over 10 mims, with people looking at us, but when holler for someone we were ingonered by management, then a dingy looking guy can to the window and told me ""someone else has to check me out"" becuase hes not …More",2 years ago,Open,1000818255
2222foxtrot,1.0,"I ordered a large pizza an hour ago with mushrooms black olives and jalapeños. The pizza came with no jalapeños and cold. It was discusting looking and poorly put together, a absolute waste of money. The woman I talked with when ordering was kind and gave me a deal and for that I was appreciative",3 years ago,Open,1000818255
Polly Culver,1.0,Horrible service employees look at you  and no one will help you,a year ago,Open,1000818255
Gypsy Soul Clothing Llc.,3.0,It was ok didn't have very much to choose from on lunch buffet but was good my daughter loved it!!,3 years ago,Open,1000818255
Samuel Gallezzo,1.0,Not good.  Ordered a pizza from them and it wasnt even close to what I ordered.  Dont put mushrooms on a pizza if they weren't ordered.  Eventually you'll kill someone.,2 years ago,Open,1000818255
Paul Todd,4.0,My kids love the dipping pizza.,2 years ago,Open,1000818255
Gary Stiles,4.0,Not to bad of a place to eat,a year ago,Open,1000818255
Theresa Norris,1.0,"Not even worth 1 🌟.1st time in a while they lost my phone in order and I said forget it ,and went somewhere else.Next time my pizza's was burned.Call back and said would replace and i called to get my replaced and cost $7.11 and they said …More",3 years ago,Open,1000818255
John Pan,3.0,"Drinks took awhile to get to us after we were seated and there was a lack of variety, but otherwise restaurant was clean, employees were friendly, pizzaa were delicious, and not better or worsw than other locations we've been to.",2 years ago,Open,1000818255
Naiyer Alam,4.0,Good. We always stop by this restaurant when passing the area.,3 years ago,Open,1000818255
Richard Gentry,4.0,Good service and friendly employees Best Pizza in town,3 years ago,Open,1000818255
steven mitchell,5.0,Some of the best costumer service over the phone with a gentleman named Bob,4 years ago,Open,1000818255
Zach Simpson,4.0,thin crust pepperoni was good,a year ago,Open,1000818255
Angela Pinkerton,5.0,it was very gd and fresh pizza buffet,2 years ago,Open,1000818255
Curtis Dunagan,3.0,Pizza tasted good. Service was ok.,2 years ago,Open,1000818255
Jace Rice,5.0,Nice people& hot pizzas,a year ago,Open,1000818255
Darlene Hyslop,4.0,98% of the time everything is PERFECT.,2 years ago,Open,1000818255
sonya fassino,5.0,Food food.  Best buffalo wings in town.,3 years ago,Open,1000818255
Above the Grill LLC.,5.0,"Good, cozy, and always greeted and treated very nice. Waitress was on her game!",3 years ago,Open,1000818255
Matthew Neary,1.0,Still here waiting for my food figured i would write a warning to any potential customers. Arrived approximately 7:30 sat at door for 5 minutes with employees staring at me before deciding to declare that i will seat myself. Waitress promly …More,4 years ago,Open,1000818255
Brayden Kious,5.0,That's were my cousin had his birthday party,4 years ago,Open,1000818255
Mike Palmer,3.0,Friendly manager...buffet was alright. Not much variety and was a little messy.,3 years ago,Open,1000818255
Tyler Moore,2.0,"Orders repeatdly get messed up or forget our 2 liter of soda. Not only that, wait time is unusually long",3 years ago,Open,1000818255
Robert Graf,4.0,Pizza Hut's okay but they never put enough cheese on a pizza even when you order extra cheese I always have to complain but I like their Pizza they need steady people to make them right all the time,2 years ago,Open,1000818255
Luis Garcia,3.0,"Waitress was very helpful, BUT the salad bar was terrible, wilted lettuce, the toppings looked old...",3 years ago,Open,1000818255
Linda Capps,3.0,Buffet is M-F usually hot And good,2 years ago,Open,1000818255
LaVada Adams,5.0,"Good pizza, fast service.",3 years ago,Open,1000818255
Mayce Bickham,1.0,Every time I have ordered from this place my order is never right. When I call back there is always an excuse as to why my order is wrong. These people need to get it together.,a year ago,Open,1000818255
Daniel Thomas,5.0,"Great service, great food.",3 years ago,Open,1000818255
river lane,5.0,Very well nice,a year ago,Open,1000818255
BOBBY FRENCH,2.0,Ordered pizza well in advance for set pick up time.  Wad not even ready to cook when I arrived.  Very poor.,2 years ago,Open,1000818255
Candice Boatner,5.0,Fast friendly service,a year ago,Open,1000818255
Michael Tate,2.0,"Not busy, therefore not much to choose from on the buffet, cooks were visiting with one another instead of keeping buffet up.",2 years ago,Open,1000818255
Dylan Jacques,2.0,"Food is usually exceptional, but everytime we order through the call center the order gets mixed up horribly.",3 years ago,Open,1000818255
bill schillinger,5.0,Great service and great food,3 years ago,Open,1000818255
daniel williams,3.0,Buffett,a year ago,Open,1000818255
William Bray,1.0,Waited a long time with only 1 other family in the whole place only to have them bring out the wrong pizza and forget to turn order in on the other...Food was ok...,2 years ago,Open,1000818255
Christopher Scroggins,5.0,Great service superb food.,4 years ago,Open,1000818255
TAD HALL,1.0,They got our order wrong.Pizza did not look at all like a supreme.I was sick afterwards and threw it all up.My stomach is tore up...ugggh...I hope they improve...uggggh.,2 years ago,Open,1000818255
Owen Smith,1.0,I got a cheese pizza and they changed it to pork and didnt want to do anything about it. I'd rather get me a $5 pizza from Little Ceasers.,4 years ago,Open,1000818255
Jennifer O'Nesky,4.0,"Good food, great service",3 years ago,Open,1000818255
Sara Edwards,3.0,felt like the bigger party in the back was more important than me and my children,2 years ago,Open,1000818255
Carla Bingham,1.0,Burnt pizza wrong order.,a year ago,Open,1000818255
Hyde Snowden,4.0,Service is alittle slow but its still one of my top 5 places to eat,2 years ago,Open,1000818255
Alana Robson,5.0,Friendly service,a year ago,Open,1000818255
Lesia Gragg,3.0,Love the week day buffet.,2 years ago,Open,1000818255
Deborah Miller,4.0,Good pizza,a year ago,Open,1000818255
Jacob Casey,4.0,Very good,a year ago,Open,1000818255
Wayne Wilson,3.0,Could be better,a year ago,Open,1000818255
Chris Wacker,5.0,Good pizza,a year ago,Open,1000818255
Lynn Watts,3.0,Great pizxa good service,3 years ago,Open,1000818255
Lu Ann G Collier,5.0,🍕I don't trust anyone who doesn't like pizza!🍕\m/you guys rock! ⭐⭐⭐⭐⭐💯😎,2 years ago,Open,1000818255
Andrea Adams,1.0,Old food and bad customer service,2 years ago,Open,1000818255
Clint Jenkins,3.0,Fast and accurate,2 years ago,Open,1000818255
Tracy Ferguson,5.0,Best pizza,a year ago,Open,1000818255
jazmin hudson,5.0,You can not bet rhe hut,3 years ago,Open,1000818255
Sandra Hall,1.0,Worst pizza place around,a year ago,Open,1000818255
Billy Morrow,4.0,Expensive but nice folks!,2 years ago,Open,1000818255
Jim Przybranowski,1.0,Dirty and smells like it hasn't been cleaned in years,2 years ago,Open,1000818255
Kristy Benhsch,5.0,Fantastic,2 years ago,Open,1000818255
Brandin Short,1.0,Manager is horrible,2 years ago,Open,1000818255
Russell Hopkins,5.0,Extra cheese please!,2 years ago,Open,1000818255
Photo SynthesiS,3.0,its ok,a year ago,Open,1000818255
Charles Trantham,5.0,Great service,a year ago,Open,1000818255
Maleen Mckee,2.0,Expensive,2 years ago,Open,1000818255
me and roblox,5.0,Excellent,2 years ago,Open,1000818255
Hezekiah Keith,3.0,It's ok,2 years ago,Open,1000818255
Phil &Sheara Weinland,5.0,Pizza is excellent!!,2 years ago,Open,1000818255
Alvin Surratt,5.0,Clean and friendly,2 years ago,Open,1000818255
Bijan Timjani,4.0,Good salad!,2 years ago,Open,1000818255
Chris B Baker,5.0,I like get my pizza from,3 years ago,Open,1000818255
Sara Harmon,5.0,Pizza aight,3 years ago,Open,1000818255
Kimberly and Murraya. Hancock and pillow,5.0,Yummy pizza,3 years ago,Open,1000818255
Brian Robinson,1.0,Slow delivery over 1 hour to go 3 miles,2 years ago,Open,1000818255
LaTrece00,5.0,I loveeee PIZZA HUT,3 years ago,Open,1000818255
Justin Adams,1.0,"Messed up my order, charged for toppings that wasn't on the pizza.",3 years ago,Open,1000818255
Hyde Ludlam,3.0,Lack of employees,3 years ago,Open,1000818255
William Grinstead,1.0,Really crappy service waitress was living an didn't know what to do.,3 years ago,Open,1000818255
Brian Maxwell,5.0,Best pizza McAlester,3 years ago,Open,1000818255
jay cromwell,1.0,"They don't deliver to the Best Western.  That's alot of money they are losing out on.  Too bad, so sad.",4 years ago,Open,1000818255
David Moore,5.0,Great lunch. Buffet,3 years ago,Open,1000818255
Joy Gragg,4.0,"Like the buffet, just wished it had wings",3 years ago,Open,1000818255
Clayton Wrice,4.0,Good Pizza,3 years ago,Open,1000818255
