name,stars,text,timeSince,openStatus,key
blizzy_ on_60fps,5.0,First time to be there and had the best service. Food was excellent to. Very calm atmosphere atmosphere. Mellow Mushroom definitely a place to go back to,a year ago,Open,2000628711
Marsi Thomas,1.0,"We arrived at 7PM and received our food at 9PM. There were less than 25 people in the restaurant.  We did have a party of 10, but everyone ordered pizza or appetizers.  I ordered soup and brushetta. That alone shouldn't take 2 hours. Very disappointed.",10 months ago,Open,2000628711
Chris Knehr,5.0,"So yummy. Restaurant was 90%full inside, service was prompt, food came out quickly and was delicious. Vibe was chill. Relaxing environment..not loud or noisy even with a full house. Staff was friendly and professional. People sitting at …More",a year ago,Open,2000628711
Victor,5.0,"This place is one of my favorites and bbn I'm glad it came back after Harvey.
The decor is funky and eclectic and is one of the only places I've heard Punk Floyd being played. Try the pretzel bites! …More",a year ago,Open,2000628711
Judy Judy,4.0,"We are such fans!  However, the last two times, we have had to wait quite a while for the appetizers/food. They didn't have a person to make any salads and an oven person left.  We overheard the manager apologize to the next table about the …More",a year ago,Open,2000628711
Natalie Kubosh,5.0,This place has the BEST pizza crust! I love how many topping options there are. Always great pizza!,a year ago,Open,2000628711
GANGREEN,5.0,"BEST PIZZA HANDS DOWN!! LEANNE WAS OUR SERVER AND SHE WAS EXTREMELY PROMPT, COURTEOUS AND DESERVES AN AWARD FOR SERVICE!  ANY OTHER PIZZA PLACE IS A WASTE OF TIME MELLOW MUSHROOM IS THE ABSOLUTE BEST!",a year ago,Open,2000628711
Terry Weaver,5.0,"Super friendly and attentive staff. The pizza was excellent, the crust was wonderful.",11 months ago,Open,2000628711
Adrian Kasbergen,5.0,"Great beer, fabulous pizza.",11 months ago,Open,2000628711
Haru Hiname,5.0,"Amazing! I was able to bring my dogs so we sat in the outdoor patio area. (We had just come from the dog park across the street). The waiter was awesome, came out and helped us and one of them gave my dogs a water bowl. Food was great, …More",11 months ago,Open,2000628711
Rachael Ramirez,5.0,"Absolutely love their pizza and the atmosphere is great. My husband and I like their pizza. Haven't eaten here in a few months, but we're planning to going back soon.",a year ago,Open,2000628711
Doublekutt 307,5.0,"This place never disappoints.  Great beer, and great pizza. The staff is super interactive with you.",a year ago,Open,2000628711
michelle schaeffer,4.0,Food is great! Sevice was eh but it's a great place in general,10 months ago,Open,2000628711
John Packard,1.0,"Welcome to GNAT CITY!  If you love those adorable tiny winged creatures like I do, then Mellow Mushroom is the bar/restaurant for you!  Scores of these little friends were out for a good time - I’m my face while I’m talking with friends, …More",a year ago,Open,2000628711
Nicole Wernet,4.0,We love the regular staff here at Mellow! Tyson is almost like family. My husband and I have been coming to this location at least twice a week for years now and I would have given it 5 stars except that the new manager has completely failed the place 😢. Where is my favorite beer? Where is ALL OF THE BEER TONY?,a year ago,Open,2000628711
Lora G,4.0,Food is great! Service was friendly and attentive. Prices are a little high.,a year ago,Open,2000628711
Issela Thomas,1.0,We went Friday 10.04.19 the service was so slow we waiting over and 1 and 1/2 for our pizza. The pizza was not as good as I remembered it being. At least our waitresses was nice but overall was not happy probably won't be back.,a year ago,Open,2000628711
Jeff wiley,5.0,this place was Awesome cool décor and good flavor on our pizza,10 months ago,Open,2000628711
Alex Priego,1.0,Went there on a Friday at 7:45. Sat for 15 minutes without even being acknowledged. All while waiters kept walking past me. Also heard people that already had their food complaining about the quality and time it took to get the rest of their order. Horrible service. And the restaurant wasn't even full,a year ago,Open,2000628711
Buldamoosh,5.0,Always great crust!  Of the best service you can get.,10 months ago,Open,2000628711
Amber Rae Parks,3.0,I have a mixed review. I had never been here before until my sister introduced it to me. She had nothing but good things to say so I decided to give it a try. This is a family-friendly place. The atmosphere was super. Their Pizza is out of …More,a year ago,Open,2000628711
Shaun Lawrence,3.0,We went there on Saturday after soccer. Ordered two pizzas and a few kids meals. Food was great but it took 1.5 hours to get our food. Probably wont be coming back because of that. Luckily we weren't in a hurry.,a year ago,Open,2000628711
Gizmo Bunnybear,5.0,Even though this place is a chain it's still one of the best places around to eat pizza. Lots of beer on tap and the inside is very cool. This location has never disappointed.,a year ago,Open,2000628711
kittylover 123,4.0,"I didn't go to mellow mushroom we went to the Pet super market.
But I do like mellow mushroom so 4 stars ⭐.",11 months ago,Open,2000628711
Don Rumsey,1.0,Been a while since we've been here....and I can't imagine we'll be back...the gnats and fruit flies are so numerous and annoying they'll either carry you off or annoy you to the point you wish they would! BEER taps are cross labeled to the …More,11 months ago,Open,2000628711
Alex Vuong,5.0,"Great food, courteous service",4 months ago,Open,2000628711
Karla,1.0,Ordered take out. On the phone they told my husband 30-45  minutes I get here 30 minutes later they say oh we told him 45 minutes of course this was after they swiped my card. It's now been 1 hour since we ordered and I still have no pizza.,a year ago,Open,2000628711
Osniel Estevez,5.0,"First time there. Amazing!!! , different,!!! specially Nick, no a waiter, a friend.",9 months ago,Open,2000628711
Maria Rodriguez,5.0,We visted this location on Saturday... love the ambiance...our waiter was cool as hell... the manager came to our table and introduced himself and asked us if we needed anything.. food was just outstanding. It was my birthday my waiter and another guy sang for me... it was great. Good old time,a year ago,Open,2000628711
Aly Murrell,5.0,"Amazing food, chill atmosphere and great people! I had Holly, a bartender, take amazing care of me on a pretty popular night. I will most definitely be back!",2 years ago,Open,2000628711
Leena Anneli Peltoniemi,5.0,Possibly the best crazy pizza place! Great gluten free pizza! Awesome sandwiches and a menu that's fun to read! Sure took me back to the great 1960's! There's a submarine? or a metal whale/UFO thingy hanging from the ceiling! The wait staff …More,a year ago,Open,2000628711
Lina Le,5.0,"I lived in NC where Mellow Mushroom was pretty easy to find. This location is not at all disappointing. It's the same, classic Mellow Mushroom fans love. The crust is perfectly baked and sprinkled with Parmesan, and the toppings are very …More",a year ago,Open,2000628711
Tania Stone,5.0,"EXCELLENT! Good service, Great food, nice atmosphere. Artistic design.",a year ago,Open,2000628711
William Bonilla,5.0,Definatley one of my favorite pizzas in Houston. The dough is incredible. I would recommend this place to anyone.,a year ago,Open,2000628711
Keith Klimple,4.0,Still good Pizza,3 months ago,Open,2000628711
Mike Adkins,4.0,"The pizza and calzones are really good.  Service fun they all seem to be young, outgoing, and good humored.  I'm a bit on the ""elderly"" side so it was a tiny bit loud for my taste.  Don't get me wrong, I wasn't put off by the noise.  It was …More",a year ago,Open,2000628711
Blake Louque,5.0,Always a favorite place to go for great pizza. We order hummus for an appetizer; the pita bread is always hot and fresh. We split a large pizza. One half mighty meaty and one half great white. Super tasty and well baked crust.,a year ago,Open,2000628711
Kat S,5.0,"My favorite guilty pleasure.  The Baked Potato and the Holy Shiitake are two we keep ordering again and again (after getting our fill of garlic cheese bread and pretzels (of course)).  Wait staff always seem to have great attitudes, are helpful and polite.",a year ago,Open,2000628711
Disabled Dave,4.0,Easy to see from the main road. A large clean easy to Park parking lot. Handicapped access. Very quirky looking as you walk in and entertaining and amusing items. very clean and an employee greet you right away and seat you right away. A …More,a year ago,Open,2000628711
paul lipinski,5.0,I really liked the meaty pizza.  Actual pieces of real bacon.  Crust was great.,a year ago,Open,2000628711
Anastasia Dushman,2.0,"Came in here on the whim and glad I stopped on by. The food here is fresh, tasty, and services is really friendly. They have a kid menu which both my kids really enjoy (really good value as well). Next time I will definitely try a pizza so …More",a year ago,Open,2000628711
Jolie O'Reilly,5.0,I had a great server LeAnne she took great care of me.  The pizza is great.  It is the best pizza I have had in a very long time.,a year ago,Open,2000628711
Bebe Mora,1.0,"SUPER SLOW. Came with team, waited 2 hours for sandwiches.  Meatball sub had thickly burnt meatballs, greek salad not a greek salad.  Service was horrible.  Food served sporadically.  Very dissappointed.",a year ago,Open,2000628711
Sofia Knox,4.0,Incredible pizza and wings . the bartender was so nice and great service,a year ago,Open,2000628711
Mindy Lay Moore,5.0,Great staff and pizza,3 months ago,Open,2000628711
Toni Seals,4.0,"Good pizza and a great selection of craft brews... Even a couple of good ""chick"" beers.",a year ago,Open,2000628711
Shannon Butler,5.0,"I had a great experience for my 1st time at Mellow Mushroom! The waitress, I wish I would have got her name, came back and checked on us an appropriate amount, was constantly prebussing our table. And when  I informed her about my dietary …More",a year ago,Open,2000628711
Phillip Cammarata,5.0,I bartender jenna was great food was amazing!,11 months ago,Open,2000628711
jean alexis,4.0,One of my favorite Pizza places in town.,10 months ago,Open,2000628711
Matthew Gweenie,5.0,I've been coming here for 5 years. I guess you could say I'm a super regular. I pretty much know all the staff. Place has gone through many changes over the course of time but they care about service and food quality and they always strive to improve.,a year ago,Open,2000628711
Jody Ivy,5.0,"Excellent service. They really know how to wait a table without bothering you every two minutes. I don't require a lot, and I appreciate when they keep tabs without interrupting. Good communication on when food will be out of the kitchen …More",a year ago,Open,2000628711
Lyndsey U.,2.0,The food was great but our server just rushed us out. He seemed to be more interested in his other tables and didn't even offer dessert before he brought the check. Boxed our pizza when we weren't even done eating.,a year ago,Open,2000628711
Raul Monzon,5.0,Great pizza! Fun atmosphere.,a year ago,Open,2000628711
Amanda Coates,5.0,I love their BBQ tempeh BBQ base pizza with vegan cheese.  (BBQ has honey so it's mostly vegan) we love the atmosphere and my husband loves their beer selection.  My son loves the kids pita pizza.,a year ago,Open,2000628711
Patricia J.,5.0,I love coming here the food is great and the service is speedy,a year ago,Open,2000628711
Dean Harryman,5.0,"Great pizza! Ordering online was simple, staff was friendly and helpful. When I was there I noticed they have a great atmosphere and a LOT of different craft beers on tap! Will be back! Great spot for lunch!",2 years ago,Open,2000628711
Dianet Franco,3.0,"I am a pizza lover! 😍🍕Not a fan of this place. I didn’t like their dough; it was too doughy. The presentation of pizza was perfect! It looked like it would taste great but like I said, didn’t like the dough and the sauce was too acidic …More",2 years ago,Open,2000628711
Mike Taylor,5.0,"Very, very good pizza and staff that actually care. Definitely recommend. Veggie pizza is delish!",a year ago,Open,2000628711
Ann Knows,5.0,"Delicious vegan salad and pizza, perfect crust, great beer (try the sherbet sour) and excellent service. Will definitely be back",a year ago,Open,2000628711
Bamby Ayala,4.0,"The pizza is delicious and they have vegan pizza, the service is good the only thing is that it takes so long to get your pizza on the table",a year ago,Open,2000628711
Melissa Hamm,5.0,Fun atmosphere. Great service. Wonderful food.,a year ago,Open,2000628711
Allen Miller,5.0,Great pizza and service. Would be back🤗,10 months ago,Open,2000628711
Brittany North,5.0,So glad they are back open! My favorite place! They are so much more than just pizza. The pretzel bites with beer cheese and the spinach artichoke dip are a must!,2 years ago,Open,2000628711
Ron Benjamin,5.0,Great service.  Best pizza I've had in years!  Stone oven baked with lots of choices.,a year ago,Open,2000628711
Katherine Thompson,5.0,"The food was great,however when you qent in the hostess was not very friendly at all. Bad introduction of the restaurant",11 months ago,Open,2000628711
Mitchell Reiter,4.0,Very friendly staff. Decent food. Only down side is long wait times.,a year ago,Open,2000628711
Candice Gauthreaux,5.0,My favorite pizza place by far. The customer service is outstanding the food is to die for and it's a very laid-back 70's style Eatery.,2 years ago,Open,2000628711
luci g,3.0,"Good place. Great ingredients. Had a pizza off their ""unique"" menu and it was pretty good.",a year ago,Open,2000628711
Alicia G,3.0,The pizza was not that good. The meatball appetizer was reheated and still cold.  The service was good.  The decor is fun.  Sadly more work needs to be done on the food.,a year ago,Open,2000628711
Tam B.,5.0,"We didnt order, not many vegetarian options which is why we went. Customer Service from the door to the waitress is great.",a year ago,Open,2000628711
laura barnes,5.0,Fabulous food and great service,11 months ago,Open,2000628711
MD MC,4.0,Always have enjoyed their pizza and beers. Service usually very friendly as well.  When craving pizza we always think MM as the first choice.,a year ago,Open,2000628711
Tina Field,5.0,Trivia night was fun for the whole family.  We started going because my granddaughter is gluten intolerant and my daughter has a coconut allergy which makes going out to eat a challenge.  Each one of us can find something to eat for a family of 5.,a year ago,Open,2000628711
Angela Estay,5.0,The food was delicious.  The service was the best.,a year ago,Open,2000628711
nat vasquez,5.0,Great pizza.. I thoroughly enjoy coming here good food good service.,a year ago,Open,2000628711
Gitanjali Sankaran,5.0,Delicious pizza. Very nice service.,a year ago,Open,2000628711
Erika Mireles,5.0,Great food & cool people,11 months ago,Open,2000628711
Michael Amerson,3.0,"Beer was great with a big selection. The pizza was awful. However, the manager took the pizza off our bill and offered us a gift card to come in and try it again. I may add some stars next time if I see improvement.",a year ago,Open,2000628711
lokesh yadav,5.0,Amazing people and amazing taste. They customize every bit if your are looking for changes in your food.. enjoy,a year ago,Open,2000628711
Shawn Bink,5.0,"Friends of mine took me here for the first time and I loved it.  The pizza here is amazing with a great crust.  Crisp on the bottom, great flavor to the dough overall. We got the house special and all the topping didn't  make the puzza …More",a year ago,Open,2000628711
Sarah Johnson,5.0,Great pizza and great beer choices,10 months ago,Open,2000628711
Tierny Cox,5.0,We came in late on halloween and we had above and beyond service!! Plus the food was good of course,a year ago,Open,2000628711
Raymond Odum,5.0,"Absolutely love this place. The food is always amazing and tasty. I always get the Maui wowie!!! I get the same server here everytime and he is the best server ever, props to Nick for always providing the best experience possible. If you have never been here you have not lived!!! Will be returning for life!!!",a year ago,Open,2000628711
Jay Cantu,5.0,Best pizza around. Cool environment,a year ago,Open,2000628711
Tabitha Lindley,4.0,"Delicious pizza, good service, but a bit pricey for drinks.",a year ago,Open,2000628711
tyler comeaux,4.0,Good pizza and great service,a year ago,Open,2000628711
Mz Diva,1.0,Cold sausage on pizza. Cold meatballs my son threw up in restroom immediately after he ate here :( they should have had fresh food and hot!,a year ago,Open,2000628711
Tony Garcia,5.0,Has a great selection of dark beers and the staff is super friendly. (Jessica) Our waitress was amazing and super knowledgeable. 1st time here and totally coming back.  My calzone was a bit on the dull side but was turned around with the amazing staff.,a year ago,Open,2000628711
Mikhail Zhebrak,2.0,"Good food , really long wait , when we went to lunch there on Friday, there were very few other customers, we waited for our food to arrive more than an hour",a year ago,Open,2000628711
c uback,5.0,Bartender Cali rocks!,2 months ago,Open,2000628711
Damian Adorno,5.0,I love mellow mushroom but their price point is super high 2 personal pizzas out the door $30,a year ago,Open,2000628711
Connor Winston,4.0,"The paper straws are disgusting. Over the course of your meal they soak up your drink and start to deteriorate in your mouth leaving you with paper i. Your mouth. Other than  that the pizza is fantastic, and the pretzels are to die for.",a year ago,Open,2000628711
Thomas Johnson,3.0,Food and service was good BUT GET CARTOONS OFF THE TVs and get a pest control service.  I had fruit flies flying around me the whole time.,a year ago,Open,2000628711
John Loth,5.0,Best pizza crust ever. The holy shitaky pizza is amazing,a year ago,Open,2000628711
Julie Shehata,4.0,"Always enjoy stopping here for Happy Hour for a brew and a snack. Their Capri salad is wonderful, as are the pretzel bites with beer cheese.",a year ago,Open,2000628711
Frances Martinez,3.0,Customer service sucked.  Waiter told us it was going to be a while but never came back to check on us.  Even our appetizers took forever and the only reason they didn't come out with the main meal was because my husbands got a manager.,a year ago,Open,2000628711
J Shirley,3.0,"We ordered a large house special and the pizza was barely warm and the crust was burned.  However, the service was good.",a year ago,Open,2000628711
Ryan Romig,5.0,Great fusion flavors delivered on a pizza,10 months ago,Open,2000628711
Katrica Christian,4.0,I love their fresh ingredients and great staff,a year ago,Open,2000628711
Shelby Robinson,5.0,Very chill...good vibes 😊✌🏼 and delicious 🍕😋 Staff have fun yet are very attentive and take great care of guests! 😁 & fair💲= 🤩Love this place!😍,a year ago,Open,2000628711
Randi Reel,5.0,"Pizza was excellent. I have celiac and a dairy allergy and had the gluten free crust and vegan cheese and it was fantastic! Happy hour was good for a cranberry gin and tonic ($4), but the italian margarita we got was $17.50!! We will absolutely go back, but will be more careful ordering drinks next time!",a year ago,Open,2000628711
Micah Barnard,5.0,Awesome apps! Pretzel bites were epic. Made this fat boy happy. Who's got 2 thumbs & loves to carbo-load? This guy!!!,a year ago,Open,2000628711
Benjamin Fizer,5.0,"This place has the most chill environment and the pizza is on point 100% of the time. Drinks are also good here, 5 Stars.",a year ago,Open,2000628711
Debra L.,5.0,Excellent vegan options. Really cool waiters. A great place to meetup with friends and family for a few drinks.,a year ago,Open,2000628711
Laurel Gray,4.0,Great food. Service can be iffy... but food and beer is worth it,a year ago,Open,2000628711
Chris Oquendo,5.0,"Great Pizza, Better atmosphere..",9 months ago,Open,2000628711
Queen Crystal,5.0,Always good hot fresh food and nice staff,a year ago,Open,2000628711
Sharon Mclin,4.0,"Great pizza place for the kids. The food is pretty good too. Friendly staff and clean bathrooms, what more could you ask for?",a year ago,Open,2000628711
Colin M,5.0,Great pizza. Good craft beer selection. Portion size is perfect. Protip: if you have a party of two just split a large size. You each can choose a different pizza per half. 4 slices per person is more than enough for two.,2 years ago,Open,2000628711
Tristan Nunn,5.0,"Pizza, Beer and Nick were great!",11 months ago,Open,2000628711
Tandyn Riley,5.0,Love the pizza,a year ago,Open,2000628711
April Monroe,4.0,A lot of good variety food..good soup to choose from and good pizza too!,a year ago,Open,2000628711
Brandon Dilli,1.0,"This rating is of my most recent visit, after the repairs from Hurricane Harvey. …More",2 years ago,Open,2000628711
Jaylene Ballard,5.0,Mushroom soup was terrific!  Try the spicy ranch dressing on your salad.  It's the best.,a year ago,Open,2000628711
Ruben D. Uribe,4.0,Good beer selection and great pizza,10 months ago,Open,2000628711
Chelsea Dickens,4.0,Great atmosphere and good pizza,a year ago,Open,2000628711
Amanda Becker,5.0,"Best pizza in Houston! The dough is delicious and the craft beer is cold and smooth. I highly recommend the Kosmic Karma pizza and Texas Honey cider. Family and kid friendly, and dog friendly with a nice patio area. Also, several vegetarian, vegan, and gluten free options. You won't regret trying this place out.",3 years ago,Open,2000628711
Jordan Mayer,5.0,Great service. Excellent food. Unique options. And fresh! Definitely go here! Lots of drink options too!,2 years ago,Open,2000628711
Ben Nance,4.0,I thought it was good service and good food.,4 years ago,Open,2000628711
Shawn Mamasis,5.0,Good pizza an large calzone,11 months ago,Open,2000628711
Patricia Aubry,5.0,"Our server wasn't the best: slow to bring out our pitcher of beer. When she finally did it was half foam. She did explain why, but only after the fact (20 minutes later). Then she forgot to put in our pretzel order. The pizza arrived then …More",a year ago,Open,2000628711
Connie Kennon,5.0,"Great place to enjoy craft beers, pizza and more... their spinach artichoke dip was amazing, as well as the pizza... didn't have room for dessert, but next time we will forgo the appetizer to leave room to try their desserts.  Best pizza …More",3 years ago,Open,2000628711
Ryan Hans,5.0,Worth it!! Super good!,a year ago,Open,2000628711
Elisibeth Kim,5.0,The great white was fantastic. And our drinks were even better,a year ago,Open,2000628711
Bryan Pershall,5.0,"Awesome place for Pizza and Beer, lots of good beer on tap.  highly recommend this place.",a year ago,Open,2000628711
Bluestar,5.0,Staff are fantastic and friendly. This is by far one of my favorite places to grab a good beer and a bite ♡,a year ago,Open,2000628711
Marco Alvarado,5.0,"First time here and it was delicious
Thanks,",10 months ago,Open,2000628711
Pacia Love,5.0,"MY MELLOW EXPERIENCE WAS GOOD.  IM VERY SATISFIED,  VERY FULL. I'LL DEFINITELY BE BACK.  I LIKE THE VARIETY.  SCOTT WAS VERY ATTENTIVE! AWESOME SERVICE.",a year ago,Open,2000628711
Jacob Perkins,5.0,We always love coming here. I wish we could come more often,a year ago,Open,2000628711
Gracie Cintrón,4.0,Service is always great. Pizza is delicious. Great place for a get together.,a year ago,Open,2000628711
Vonia Bowers,3.0,Food is delicious but my pizza and my server were not getting along they serve the pizza on stands which is very cute but lort the pizza went flying. They corrected the issue by making another pie. I hope the guy is okay though he was very polite and apologized it kinda made me laugh 😂😆😆😆😆😆😆😆😆😆😆,a year ago,Open,2000628711
Dave Duez,5.0,"Love this place. Always super service. Superior ingredients. Last time we were there the whole area lost electricity. They comped a lot of our meal. Including drinks and salads. Distinctive place, great spirit, and incredible Pizza.",2 years ago,Open,2000628711
Tonya Scott,5.0,"I love their pizza, so many choices, even for vegetarians!! Their crust is the best!!",a year ago,Open,2000628711
Lisa Gale,5.0,"Wow, both our waiter and chef were vegan and did a beautiful job on the pizzas!",a year ago,Open,2000628711
William Mendoza,5.0,Fresh delicious pizza filled with flavor. Ingredients actually stay on the pizza and don't slide off like some other pizza places(Corner Slice).  The employees here are very friendly and welcoming as well. Will be returning with the family.,2 years ago,Open,2000628711
Carlos Ramirez,5.0,Great place and great pizza,8 months ago,Open,2000628711
Lillian Golgi,5.0,The food is amazing.,9 months ago,Open,2000628711
Tracy Son,2.0,"Not the best service, we asked about the beer selection and the female server told us to look at the wall. We left",a year ago,Open,2000628711
Melissa Butcher,5.0,The service was phenomenal and my build your own vegan pizza was nice. Try the jerk tempeh,a year ago,Open,2000628711
Michelle Alexis,4.0,"The customer service was great. The pizza was just ok, but I did experiment with something I had never had before. I will try them again.",a year ago,Open,2000628711
CHARLIE MARTIN,5.0,"Always a family favorite! The decor is eclectic and interesting, the food and service is awesome!",a year ago,Open,2000628711
Kevin Olson,5.0,"Great staff, Very good Pizza, Great beer selection!",a year ago,Open,2000628711
Christina Comstock,5.0,Great pizza and atmosphere,a year ago,Open,2000628711
Drow,5.0,"Pizza was great, atmosphere was good, the Bar tender/server (Holly I believe was her name) was Awesome",a year ago,Open,2000628711
