name,stars,text,timeSince,openStatus,key
Mataichi,5.0,"It's the best pizza around and has a tap list to match.  Great selection of local and non local beer.  They often have a sour on tap, something not a lot of places have and once or twice I have even had mead there.  Great sides and mushroom soup too.  I have always had good food and drinks there.",2 weeks ago,Open,2000628711
Tony Jones,2.0,"Let me start with the good, pizza was good. Crust was perfect. Now the bad, customer service was HORRIBLE!! I think they take the name ""Mellow"" a little too literally. We had a long wait time for the food to come, so if you're really hungry …More",a month ago,Open,2000628711
bianca ellis,5.0,Great service and really good pizza. Loved the thin crust.,2 months ago,Open,2000628711
Johnny Rivas,5.0,Really enjoyed out time here. Really laid back environment and one of the workers there only made it better by making everyone laugh. We ordered the wings pizza and calzone. The wings were tasty although wished they were more crispy. The …More,2 months ago,Open,2000628711
Terry Gates,3.0,"Food good. Service bad.

Service: Not busy this night, food took almost an hour to come out. Server was …More",a week ago,Open,2000628711
D Pattison,4.0,One of our favorite pizza places. Staff is nice but you have to be patient - the pizza takes a while to make and service is sometimes a little slow especially with the COVID reductions.,4 weeks ago,Open,2000628711
Sheila Attayi,3.0,"Good pizza, but beware if you want to customize it in any way, as they get it wrong more often than they get it right. I ordered a mega veggie on GF crust with no green or yellow peppers and no black olives. My boyfriend picked up the order …More",2 weeks ago,Open,2000628711
kevin campbell,2.0,"Food was ok but, made to order means you may not get your food at the same time as the rest of your party.   Atmosphere is festive and drinks are good for the price.  Facilities were freshened up after three requests.",2 months ago,Open,2000628711
lvlonkey,5.0,I ordered a small bbq chicken/house half and half pizza for pickup. The service was polite and pick up happened at the expected time. The pizza itself was great. The ingredients looked and tasted fresh. I would definitely continue to get pizza here.,3 months ago,Open,2000628711
Rene Jackson,5.0,"Started off with bread bites, yummy! Then has a large thin crust with bacon and green peppers. Delicious! So good we devoured it and there was nothing left to take home. I'll be missing leftovers tomorrow.",3 months ago,Open,2000628711
Dennis Tidwell,1.0,"Was very excited about menu, but service was soooo bad.  Was the first customers in the restaurant and took over hour and 20 minutes before we got food, it was cold and nasty!  Other table came in after got drinks, food, and left before we even was served!  No manager inquired, we won’t be back!",2 days ago,Open,2000628711
Ashley Rios,5.0,"First time here,and will definitely be back! The dough is the perfect combination of soft and crispy.The spinach artichoke is creamy and so good!The vibe is super relaxing and the staff is nice!",4 months ago,Open,2000628711
Kimber Republican,1.0,Do not do orders to go they give way way less on them just horrible for that amount of money even after asked to please not do that.. And they say ok boss and still do it very very dissatisfied...will nvr eat here again. Food is ALSO just so ...,2 weeks ago,Open,2000628711
Christina Postel,5.0,"We visited about a week after they reopened and it was wonderful! Our waiter Johnny was very attentive, suggested great things on the menu and held good conversation. We loved our appetizers, the pizza and the calzone. I’m so glad we had …More",4 months ago,Open,2000628711
Lorenza Lombana,5.0,"So delicious! I suggest the Thai Dye pizza. Vegan options are available too which is also a big plus. The really tall guy with the hat (Nick) was our server and he's a rockstar. Was very attentive, kind, and had great suggestions. Everyone …More",4 months ago,Open,2000628711
Chris Hearn,5.0,"Awesome pizza. It takes awhile to get your pizza, but based off the food and the beer choice, it gets five stars.",2 months ago,Open,2000628711
Tommy Sanchez,2.0,This place has a dog friendly patio which is great after dog park and water bowls for dogs but the dog gets better service then you. Plastic straws are ehh. Sprites we ordered had no syrup flavoring so they tasted like soda water. Asked if …More,a month ago,Open,2000628711
Deborah Villani,5.0,"A definite must. Great food, bar, and the decor is fun. Many tv's to watch sports. Had an excellent server.",2 months ago,Open,2000628711
Brent Petrick,2.0,"Terribly short staffed!  Had a party of 6 got first entree after 40 minutes, got 3 more 15 min after that and at that time we’re told that they were out of the last two entrees!!  Waited 10 minutes for waiter to come back to reorder then a …More",2 months ago,Open,2000628711
Eddy Arnold,4.0,"Good, friendly service.  We went on a Tuesday night... sat near the bar area.  Bartender took care of us.  Food tasted good.  My wife and I each tried a glass of beer (we liked one and not the other but that is no big deal). I guess the …More",a year ago,Open,2000628711
David Smith,5.0,Good food. Loved it. Had great service.,a month ago,Open,2000628711
Rose Cordova,1.0,"Well after the 10 minute wait at the host stand after not being acknowledged, my kids and I left very disappointed and hungry. Would really like to try it but not sure if it's worth the wait.",a month ago,Open,2000628711
M Hayhurst,5.0,"Best wings I’ve ever had hands down. The meat is very tender & the sauce was delicious. Excellent service, friendly staff, & the food is on point. If you haven’t been here yet, you need to go. You won’t leave disappointed, or hungry!",a year ago,Open,2000628711
Diana Wolverton,1.0,"All kids except bartender. About an hour behind on each order. Wasxexplained to every one whom cane in. And it was trashed busy!
I really think they just opened inside up. But totally unprepared! I will go some place else.",a month ago,Open,2000628711
Isabel Kenyon,3.0,"Food was great.
Service was hurried, borderline rude.
My 15 year old daughter and I were seated at the bar section when there were many tables available in the family section.",2 months ago,Open,2000628711
Wayne Skinner,1.0,"They ""lost"" our order. After 45 minutes that finally came out to ask if our pizza had arrived. Then it took another 20 minutes. The veggie max pizza was not well seasoned, very little pineapple. We won't be back anytime soon.",2 months ago,Open,2000628711
David Dushman,4.0,"Great Pizza restaurant, loads of different toppings, good craft beers, great service and nice outside seating in addition to a nice clean restaurant. In addition to the pizza they do a nice selection of hoagies. Thoroughly enjoyed our meal …More",a year ago,Open,2000628711
Angelina Grijalva,2.0,"We usually love Mellow Mushrooms, we have never had an issue with the customer service nor the quality. Which is why we don't mind the 30 min wait or the price. However, today we were a bit disappointed. Our pizza tonight was burnt, not just a little crispy it was charred at the bottom. The kids wouldn't eat it.",4 months ago,Open,2000628711
Jim Sage,4.0,Ordered curbside pickup of the meat and greek salad combo.  The staff was great especially since we orderd 30 min before closing.  Pizza was really good.  The greek salad toppings looked amazing but the salad underneath was on it's last leg.  May have been due to how late we were there.  Would definitely go back!,3 months ago,Open,2000628711
Cassandra Lanza,4.0,"Service was great, it took a minute to get the food even though the place was pretty empty.  But I'll definitely be going back!",3 months ago,Open,2000628711
Cynthia Perez,5.0,"Went here yesterday for the first time, with the family.
Everyone had a great time.  We got full and everything was really good.
They have a large selection of beer. …More",3 years ago,Open,2000628711
Michael FIlandro,5.0,I love working here and eating here. Grest food and great people. Nothing like having a pizza and a good conversation with some great music playing.,5 months ago,Open,2000628711
Tyson Findley,5.0,"Cali, Jared and Holly were gnarly! Good jokes, rad vibes and quick on the drink refills.",2 months ago,Open,2000628711
John DeLeon,5.0,"Never been before and had the holy shitake pie and WOW it was probably the best pizza I've ever had. Kyle(Nick), our server was great also. Over all great food and great service!",a year ago,Open,2000628711
mayra aguilera,5.0,First time trying this pizza place out and have to say best pizza I have tried around beats all those big pizza places like pizza hut and domino's.,4 months ago,Open,2000628711
Chris Fitzgerald,2.0,"Recipe has definitely changed since last time we went. Very short staffed, took forever get request like a refill or a check.",2 months ago,Open,2000628711
Daniel Krattli,5.0,Love this tasty home style pizza n salad restaurant. Definitely recommend this restaurant.,4 months ago,Open,2000628711
Dionne Hill,2.0,So lets be clear....its business as usual at this restaurant during the pandemic in terms of cleaning. The tables are all wiped with the same cloth by the busser. There is no cleaner being sprayed on tables and chairs when wiped. The bar is …More,3 months ago,Open,2000628711
giovanni montelongo,5.0,Had the honor of getting the server who went by Cali and he was not only a great server but was very easy to get along with and made me feel at home. Food was amazing and Cali was even better!,4 months ago,Open,2000628711
Danika Burwell,5.0,"One of my favorite pizza places in the area. The pizza is always delicious and consistent (the crust is to die for). Lots of local beers, great atmosphere and staff. Great place to grab a beer and chill by yourself or take a date and share …More",10 months ago,Open,2000628711
Christine Carnes,5.0,"Servers were very attentive, bathrooms were very clean. Everyone practice social distancing.",3 months ago,Open,2000628711
Tony martinez,5.0,Best pizza!!! Their specialty pizza is so delicious.,2 months ago,Open,2000628711
Emilio Ortiz,4.0,Chicken wings were better than my pizza,2 months ago,Open,2000628711
Michael Qualls,5.0,"Favorite pizza joint, great craft brews.",a month ago,Open,2000628711
David Corona,5.0,Good pizza. Great service!,3 months ago,Open,2000628711
Fluffy Bunny,4.0,A very delicious pizza place! The large pizza I got (half holy shiitake and half mighty meaty with jalapenos and onions) was absolutely great! Super impressed with the quality of the dough and the toppings/ingredients! …More,2 years ago,Open,2000628711
J.C. Clements,5.0,Great pie and a good selection of rotating taps with local brews to be had.,2 years ago,Open,2000628711
Shanna Johnson,5.0,Seriously awesome pizza & great beer selection. Wahoo for not all TX beers.,a year ago,Open,2000628711
NiNa Brown,5.0,"I’m so glad that Hurricane Harvey didn’t completely knock this place off the map. It’s absolutely incredible and every chance I get, I’m in there! I sat at the bar and what a great choice I made! The names are eluding me but I was well …More",2 years ago,Open,2000628711
Vanessa Glover,4.0,"The place is nice, the food is great I fully recommend the wings, the waiting time for the pizza is arround 30 minutes so take that in count... the service is nice just a litle bit slow... one thing I love is the paper straw!...",a year ago,Open,2000628711
Mark Blanford,5.0,"Prompt service,  piled high with toppings, great taste, fun decor",2 months ago,Open,2000628711
Chanel Morton,5.0,"Yummy food, extremely pleasant atmosphere.  I crave their Greek salad constantly.  The bartenders were very nice.  It was one guy's first day at work and he was still really chill and helpful.  One of my favorite restaurants in the area. Hopefully one day I'll get to sit at the alien booth.",11 months ago,Open,2000628711
Matthew Quinton,2.0,"Just left after visiting for National Pizza Day...which they were not aware of.

So, no cool pizzas to try. Not a big deal, though. …More",9 months ago,Open,2000628711
Ana Christine Clark,1.0,I like Mellow Mushroom but I've been to this location twice wanting their burger and both times they've told me they run out of meat so I've had to order something else that I didn't originally want. Once I ordered the avocado sandwich and …More,10 months ago,Open,2000628711
Rick Colmenero,5.0,This place is good! Pizza is delicious and you get the mid town feel when you walk in. Great food and beer menu!,a year ago,Open,2000628711
Nnokwanda,4.0,Very Friendly staff and they enjoyed making my order. The pizza and pretzels were delicious!! …More,4 weeks ago,Open,2000628711
Josh Morrow,5.0,"This is the mighty meaty with mushrooms. And it’s absolutely, positively delightful. We’ve missed this location for some time now. We arrived at 6:10 PM, it’s 6:28 and my food is here. Cold beer and great fantastic pizza.",2 years ago,Open,2000628711
Ruslan Umarov,1.0,"Overpriced place
No correct pick up time
Not good pizza quality …More",2 months ago,Open,2000628711
colin mckeen,3.0,Don't order take out. Especially on line. Apparently it doesn't run with the restaurant. We put a order in for 815 pick up. Its 8:51 now and supposedly they are boxing it up. I hope the pizza is still worth this ridiculous wait.,4 months ago,Open,2000628711
Paul G,3.0,"On the plus side, they have an excellent selection of beers on tap and the servers are all pretty cool. The pizzas are delicious. Don't get the hamburger. The bun had definitely been frozen, then microwaved. It was super rubbery/chewy. Also, the food always takes a really long time to come out.",11 months ago,Open,2000628711
shan elliot,5.0,Man the pizza is good and we tried some of the craft beer. The waiter and bartender cut up with us. Loved the pretzel bites and cheese sauce. We had a great experience,9 months ago,Open,2000628711
Asia Carter,5.0,This place Is awesome.  The food is great and Staff is very friendly.,a year ago,Open,2000628711
rootlessprophecy,3.0,"The pizza was delicious, but if you're looking for a place that serves it quickly this is not the place to go. It took a long time for them to bring out the macaroni and even longer for the pizza. I would come back, but now I know how long of a wait to expect.",a year ago,Open,2000628711
Ryan,2.0,Not impressed with the food or service. The calzones we ordered had little fillings and were shifted so they were mostly crust. The half cheese and pepperoni pizza didn’t have enough cheese to cover the cheese side. …More,11 months ago,Open,2000628711
Blanca Garcia,5.0,We vegan and enjoy the place,a month ago,Open,2000628711
Michael Spinler,4.0,Great pizza and beer selection! I love the deco of the place.,2 years ago,Open,2000628711
Nicholas Willard,5.0,"Good beer selection, great service, great food.",a year ago,Open,2000628711
Diana Waterman,5.0,"Love this location! Super low key atmosphere and extremely friendly staff. Every time my husband and I go we ask for Cali, he's our favorite!",a year ago,Open,2000628711
Ken Rochow,5.0,"""Hit the spot"" for pizza.",3 weeks ago,Open,2000628711
scott durham,1.0,Dont order over the phone they never get it and then ask you to wait while they figure it out,3 months ago,Open,2000628711
Jeff R,5.0,First time for me. The pizza is fabulous. The art installations are very entertaining. All of the employees project a cool vibe. I'll be back.,11 months ago,Open,2000628711
Mar P.,4.0,"Amazing pizza! I tried the holy shiitake pie and it was great and they also offer vegan options with vegan cheese which is super awesome! The wait is sometimes a bit long but it’s worth it because the pizza is fresh and the dough is made with spring water, definitely would recommend!",11 months ago,Open,2000628711
karen castro,5.0,Amazing!!! First time dining here and since walking through the doors my family and I was greeted by smiling faces. The pizza and wings were delicious and you can taste how fresh the ingredients were. The ranch sauce was definitely not from …More,a year ago,Open,2000628711
Perry Rodriguez,4.0,Always good pizza. Server was great.,5 months ago,Open,2000628711
Micaela L,5.0,"I've driven by far too many times without stopping in!  Today was such a treat, I had a cheese pizza with the roasted mushroom trio, carmelized onions, and sausage.   I can't believe it took me this long to try it. I'll be back, and soon! They have a generously sized patio that's dog friendly as well.",a year ago,Open,2000628711
Dan Riggin,5.0,"Mellow mushroom was awesome! The pizza was fire! The calzones were too. Great atmosphere, good people.",a year ago,Open,2000628711
Sonia Odum,5.0,"AWESOME place! Service is always spot on, and food is always perfect!! Everything is made fresh and is always the perfect temp when you get it! Shout-out to our server Nick! We get him almost every time we go! Very knowledgeable and always …More",a year ago,Open,2000628711
RENEE P,5.0,"Great staff! The food is really good, and came out in a timely manner :-). Such a cool. creative interior, too.",a year ago,Open,2000628711
T.L. C.,5.0,"Delicious pizza aside- everyone at this restaurant was so kind and friendly. They really made the ending to our Halloween night super awesome. Also- they have the largest candy bowl I've ever seen in my life! Lol
Sincerely- thank you!",a year ago,Open,2000628711
Abe Flansburg,5.0,We love this location. The service is always great and we really love the employees here. We moved back to Texas recently and this has become our standard go to spot!,11 months ago,Open,2000628711
Andrey Gray,5.0,Best pizza I have had in Texas. The detail to the seasonings and toppings is unparalleled. That along with a broad selection for craft beers coupled with outstanding service make mellow mushroom a clear cut winner.,2 years ago,Open,2000628711
William Gomez,2.0,The fruit flies were terrible! I felt as if I should have gotten a discount for each one I had to kill. Food usually is good but the pest problem was unacceptable,9 months ago,Open,2000628711
Juan Siu,5.0,"Beautiful place, all the art and the environment is super cool, food is incredible and the welcome friendly attitude from both mikey and cliff were unbeatable! Definitely need to come more often",10 months ago,Open,2000628711
Colleen Holmes,4.0,"It took a while to get our pizza, that's why I'm not giving it 5 stars; but the pizza is wonderful and the atmosphere is interresting! Highly recommend!",9 months ago,Open,2000628711
Francine Alvarez,5.0,Great pizza and made to order so don't go starving.  Good beer selection.  Homemade hummus is delicious.  Large Greek salad can be shared. Will definitely go back. Dog friendly patio.,a year ago,Open,2000628711
Allison Welker,5.0,"Love their pizza!!! It's always delicious and has me running back for more. I'd definitely recommend getting their pretzel bites as an appetizer with the cheese dip, it's soooo yummy! The service is also always super nice!! They're pretty …More",a year ago,Open,2000628711
Komal Bhakta,5.0,"Waiter kept my water glass topped. Pizza took a bit long to cook, but totally worth it. They have a sign up that advises customers to be patient as good food takes time to cook. Wish the people at the next table over would have kept their mellow on.",a year ago,Open,2000628711
Liliana Ludwig,1.0,When we got there to pick up our order they told us they hasn’t even started on it. We got home to find out they messed up one of our pizzas and instead of wings we got some bread roll things. We will never go back there again!! There pizza isn’t even that good anyways.,3 months ago,Open,2000628711
Alfredo Cervantes,5.0,Awesome pizza joint!  The decor is a cool trip and the staff is super chill.  The food always tastes great and the drinks definitely help with this cotton mouth.,a year ago,Open,2000628711
nathaniel arter,5.0,"Very good, as always! Tried the steak and cheese calzone... I will be getting that again! Great attentive service, feel very welcome there.",11 months ago,Open,2000628711
MICHAEL STUMPS,5.0,Great tasting pizza custom made. The mushroom pizza is a great tasting pizza without the meat although any protein can be added. Plenty of seating and plenty of parking easy to access from major roadway. The restaurant can get quite busy …More,10 months ago,Open,2000628711
Tommy Lott,5.0,"The decor makes you feel like you've stepped back in time. The pizza is outstanding, specifically the Holy Shiitake Pizza. I really wanted to add somenmest protein to it but I'm so glad I left it the way it was. Our server was great, he …More",11 months ago,Open,2000628711
D Avery,2.0,Very small meat portion on my tiny 4 inch Hoagie. Bread was overly toasted and too crunchy. Every bite made my mouth hurt behind my front teeth. Strange food presentation too. A tiny sandwich next to a knock off brand bag of chips on a nice …More,11 months ago,Open,2000628711
Elisabeth Shell,1.0,Honeslty pretty disappointed. I’m not entirely sure if it’s just the flavors we ordered (half was Thai Pie and half was Buffalo) but they were not well flavored combinations and the price point is too high for me to want to come back and …More,9 months ago,Open,2000628711
Oscar Abella,5.0,Most DELICIOUS portobello mushrooms I have ever eaten. Good place and good service. Good options for vegetarians.,11 months ago,Open,2000628711
Karen Coates,4.0,"The food is good and we like that there are so many vegan options, but our order was very slow in arriving and some of the members of our party were almost done with their food by the time my food finally arrived.",9 months ago,Open,2000628711
David Chialastri,4.0,"The specialty pizzas were very unique, so this place is definitely worth checking out. We had the Maui Wowie, and all of the toppings were fresh, which made for a delicious pizza. The lunch specials are a great deal too.",a year ago,Open,2000628711
Paul Cannon,5.0,Ate here for the first time. Pizza was great and made to order. The beer selection is better than most bars. Game was on. Our server Iain was friendly and on top of everything. We will definitely be back!,a year ago,Open,2000628711
Barry Coates,5.0,Only vegan cheese at a pizza place I've been to so far. Server was awesome about helping me with vegan options. All the food was great.,3 years ago,Open,2000628711
Aubrey Skinner,5.0,Absolutely LOVE this place. The pizza is always fresh and taste organic. The Cesar salad is also very delicious. The staff is very friendly and very helpful and always look as though they love their job. This is the only pizza place I will …More,a year ago,Open,2000628711
Mano W,5.0,They are just as good as before the flood,2 years ago,Open,2000628711
Hildegarde Poulos-Duran,5.0,"Great place to have pizza.A very interesting place! Clean, clean clean.",2 years ago,Open,2000628711
Jordan Butler,5.0,Service was great & very friendly. LOTS of great beer choices and the pizza was amazing! We had a great time there with family,a year ago,Open,2000628711
Estephany Galvan,5.0,Best pizza on this side of town. The buffalo chicken pizza is fire!!!!,a year ago,Open,2000628711
Shai.so. LOVELY,4.0,"My boyfriend and I had a wonderful time in Mellow mushroom. I sometimes have to be dairy free, so I love their option for vegan cheese pizza. The pizza was very delicious and the aesthetic of the place was cool. The wait time was fairly …More",a year ago,Open,2000628711
Kellenescotton SCOTTON,5.0,Great selection of micro brews.  The most wonderful pizza ever. Always..always great service!,a year ago,Open,2000628711
Vanessa Riley,5.0,"I'm a fan of the food and the beer. I used to be a regular a few years ago, but after my favorite bartender left, I stopped visiting as frequently. …More",a year ago,Open,2000628711
Stephen Honey,5.0,Excellent Crust...could just eat the crust and be happy... different topping combinations. Decor is great and atmosphere is laid back...,11 months ago,Open,2000628711
Philip Blue,5.0,They made us a heart pizza for our 3 year anniversary.  They are seriously the best!,3 years ago,Open,2000628711
Suzanne O'Connell,1.0,"Not impressed... the food was okay, the waiter was slow. Over half my calzone was just bread. The people sitting behind us, came in right after us, but got their food and left before we got our main dish.... and there were only a few …More",11 months ago,Open,2000628711
Sergio Chaulet,4.0,"Pizza was very good, customer service also. Relaxed atmosphere. I didnt give 5 stars because we ordered a Margarita and they charged us for a cheese pizza plus each individual item: fresh mozzarella, basil and tomato. Come to find out they …More",a year ago,Open,2000628711
R Kan,5.0,This is my favorite pizza place with out question.   Very creative speciality pizzas.,8 months ago,Open,2000628711
Faye Deacon,5.0,Melloe has great pizza and a wonderful selection of beer. We love coming here to relax.,10 months ago,Open,2000628711
Yasser Marcos,5.0,"Delicious pizza and good variety of beers that will make you try different ones from one round to another.
The pizza is so great, the crust was just perfect and the flavor was amazing!
This is a must try place if you haven't been here before!",a year ago,Open,2000628711
Rick Johnston,5.0,"cool atmosphere and lots to look at. And, the pizza is great too!",10 months ago,Open,2000628711
Jenna Martin,3.0,"This was my 2nd visit. The 1st time, everything went really well- the pizza was delicious & the service was great- despite us being a rather large group & it being pretty crowded. …More",9 months ago,Open,2000628711
Charmarie Dotson,5.0,The food is delicious and you can try something new everytime you go!!! Would recommend this place to anyone!!!,9 months ago,Open,2000628711
