name,stars,text,timeSince,openStatus,key
Elizabeth Bachle,5.0,"Love, love, love!! I have been here multiple times and always had a great experience! The staff is great and the food is so good!! They also allow dogs on the patio and have outdoor TVs for watching games! The rotating craft beer selection is amazing and the staff really knows their beer! Their happy hour specials are THE BEST!",5 years ago,Open,2000628711
King Moon,5.0,Very good customer service,8 months ago,Open,2000628711
Aaron North,5.0,"Absolutely love this place! If your in the area, it's a must to stop by. Food is amazing and one of the best beer menu's around. The staff is friendly and courteous, and bartenders are extremely knowledgeable. I'm so happy they are open …More",2 years ago,Open,2000628711
Daniel Hernandez,5.0,One of the best pizza shops i had the pleasure of visiting. The staff is very friendly and a wide selection of awesome beer to choose from. I tried the bombshell and it was delicious. I ate the stuffed potatoes pizza and it is awesome.  Highly recommend this place.,3 years ago,Open,2000628711
Fernando Ruiz,5.0,"Great pizza, awesome ambience.",11 months ago,Open,2000628711
Vanessa R,5.0,Pizza is very delicious! Pretzel bites and wings were great as well. Great staff and service.,2 years ago,Open,2000628711
g IRL,4.0,"I always love the food! I love how fresh it is, however, I wish they had a bigger gluten free pizza😞",a year ago,Open,2000628711
Rachel Thorne,5.0,"Our server Val was fantastic! She took such great care of us! Awesome food, awesome service, awesome experience!",a year ago,Open,2000628711
Marquell Wagner,5.0,"My gf and I had the large holy shitake pie and it was great. I'm not usually big on vegan cheese but it worked perfectly on the pie. Though a little more pricier, they're much better than MOD pizza. On a side note the large is legitimately huge.",2 years ago,Open,2000628711
Popeye Baca,5.0,Fun place with great food order the spinach o with bacon!,a year ago,Open,2000628711
Mike McCollum,1.0,"We waited a long time for our pizza. The service was slow
They didn't seem to know what appatizer they had.",a year ago,Open,2000628711
Tammy Harayda,2.0,They're always out of things today it was mushrooms before it was cheese sauce.,11 months ago,Open,2000628711
Mitchell Payne,5.0,Bought a medium pizza that took me a couple days to finish. Those were a good couple days.,a year ago,Open,2000628711
Mari Ruiz,4.0,"Great food, atmosphere, & friendly service. Cocktails from the bar were surprisingly really good. I really enjoyed my visit.",2 years ago,Open,2000628711
Don Jones,5.0,"Great Place! There is a bit of a wait, but that is only due to each order being made fresh. Awesome selection of craft and local beers. Fun and friendly staff. Definitely suggest/recommend this place for date night, family lunch, or Sunday beer and pizza.",3 years ago,Open,2000628711
David Britt,5.0,"Great food, great people and fantastic atmosphere",a year ago,Open,2000628711
Ashley Hill,5.0,Amazing food and great staff,a year ago,Open,2000628711
DonoftheBran,5.0,Awesome food!! Get the hummus you won’t be disappointed. The “pacific rim” pizza is worth being a cheat meal for sure lol. The staff was very friendly.,2 years ago,Open,2000628711
R Solano,5.0,"Awesome pizza,  family friendly.  Cool decor too.",a year ago,Open,2000628711
ebe q,5.0,Love the crust they use because it doesn't feel as heavy as other chain crust.  Try the pretzels too with honey.  They're sooo good!  They have a good variety and friendly service.  Covered patio outside also available.  Good kids menu too. …More,3 years ago,Open,2000628711
Miranda Thomas,3.0,"The pizza is great, as are the drinks. Servers are always very nice - however, the reason they do not get more than 3 stars is the inevitability slow service. Does not matter whether you are at the bar or a table; do not come here if you …More",3 years ago,Open,2000628711
Terry henry,5.0,Huge shout out to Mellow Mushroom for making my sons day better. Took my son to the Champion Forest Baptist Church for a pizza party he earned for completing his book reading goal and unfortunately we forgot to pick up a ticket for the …More,2 years ago,Open,2000628711
Maddi S.,4.0,Great pizza. Laid-back atmosphere.,a year ago,Open,2000628711
Savon Abnormal,5.0,"Vegan option is very delicious. Glad they are back open! Great customer service. Very chill and ""mellow"" :)",2 years ago,Open,2000628711
Carrie Fougeron,1.0,"Came in ordered wait over 45min for our pizza finally asked ""how much longer "" our waiter stated ""there were a bunch of online came in and ours got pushed back 5or 6mins!"" But there we two other tables that came in after us and got there …More",a year ago,Open,2000628711
Collin Parker,5.0,Pizza takes a little while its all homemade. I enjoy it,a year ago,Open,2000628711
Jonathan Koros,5.0,Always love visiting to Mellow. Staff is cool. They're dog friendly and even bring out water bowls for pups on the porch. Beer selection is one of the best in the area. And all of the servers make it a point to come say hi to our Malamute.,3 years ago,Open,2000628711
POTTERSTUNT,5.0,"Very chill place, nice atmosphere with dope pizza",a year ago,Open,2000628711
Randy Ford,5.0,"We've loved this place for years. My daughter has requested it since she was 4. Traditional & ""strange"" pizzas are on the menu. Try the Loaded Baked Potato Pizza; it's not on the menu anymore, but they'll still make it with a smile.",2 years ago,Open,2000628711
Kiera Caron,5.0,"This place is right around the corner from our house so we go all the time. Now, I am pretty picky about my pizza. From the sauce to the crust to the amount of cheese and the even dispersment of the toppings.",a year ago,Open,2000628711
gilbert delatorre,2.0,We waited today for an  Hour for a cheese pizza... We just ended up leaving we could not wait any longer,11 months ago,Open,2000628711
Jason Rudnicki,5.0,Always a great place to eat.,a year ago,Open,2000628711
Carlos De Sa Garcia,4.0,It was kinda expensive but it was nice coming into this place. I loved my pizza and the friendly atmosphere. Fun place.,2 years ago,Open,2000628711
Amy Robinette,5.0,I love this place!  Great vegetarian options. Family friendly fun!,2 years ago,Open,2000628711
Kurt Villanueva,3.0,"Today i tried the Maui-Wauwie  Pizza and it was not what i expected, i clearly asked for the banana peppers to be removed and they were still on my pizza, Scot, the Bar tender was really great and the service was amazing, but i was a bit …More",a year ago,Open,2000628711
Samuel Jackson,5.0,"There are many pizza places around, but not as many that are family friendly with a fun atmosphere. The staff here are great, engaging, and prompt. I highly recommend this location!",2 years ago,Open,2000628711
Mark Giles,5.0,Quality pizza. Great beer also.,a year ago,Open,2000628711
Spencer,4.0,"Pretty expensive, overall good experience.",a year ago,Open,2000628711
Michael George,5.0,Delish and reasonably priced! Oh and the beer selection is amazing. Try the mosaic & 567,a year ago,Open,2000628711
David Sherwood,3.0,The building has been restored after the flood. The good food is back including the pizzas and hamburgers. The beer is cold (try the Pecan Porter). We were disappointed that trivia night did not return.,2 years ago,Open,2000628711
Gavin Taylor,4.0,"Pizza is good, fresh made so plan on a wait for your food but its worth it",a year ago,Open,2000628711
Orlando Cruz,5.0,Always a great experience. Delicious food and friendly knowledgeable craft beer bartenders .,a year ago,Open,2000628711
JD TheEntity,3.0,Great food but slow service,a year ago,Open,2000628711
Papa Amadeus,1.0,"Nice place, super slow service .I recommend to eat before you go because they will starve you to deat. By the way no apologies after one hour wait for a simple pizza.. …More",2 years ago,Open,2000628711
Erik Moreno,5.0,"Fresh pizza, very very good.",a year ago,Open,2000628711
john mcclendon,5.0,Pizza was great and service was awesome,a year ago,Open,2000628711
Tamika Phillips,5.0,Great service and food!!! Great pizza selections and they have choices for vegans and vegetarians.,a year ago,Open,2000628711
TheeKimmie Duh,5.0,"Great location, amazing food, and inexpensive drinks is always a win win !!!",a year ago,Open,2000628711
taylor kittens,5.0,"Food, beer, and service all great.",a year ago,Open,2000628711
Kathy Seay,5.0,"I love this place. I hope they re-mediate the repairs from hurricane Harvey quickly. If you are looking for a great pizza pie, this is the place!",3 years ago,Open,2000628711
Alexis Lockhart,5.0,"Started with hot, fresh pretzels, then AMAZING Kosmic Karma pizza, & finished with THIS mile high dessert. The atmosphere was so chill. Don't rush, enjoy the food. We ❤️ this place. Tyson our server was so chill, attentive & helpful. There is no place like this.",4 years ago,Open,2000628711
Hector Valdez,5.0,Great service and better pizza!,a year ago,Open,2000628711
Riley Lebonaire,2.0,"Ridiculously over-priced.  You can get better pizza for less at places like Blaze and Mod. The wait time for a pizza is too long.  I understand they're made to order, but so are the other places I mentioned, and they don't take nearly as …More",2 years ago,Open,2000628711
Emilia Ortiz,4.0,Delicious love it here!,11 months ago,Open,2000628711
Ana Pape,5.0,Favorite pizza place in Houston. Their crust and flavor combinations for their pizzas are excellent. They also have a wide variety of beers on tap.,2 years ago,Open,2000628711
Armando Sauceda,5.0,Love the schroons......people got to go....,a year ago,Open,2000628711
Darwin Chacon,5.0,Best pizza in the area,8 months ago,Open,2000628711
Charles Carver,3.0,The pizza is good... When they get your order right... We did have to wait 45 minutes for it though and they weren't crowded.,2 years ago,Open,2000628711
Gerardo Reoyo,5.0,Awesome pizza always worth the wait to get a fresh pie from here,a year ago,Open,2000628711
Luhit Young,5.0,"Good beer selection, good food",a year ago,Open,2000628711
Shelley Lockwood,5.0,"Awesome pizza, craft beers, and fun art",a year ago,Open,2000628711
Sheryl Neal,5.0,Great placee for beer and pizza. Family oriented also. Big outdoor patio.,2 years ago,Open,2000628711
Ha S,5.0,"The gluten-free crust is vegan, and they have dairy free cheese that actually melts! This is the first time that I've actually enjoyed a vegan/gluten-free pizza. So much better than Daiya pizzas!",2 years ago,Open,2000628711
Lena Nguyen,5.0,Fresh pizza is good to eat if you're willing to be patient because they bake the pizza when you order it.,2 years ago,Open,2000628711
David Remley,5.0,Great trendy place,9 months ago,Open,2000628711
Stephen Jones,5.0,Always enjoy our time here. This is me and my wife's date night spot for trivia night.,2 years ago,Open,2000628711
Charlene Maxwell,5.0,"OMG!! I had no idea there was such a cool place just around the corner from my house. The pizza is the BEST. Had two kinds of pizza, smooth draft beer and key lime pie. It was amazing. Best birthday meal EVER! I will be so proud to bring friends/family there when they visit. In the meantime, will be a regular patron there.",5 years ago,Open,2000628711
Mark Kerr,5.0,"The Pizza is fabulous!

Great service as well.",a year ago,Open,2000628711
carmen farias,5.0,"Awesome atmosphere, great staff and delicious food. 10/10",a year ago,Open,2000628711
Manda Davis,5.0,"Great pizza, cold beer and delightful staff.",a year ago,Open,2000628711
nowell godfrey,5.0,Always good come have a slice,a year ago,Open,2000628711
D Roper,2.0,This place does have good pizza and an awesome choice of toppings however the wait staff can never get your order straight and pizzas are served wrong and everyone else is eating and you have to wait because they screwed up your order. …More,2 years ago,Open,2000628711
Mhari Guidry,5.0,I recently went vegan (again) and decided to go eat here because we wanted food nearby and I thought..well at the very least I can have a vegetarian meal..when I went in I noticed they had a tofu hoagie! The waitor was super awesome and …More,a year ago,Open,2000628711
Antonio Brown,5.0,"Great people, great food",10 months ago,Open,2000628711
TheForerunner,4.0,"The service was great and most of the food was spot on but the bruschetta was a bit lacking, the toast was burnt and the mixture on top could have had more flavlr if they didnt focus so much on just making it look pretty. And i understand …More",a year ago,Open,2000628711
Kyle Ramsy,4.0,Love the design of the restaurant with it looking like a baseball stadium.,a year ago,Open,2000628711
Taylor Evans,5.0,"Nice pizza, and nice and great waiters and waitress.",a year ago,Open,2000628711
Kat H,4.0,"I would LOVE to give them 5 stars, but the service is slow and lax.   I know, I know, its handmade-everything and as a former server, I both appreciate and understand what that means. However, my wait for food has sometimes been excessive, …More",4 years ago,Open,2000628711
davis jumper,5.0,Great beer selection and excellent pizza with a laid back vibe.,a year ago,Open,2000628711
J H,4.0,"Good pizza, good service, world go back again",a year ago,Open,2000628711
Cindy Gauthier,4.0,"Very chill environment. Great for groups. We usually sit in the bar area as it can get loud. Staff are a full array of hipsters, grunge, tattooed gothd and other such 20 something's outside the box. I didn't care for the server with the …More",2 years ago,Open,2000628711
J Martinez,4.0,Don’t order extra cheese bc they go WAY overboard!,11 months ago,Open,2000628711
Debbie Colley,4.0,Have the Kraft beer my boyfriend loves,a year ago,Open,2000628711
Christian Garcia,5.0,"Psycodelic art decorated place with one of the best pizzas i ever tried , the crust felt so fresh and crispy and the chesee taste like real cheese!!",a year ago,Open,2000628711
Evan BullTrue,4.0,"Honestly every thing about the place was great .I had a great server ,my food came pretty quick, the atmosphere is a trippy far out style and its done very well and last but not least the food is really good and I was left with the only sane choice which was to take the leftovers home come there a week later.",a year ago,Open,2000628711
C -J,5.0,Pizza was absolutely delicious and the beer was really good too. So many selections!,a year ago,Open,2000628711
amanda rodriguez,5.0,Good service and great food,a year ago,Open,2000628711
Dustin C.,4.0,The Funky Q chicken pizza was great. Cooked perfectly. We did get it w/out bacon FYI. The only downside is the amount of time it takes to cook it.extensive menu and good atmosphere,3 years ago,Open,2000628711
Mike Iglesias,5.0,Good Pizza and service,9 months ago,Open,2000628711
Diana Petisca,5.0,In love with the Mighty Meaty pizza....yum!  The spinach dip is super yummy too!  Great atmosphere and service.,3 years ago,Open,2000628711
stoney mitchell,3.0,"Food & Beer was good. The pretzels are pretty good.

The service was terrible. Me and some friends walked in at 9:30pm after a …More",7 years ago,Open,2000628711
Jon Litt,4.0,The pizza here is really good and they have an incredible Texas beer collection to select from.  So that is great.  Service for us on past two occasions has been very friendly yet very bohemian.  That is a little odd.  But what I did not …More,3 years ago,Open,2000628711
Ed Aldridge,5.0,Grandkids love it too.,a year ago,Open,2000628711
Brianna Selman,4.0,Good pizza nothing crazy different or innovative but tasty,a year ago,Open,2000628711
Michael Maloney,4.0,"Pros: The Restaurant is Clean, There Is Plenty of Space for Small to Large Groups, The Staff Is Professional and Engaging, The Service Was Quick, They Have a Great Beer Selection, The Prices Are Reasonable. The flavors on the pizzas and pretzel bites were good, not great.  Cons: Non on our visit.",a month ago,Open,2000628711
Robert Lotspeich,5.0,The food and the staff were great here and I enjoyed the relaxing atmosphere. I did not want to leave. You also can watch the pizza being made.  They also had quite the selection of spirits as well.,3 years ago,Open,2000628711
Liz Q,5.0,"Expensive if you're there to drink and eat, I would say $30 or more per person, with that being said... the pizza is AMAZING! Best pizza I've had in my 18 years in Houston, good draft bee toor. I loved it and will visit again.",4 years ago,Open,2000628711
Paul Wilder,5.0,Delicious pizzas. Fast service.,a year ago,Open,2000628711
Victor Urrutia,5.0,"Pizza here is good. Vegan and gluten free menu items, this means it's very open to most customers. They also have a nice variety of craft beers that rotate often for a new flavor. There is also unique art that adds to the atmpsphere. Check …More",a year ago,Open,2000628711
Shannon Carr,4.0,I love the huge slices and the bar atmosphere.,a year ago,Open,2000628711
love & peace,5.0,Pizza was delicious. Victor is the man!  How can you not love a guy that introduces you to great new beer.,2 years ago,Open,2000628711
Taterpops Jun,5.0,Pizza and place is awesome,a year ago,Open,2000628711
Daniel Davenport,5.0,PIZZA IS BOMB!,9 months ago,Open,2000628711
Jay Ferguson,5.0,"Loved this place, great beer selection and pizza is made to order.  Keep in mind this is a meal and not quick service, your pizza will take some time.  Very trendy, great for kids and pets on the patio.  Worth checking out.",3 years ago,Open,2000628711
Gregory Sistrunk,5.0,"Outstanding service,  calzone was excellent",a year ago,Open,2000628711
Judy Pruitt,5.0,"This was my first visit, and the pizza was great!",a year ago,Open,2000628711
Steve Harrington,5.0,My favorite Pizza Northside. Add to that the multitude of beer on tap and the good times can be had. Family friendly!,2 years ago,Open,2000628711
June B,5.0,Great gluten free pizza.,a year ago,Open,2000628711
Anthony Ramirez,5.0,Great food and excellent service,a year ago,Open,2000628711
Cee Dotson,3.0,Decent places to stop by,11 months ago,Open,2000628711
Carolyn Wu,5.0,So good! Staff is also extremely sweet and happy to recommend drinks if you’re unsure!,a year ago,Open,2000628711
Samuel Arenson,5.0,Great place to get pizza and related foods. Fun atmosphere with friendly staff and the food looks and tastes great.,2 years ago,Open,2000628711
Jessica Ballard,5.0,I love their beer selection! Kosmic Karma is the best pizza ever 😍,2 years ago,Open,2000628711
Nicole Ngoc Lee,5.0,I like Mellow Mushroom. I like it a lot. I wish there were more locations around Houston! The ingredients are fresh and the pizza combos are delicious. I love meat on my pizza but I must say my favorite here is the Holy Shiitake Pie. …More,4 years ago,Open,2000628711
James Anderson,5.0,Delicious food and great beer selection. Great service too.,2 years ago,Open,2000628711
ross faulkner,5.0,Great food good people always a great place to eat,2 years ago,Open,2000628711
MrDeeds Alexander,5.0,"Wheeeww, those mushooms and herbs, my goodness!! ....LoL!

Thanks for the good service and delicious pizza~ 😎👍",a year ago,Open,2000628711
Ismael Garcia,5.0,"Incredible place to eat some incredible and unique pizza and more. It has an amazing atmosphere, the staff is extremely kind and courteous, and the selection is exceptionally vast.",2 years ago,Open,2000628711
K. S. T.,5.0,"The pizzas are Amazing! A great family environment, laid back yet professional staff, and reasonable prices. My family loves this place.",3 years ago,Open,2000628711
Zachary Castro,5.0,"Great pizza!!! Plenty of craft beer on tap. Pizzas are made to order, so be patient. It will be worth the wait.",3 years ago,Open,2000628711
Carmen Rivera,5.0,Great pizza and great amosphere. Our waiter Scott was super nice and helpful. Very happy with our first experience,3 years ago,Open,2000628711
Gustavo Rodriguez,5.0,"Reeeeeeeeeeally good pizza, loved it!  We took it home along with chicken wings, total was under $25, and we were four hungry souls... and hunger went away without a problem.  Flavor, smell, taste, texture was very nice... and the place has a very friendly bar.",3 years ago,Open,2000628711
Kody Phan,5.0,The place is awesome with great services,a year ago,Open,2000628711
Heather Crisp,5.0,Great food and great service as always!,a year ago,Open,2000628711
jesse Wolf,1.0,So I've been before but today I had a completely horrible experience and because of such I'm still hungry. I went up their about 6:10-6:15 ordered a beer and waited for them to take my order took about five minutes after the beer no …More,2 years ago,Open,2000628711
Charles Jessup V,5.0,"Good food, good beer",3 years ago,Open,2000628711
Larry Guillory,2.0,Over a hour wait for pizza!  Never again,a year ago,Open,2000628711
Scott Brusaw,4.0,Pizza is pretty good for Houston standards. Beer selection is very good unless your idea of good beer is bud light.,2 years ago,Open,2000628711
remick lackey,5.0,"Great service, friendly staff, exceptional pizza... 10/10!",a year ago,Open,2000628711
Cheef Smeef,4.0,"Great food. Normally pretty busy. Kinda hipsterish, but a good crowd. Decent craft beer selection.",3 years ago,Open,2000628711
Trent McInturff,2.0,"Food is typically very good but...
Went in for a calzone and they literally put one pepperoni in it and cheese, nothing else. I also spotted two employees walking out to their car to smoke marijuana multiple times. I cannot believe the unprofessionalism at this restaurant.",2 years ago,Open,2000628711
Erin Niman,5.0,My favorite Pizza place in Houston by far!,a year ago,Open,2000628711
Trudy Rivich,5.0,A fun place to eat and some AMAZING pizza!  I always have the same big slice because it's so good and the ingredients are really fresh!  The house salad was bigger than I expected!,3 years ago,Open,2000628711
Michael Duncan,5.0,One of the best pizza places under the sun,a year ago,Open,2000628711
Matthew Johnson,5.0,Loved it... great Pie.. definitely worthy!,a year ago,Open,2000628711
Mariela Sanchez,5.0,Great service and delicious pizza... I also love the oven roasted wings..... love coming here during lunch,4 years ago,Open,2000628711
Tony Harrell,5.0,Really good food and my wife was really happy about having gluten free crust.,2 years ago,Open,2000628711
Mila Hardin,4.0,So yummy! I love mushrooms!,a year ago,Open,2000628711
skyfindley,5.0,"Place is awesome, kitchen manager is super professional and understanding, place is also greatly vegan/Vegetarian friendly. Staff is badass to say the least.",2 years ago,Open,2000628711
Joshua Bailey,5.0,Some of the best pizza you can get. Their dough is the best!,2 years ago,Open,2000628711
Allen Steagall,5.0,Love this place. Always good food and service.,2 years ago,Open,2000628711
Elizabeth Rose,5.0,Vegan pizza was delish,a year ago,Open,2000628711
Caleb Pickett,5.0,Great pizza and atmosphere,a year ago,Open,2000628711
Penguin Scott,5.0,Fantastic setting for really good pizza. Bring a big wallet.,2 years ago,Open,2000628711
Ryan Sanislo,5.0,Some of the best pizza I've had in the area.  The pizza around here is not on the level it was on the east coast.  With all the ethnic diversity you'd think good pizza would not be hard to come by.  Mellow Mushroom brings the noise!,5 years ago,Open,2000628711
Matt Henley,5.0,Excellent Pizza and calzone,a year ago,Open,2000628711
Ham String,4.0,"This place was awesome. They make their pizza from scratch so it takes some time. Very nice staff, good beer selection, and cool environment.",4 years ago,Open,2000628711
Erik Cao,4.0,Great pizza with new style of topping with a full bar that offer domestic local  beer and ok cocktails,a year ago,Open,2000628711
mark sebastian,5.0,"Great pizza, great beer, and incredible service by our waitress Erin!",2 years ago,Open,2000628711
shawn crocker,5.0,One of the best pizzas I've ever had,a year ago,Open,2000628711
Hayley Sheeks,5.0,Our favorite pizza in town,a year ago,Open,2000628711
Inge Raley,5.0,I will recommend if you are in the mood for pizza. I'll come again soon for another slice.,a year ago,Open,2000628711
ABikerLife,1.0,"A friend convinced me that this was a great place,,NOT !! Mediocre and not flavorful pizza that is wayyy over priced.. Drinks wayy over priced.. I can't believe anyone would go to this place.  If you want to pay 50 bucks for a sub-par pizza …More",2 years ago,Open,2000628711
Junior A.,5.0,"The pizza is the best in the area. The decor gets better everytime I visit. And their alcohol selection is good. Plus their desert is deliciously evil!
Occasionally you'll get a bad waiter/waitress but then again tips are based on the level of service you received.",7 years ago,Open,2000628711
Streaky,5.0,Greatest pizza ever and ever Wednesday is trivia night,a year ago,Open,2000628711
shannon curry,5.0,Great pizza and beer.,a year ago,Open,2000628711
Grant Goodyear,5.0,Great pizza. Pretzels with beer cheese ftw.,a year ago,Open,2000628711
juan razo,5.0,"I love this place always have a great time when I visit  good food, friendly waitresses, great adult beverages what more can I say",2 years ago,Open,2000628711
jose calvillo,5.0,"Great food, awesome service!!!",a year ago,Open,2000628711
Carlos Garibaldi,5.0,Good food and super friendly staff!,2 years ago,Open,2000628711
Gabby Walton,4.0,Good location with great service.,a year ago,Open,2000628711
Erik Bartlow,4.0,"Great pizza, but a bit pricey.",2 years ago,Open,2000628711
curt lamb,4.0,It's worth it to check the place out. The pizza is great.,2 years ago,Open,2000628711
Maria Palenzuela,5.0,Pizza was really good,11 months ago,Open,2000628711
FBI,2.0,Had to argue with the 'manager' because he didn't understand his employee was over charging on a type of beer I didn't even order. Terrible service. Should provide some sort of management training if they're going to allow a kid to run the place. Oh well. Salad was tasty.,3 years ago,Open,2000628711
Sherry Schultz,3.0,Good service.  Unique pizza.,2 years ago,Open,2000628711
