name,stars,text,timeSince,openStatus,key
Jose Reyes,5.0,Had never been here before but it was honestly a 10/10 first experience. The manager and other member of the staff that helped me were extremely patient and nice about taking my order. My food was great and it got out to me super quickly. I’ll definitely be coming back!!,3 weeks ago,Open,2000390383
Kay H,4.0,Though the place was a bit of a drive for me. I really liked the pizza. It tasted pretty good. Their online website was very easy to use. Only thing I didn't like was their wings.,a year ago,Open,2000390383
Dawn Mcniel,1.0,I received the wrong order. I called to speak to them and ask them if they would send out the correct order and they refused to send it out. I was first told that it would be two hours before the driver could return with the correct order …More,3 weeks ago,Open,2000390383
Jacearonie0004 Giles,5.0,Very good customer service and even better pizza. It was perfect and nothing was wrong with it. Came out at a good time and the manager was super nice and helpful with me. Definitely coming here again 10/10,3 weeks ago,Open,2000390383
D Ryan,4.0,It’s exactly what I thought it would be. Basic simple decent tasting thin crust pizza that deliver and I threw in some Buffalo Wings. Wings and sauce were not bad. Next time I’ll ask them to be a little crispier. Overall satisfied with the food. I’ll use them again.,3 years ago,Open,2000390383
Lana Dahle,5.0,They we're out of onions! We ordered a few pizzas and a few subs for lunch in the park. Their italian sub is fantastic. It's bread is like a sub and a calzone had a delicious baby. I grew up eating Hungry Howie's and nostalgia is trumped by deliciousness. It has been a while since I've had H.H. and it surpassed my expectations.,3 months ago,Open,2000390383
Benjamin Bakaitis,5.0,I am very glad this is here. Hungry Howie's is arguable the best pizza franchise out there. The pizza is well made with very good crust.,3 weeks ago,Open,2000390383
Henry Spackman,5.0,"Ok, where to even start. Hungry Howie's is legitimately the best pizza I have ever had (and I've had a lot of pizza). The costumer service at this place is truly amazing. The employees are always helpful, kind and just really chill people. …More",3 weeks ago,Open,2000390383
TheEvilPanda,5.0,Food is really good! Get the flavored cust. It's worth it! Brett the owner has a really cute service dog.,a month ago,Open,2000390383
Zachery Giles,5.0,This restraunt is awesome! They have a huge variety of options and they always deliver it with excellent customer service! My favorite thing there is the stuffed howies bread! Its amazing! 10/10,3 months ago,Open,2000390383
Tanner Andersen,5.0,"Pizza was well cooked, not burnt or doughy! Great amount of toppings evenly spread out! Employees were super friendly and helped with what I needed! I would recommend for a family night or get together!",3 months ago,Open,2000390383
Shule Aggabao,5.0,"Too bad there isnt a 10 star option. The manager was lit and definitely going back. Food was good, got free drinks on my Birthday",3 weeks ago,Open,2000390383
Jamison Chandler,5.0,The food was really good. The pricing was really reasonable and the manager is a homie,3 weeks ago,Open,2000390383
Jeremy Lewis,5.0,The food was very good. We had a pepporoni and a hawaiian pizza. The staff was also very kind. Manager helped us he was a cool dude,3 weeks ago,Open,2000390383
Logan McNiel,1.0,I got the wrong order but when I asked for a replacement they said it would be two hours which would’ve been fine but then they refused to send it out at all.  The manager said that they could credit me but I wanted my correct order. The …More,3 weeks ago,Open,2000390383
Brooke Guinn,5.0,"The pizza is incredibly delicious and the employees are friendly and helpful! Amazing service, and my food is always finished quickly. 11/10",2 months ago,Open,2000390383
Hunter,5.0,"This location has never let me down. If you like Hungry Howie's, you can trust this location. Really the only pizza place I order from because they do gluten free that still tastes alright.",4 months ago,Open,2000390383
Fanana 85,5.0,The customer service was amazing and Jason helped me out so much.,2 weeks ago,Open,2000390383
Josh Hunt,3.0,Their pizza is amazing but their online ordering could be improved.,2 weeks ago,Open,2000390383
Jake Hull,5.0,Every time I go the employees are super friendly and helpful. The pizza always tastes great and they never make me wait an unreasonable amount of time. Not the greatest pizza in the world but it’s the best at its price.,4 months ago,Open,2000390383
BeserkerRage13,4.0,"Good service time, even better pizza",2 weeks ago,Open,2000390383
Daniel Lemmingston,5.0,I ordered a large pepperoni pizza with butter crust and it was amazing! Employees were super nice and helpful!,3 months ago,Open,2000390383
Rebecca Newell,1.0,just ordered cheese breadsticks and they were completely dry and not the slightest bit cheesy.  super disappointed and won't be ordering again anytime soon.,2 months ago,Open,2000390383
Lily Bedolla,3.0,It tasted way better when you guys first opened right now its okay,4 months ago,Open,2000390383
George Vandewater,5.0,Great service great  food and good prices. The Howie Roles are my number one choice on their menu.,6 months ago,Open,2000390383
josie hawkins,5.0,Pizza from here is worth the drive - big yummers,3 weeks ago,Open,2000390383
Monica Casper,1.0,I ordered delivery and waited an hour and a half and then called the store they said that they had canceled my order because I wasnt in thier delivery zone I live 10 mins away... they didn't even contact me to tell me so I've just been wasting my time waiting for my food never ordering from them again,4 months ago,Open,2000390383
CubzCaleb,5.0,The workers were looking good that day,2 weeks ago,Open,2000390383
Dan Espinosa,1.0,"I really like the pizzas from Hungry Howie's, but this location has historically wasted my time on multiple accounts. …More",7 months ago,Open,2000390383
Jamin McKeever,5.0,Great junk food pizza! 🍕,2 months ago,Open,2000390383
Andrew Townsend,5.0,We like it. Reasonably priced too.,4 months ago,Open,2000390383
Alan Crawford,5.0,We always love the garlic buttery crust! It's always a favorite pizza shop for us!,5 months ago,Open,2000390383
Nick Bernfeld,5.0,"Great service, always feel welcomed and treated well. This location is the only one I go to, they've always done a great job.",8 months ago,Open,2000390383
Damian Bray,5.0,"This spot is one of my favorites! Convenient pricing, big dishes and the employees are consistently super friendly.",8 months ago,Open,2000390383
Donny Merrill,5.0,"This pizza is amazing! The Asiago cheese crust is the best. Why hasn’t any one else done this. The customer service is top shelf stuff too, they really want to make sure you have a good experience and good pizza.",a year ago,Open,2000390383
David Hard,5.0,"Not only is the food really good! The cheese is amazing.  The most important thing is the other night ,I was in with my daughter and left my wallet at the store, I didn't realize it was gone until the next morning. OMG! I knew that was the …More",11 months ago,Open,2000390383
Brianna Dungan,5.0,From the Midwest and miss having hungey howies.  Worth driving 25 mins for a treat,7 months ago,Open,2000390383
Preston Thayne,4.0,"Hungry Howie's has great pizzas.  Love the flavored crust.  Speaking of crust, theirs is a perfect consistency.  Their meats have a good balance of flavor.  Their salads are packed with a good amount of meat.  Their howie rolls are pretty …More",a year ago,Open,2000390383
Wilma Franklin,5.0,Great pizza and friendly staff,a month ago,Open,2000390383
AnnaBrook Roy,5.0,I like the flavored crusts. It makes the pizza even more better!,9 months ago,Open,2000390383
Kendra Nuttall,5.0,Delicious! Love that they don't charge extra for stuffed crust on the large pizza. Also love the flavored crust.,11 months ago,Open,2000390383
Adriana Giles,5.0,"I order from howies pretty regularly. Maybe once a week. I really enjoy their pizza, specifically all of their flavored crusts and their wings are so good. They have great customer service as well. Managers are helpful and drivers are …More",a year ago,Open,2000390383
Andrew Van Buren,5.0,We love Howie's!! The flavored crust is awesome! It is a nice change from your typical pizza place. There are a lot of variety and options to chose from. The store is always clean and everyone is nice and easy to work with. I would highly recommend Howie's to anyone looking for some great pizza.,2 years ago,Open,2000390383
Renegade Gamer,4.0,Service was acceptable. Food was ok. Breadsticks are awesome.,10 months ago,Open,2000390383
Marshall Madsen,5.0,Love the flavored crust!,2 months ago,Open,2000390383
Marshall L. Madsen CFE,5.0,Love the flavored crust!,2 months ago,Open,2000390383
Zackary Page,3.0,"I put it at 3 stars for the purpose of a few things. Good parts first of what I appreciated. The speed on delivery was amazing. But the deep dish pizza was hot and burnt on the outside (Hot part not bad), while also undercooked specifically …More",a year ago,Open,2000390383
Justin Baron,2.0,"It looks like from the reviews that people absolutely love their items or they’ve had problems. This location doesn’t seem consistent, well, I shouldn’t say ‘seem’. And then on the reviews that aren’t so great, the owner just says, “how can …More",11 months ago,Open,2000390383
Ryan Nylander,5.0,Whenever I'm in town I hit this place up normally once.  Been eating this pizza since a kid. …More,2 years ago,Open,2000390383
Edward Prignano,5.0,Great pizza for a great price. Their flavored crusts are amazing. I personally like the garlic butter crust the best. I’m a fan of simple pepperoni and this pie didn’t disappoint.,a year ago,Open,2000390383
joana velazco,5.0,OHHHHHH MYYYYYYY THE SESAME CRUST IS THE BEST,10 months ago,Open,2000390383
brandon majers,5.0,The best pizza you'll eat,6 months ago,Open,2000390383
Jeramie Branin,5.0,The service and food are top notch. Would recommend to everyone.,a year ago,Open,2000390383
Tyrell Atkin,5.0,Good food and great crust,4 months ago,Open,2000390383
Emily Parks,4.0,"The pizza was very fresh. I thought it might have a unique flavor because they advertise their flavored crust but it didn't seem incredibly different. We still enjoyed it, the pizza was very crisp and fresh. The service and price was average for a pizza place.",a year ago,Open,2000390383
AJ Hatton,5.0,Pizzas are great and you get a ton for your money ! Customer service is the best in town! Def my go to for take out pizza every time.,3 years ago,Open,2000390383
Kendra Holmes,3.0,Pretty good pizza! Seems like a hit or miss. Sometimes its SO good and other times its just EH. But I do love their flavored crust! (when they don't forget to put it on) lol.,a year ago,Open,2000390383
Spencer Munson,5.0,"We have had this place at least once a week for a few months now.  The pizza is always great and we never have to wait long at all. I would suggest the Asian chicken with the sesame seed crust, or anything with the garlic crust. The Howie bread is amazing as well.",a year ago,Open,2000390383
trevor nevills,3.0,Their pizza tastes great their veggies are fresh but the dough is never cooked all the way!,a year ago,Open,2000390383
Adventure gaming,5.0,The flavored crust has been amazing every time and I just tried the stuffed crust which adds a subtle extra cheesiness if you have the asiago crust.,a year ago,Open,2000390383
Tyler Weight,5.0,"The owner of this location is great! He answers the phones, delivers and is alway in his store to make sure things are running smoothly. I had a big order and he made sure everything was right. I don't know how he finds the time with his …More",2 years ago,Open,2000390383
Jake Astle,4.0,We love the option that you can order online. We are disappointed that despite living 3 miles away we have to drive to pick up the food because we are out of their delivery area. I am not sure how small of an area they deliver to but I wish …More,2 years ago,Open,2000390383
Josh Hunting,5.0,Our family had never even heard of Hungry Howies until a friend of ours recommended it. We gave it a try and boy did it just knock the darn socks right off our feet! We haven’t gone to a different pizza joint since. Our favorite is the deep …More,2 years ago,Open,2000390383
Jonathan Rasbach,3.0,"The store was super-clean, and the service both fast and exceptionally friendly.  However, the food, despite looking decadently delicious had not-much taste.  If you're looking for fast-made comfort food, this is a reasonable bet--but you …More",2 years ago,Open,2000390383
Tj Meranda,4.0,"Great pizza. Just wish they were more consistent with being able to deliver. We would get the pizza everytime but, they are very hit and miss with the delivery.",a year ago,Open,2000390383
Benjamin Davis,5.0,"This place is great. They get the food out at a reasonable time even with a big order, and when my Jeep is broken down in the parking lot I can get some food here while I wait!",a year ago,Open,2000390383
McKinzie A. Rogers,3.0,Forgot toppings on our pizza and was slightly doughy in the middle. Bread was fine but the lettuce on the salad was old. Not a horrible experience but not the best either. Driver was nice though.,a year ago,Open,2000390383
Andrea Hardee,4.0,"Decent pizza with a moderate menu of toppings. Their gimmick is to add flavor to the perimeter crust, in the form of brushed on sauces and sprinkly bits, such as sesame seeds or parmesan cheese. Delivery is quick. A bit pricey for me, but …More",a year ago,Open,2000390383
jake hubbert,4.0,Friendly service and a they have a good selection of pizza flavors.,a year ago,Open,2000390383
Victoria Bennion,5.0,One of the best pizza places  ever.,9 months ago,Open,2000390383
Kathleen Roberts,1.0,"They screwed us BIG time today, for my son and daughter's birthday party. We ordered catering for 26 people two days ago and when my husband went to pick up the food, they let him know that they didn't make our food at all. Why? Not enough …More",3 years ago,Open,2000390383
Erik Zane,1.0,bad experience,2 weeks ago,Open,2000390383
Todd Gillies,5.0,Howie’s is a family favorite for us! Their deep dish pizzas are the only way to go! The store is always clean and the staff has always been very helpful.,2 years ago,Open,2000390383
Karina Flores,5.0,Sonia the manager has great customer service. The pizza is delicious it is honestly my favorite. Every time I go I am satisfied. I would really want the one in Provo to open already since it is closer to were I live.,2 years ago,Open,2000390383
Emily Worley,5.0,Seriously one of the best pizza places. Yum!,a year ago,Open,2000390383
Erik Crossette,1.0,pretty bad experience,2 months ago,Open,2000390383
TJ Dale,1.0,"Meh, the flavored crust was ok. The toppings were ordinary & lackluster.  The sauce left much to be desired. I gave it a try twice & gave up. They could have a bad day once, but twice? Why waste my money when I can get good pizza so many other places.",a year ago,Open,2000390383
Bryce Griffin,5.0,The pizza is great and the service was excellent. The employees were super nice and helpful and answered all of our questions.  My wife and I love hungry howies!,2 years ago,Open,2000390383
Patrick Reynolds,5.0,"I was first introduced to Hungry Howie's in Florida. I live in Wyoming and come here every time I visit Utah. I usually eat the pizza and throw away the crust, but not this pizza. Wow! Quality ingredients like real bacon pieces make this …More",2 years ago,Open,2000390383
Brady Greenhalgh,5.0,"Hungry Howies has the best pizza, I love thier crust!  They handle all of my large orders with ease.  I strongly recommend them.",a year ago,Open,2000390383
Janelle Sullivan,4.0,"We went to Hungry Howie's for their Pi Day special, and ordered a pepperoni pizza with garlic and herb crust along with their original bread sticks. The crust turned out to be too strong of a flavor for my taste, but I do think it is a …More",a year ago,Open,2000390383
Arielle Michelle,5.0,Staff was super nice and really helpful. The pizza was delicious! They have different flavors for their crust and the taste is great. Definitely coming back!,2 years ago,Open,2000390383
Jenny Lindquist,5.0,Love this place! However I am sad that they don’t have a location in Provo.,a year ago,Open,2000390383
Jacob Frei,4.0,"I used to love Hungry Howie's, and when the opportunity to get their pizza for the first time in five or so years presented itself, I was really excited. I was very happy with the service and there wasn't any kind of wait, but their pizza …More",a year ago,Open,2000390383
Jordan Olson,5.0,"Asiago crust is amazing from here, and it's one of the best priced lunch deals for a small personal pizza with two toppings. To get the pizza I'm talking about just ask for the $5 lunch deal if you order online go through their deals tab and get the $5 deal.",a year ago,Open,2000390383
Laura Dalrymple,3.0,"Pizza there is great, so I’ll recommend HH for that. 3-stars because I spent $8.49 for a 10 piece boneless chicken and it was so cheap and awful looking. Looked like Wendy’s chicken nuggets thinly topped with a buffalo sauce. Not worth the price!!",2 years ago,Open,2000390383
Robert A Auman,2.0,It is a fast food pizza place gone wrong. There stromboli was still doughy and there pizza left a lot to be desired. But the people there were great.,2 years ago,Open,2000390383
Devan Muir,1.0,"I literally just walked out. Stood there for a couple minutes with an employee feet from my face, making eye contact, and was not greeted, or told to wait a minute or asked what I'd like to order. No contact whatsoever. I was the only one in the store! Guess they don't like selling pizza here. Terrible first impression.",a year ago,Open,2000390383
Kelsey Hallett,1.0,Normally I love Hungry Howie’s and always say it’s my favorite pizza but to say i was disappointed today is an understatement!!! I ordered a pizza today at 4:20 PM to be delivered to my work like I often do. I called at 5 and asked where it …More,a year ago,Open,2000390383
Alexander Supertramp,5.0,"Greatest customer service in existence. Sometimes you can really learn to appreciate the small things. For example, I ordered a pizza last night and asked them to ""draw something spooky"" on the box, and they made the little guy on the front …More",4 years ago,Open,2000390383
AJ Hatton,5.0,Delicious pizza at amazing prices ! Way better than Papa Johns and Pizza Hut ! Staff is super friendly and I put in large orders and everything is exactly right. This is my go to pizza place for any occasion.,2 years ago,Open,2000390383
Stephanie Anderson,5.0,This is the best pizza in Utah County!  Try the Chicken Asian Pizza and all the flavored crusts. The Howies Bread is delicious,2 years ago,Open,2000390383
Tom Neff,5.0,Best pizza ever but they need to do a taco pizza I tried the bacon cheese burger and wow really good,a year ago,Open,2000390383
Tyler McNutt,3.0,"I grew up in Birmingham, Alabama and this is BY FAR my favorite pizza chain of all time. When I saw that Orem opened a store I drove 30 minutes from salt lake city just to get take out and carry it back home. Its not the way I remember it …More",a year ago,Open,2000390383
Andrew Poulsen,4.0,I live and work around 1600 N in Orem and have done so my whole life. I am glad to see Hungry Howie's make it! Today was my first time actually trying their flavored crust pizza and i really enjoyed it. The  Works pizza had the perfect …More,4 years ago,Open,2000390383
Philip McArthur,5.0,Calzones and cheese bread are so good. Flavored crust sets them apart from everyone else. Cajun/Sesame is my favorite.,2 years ago,Open,2000390383
Jill Swenson,3.0,The first time i tried their pizza i loved it. I was excited to try it again. I ordered it on line to pick up at a specific time. I got it right away when i went to pick it up. It smelled great! Box was hot. Got home opened the box complete …More,3 years ago,Open,2000390383
comedy guy,5.0,Excellent pizza and customer service,8 months ago,Open,2000390383
Zak Kandare,5.0,Great pizza. Honestly best I've had. They use fresh ingredientes making it taste much better - nothing is frozen. Best part is the crust. Its flavored. The people there are nice and the owner is very hands on and personable. 5/5 Stars would recommend it to anyone,4 years ago,Open,2000390383
Tyler Mickelson,4.0,"We got some cajun seasoned bread sticks that were not my favorite, and I usually like cajun spices the garlic butter crust on our pepperoni pizza was much better. It was a very greasy pizza, which is good for some people and bad for others.",a year ago,Open,2000390383
Riley Ferwerda,2.0,Typically love Hungry Howie’s pizza but this was our first time at the Orem location. Both pizzas had a weird smell and a bad taste too! One of our pizzas had NO sauce and they forgot to flavor the crust. The staff was nice but that’s about all the positive I can give.,2 years ago,Open,2000390383
Alec Borow,5.0,"Hungry Howie's Has always been good to me and my friends, when we hold our cult followings of games, and DnD adventures, This is the go to location for our adventure needs, they took a detour this time though and the adventure food took a …More",2 years ago,Open,2000390383
Josh Black,3.0,"You deserve zero stars for your Google Maps shenanigans having a listing for a north Provo location but I'll take some of the blame for not noticing an Orem address on my order. I won't be back in any case, too many issues with service in …More",2 years ago,Open,2000390383
Rip DeRoest,5.0,Excellent pizza. The crust is sooo good. Not only that but the customer service is great. And the manager is very helpful!,2 years ago,Open,2000390383
John Anderson,5.0,I am the franchise owner of the the Orem Hungry Howie's Flavored Crust Pizza.  We recently changed management and have corrected the issue of not taking orders until our closing time.  This was isolated   to several team members.  Our food …More,5 years ago,Open,2000390383
Daniela Jimenez,5.0,"My boyfriend got me hooked on this pizza place. I love their jalapeno with black olvies pizza. Plus, thry have howie rewards!",a year ago,Open,2000390383
Dan Parks,1.0,"Terrible customer service. I have been here a few times and they have yet to get my order correct. Additionally, they didn't give me the sauces I ordered. By the time I noticed, it wasn't worth the 59 cents per cup to return and get the …More",3 years ago,Open,2000390383
Jenna Villegas,5.0,I have been to a hungry Howie's in Pensacola  Florida.  When we found out there was one in Orem we drove on down 35 mins out of Slc and had to have some. It was just as we remember. Delicious fresh pizza with your choice of flavored crust. …More,a year ago,Open,2000390383
Scot Madsen,5.0,"They created what I assume was a wonderful Cheese Bread for me, and I got stuck in my errands so the pickup time was well over a half an hour past due. I called in to notify them, and they made me another one as I was on my way so that I …More",4 years ago,Open,2000390383
Educational Lunch,5.0,Brett the owner takes care of his customers. Him and his staff take care of their customers.,a year ago,Open,2000390383
Adam Guymon,3.0,"The pizza was pretty good, I thought they went a little skimpy on the toppings. The flavored crust was fun and the Howie bread is yummy. Overall pretty good pizza place, will probably order again",3 years ago,Open,2000390383
Ed Pinegar,5.0,Great staff.  Pizza is one of the best around!,a year ago,Open,2000390383
Jay Christopherson,1.0,Awful service. Ordered a pizza over the phone almost an hour before I went in and when I get there they tell me “it’s just about to go in the oven.” I see that two other dads have obviously been waiting for who knows how long. …More,2 years ago,Open,2000390383
Justin May,5.0,They always hook it up for a brotha that just needs some good pizza after a long day of work. Duh duh duh duh duuuuuhhhh I’m loving it!,a year ago,Open,2000390383
Arielle Brädt,1.0,The pizza is good but I ended up with hair in my pizza followed by very poor service from the manager and owner. I didn't even get an apology from the manager and the owner felt excuses and accusing me of yelling at him a good solution. Ha …More,4 years ago,Open,2000390383
Tanner Street,5.0,"There have been a couple mistakes in the probably, 40 plus times we have had pizza here. Each of those two times I gave feedback on the website regarding those cases. I promptly reiceved an incredibly apologetic response from one of the …More",2 years ago,Open,2000390383
J Furr,4.0,You guys have great pizza but EVERYTIME I go there you're short staffed or the pizza takes forever to make. Great pizza but I don't think it's worth the time anymore. …More,2 years ago,Open,2000390383
MORI ANDERSON,5.0,I love this pizza!  Absolute favorite pizza joint and Orem! (My favorite being the  asian chicken with the  sesame seed crust) 👌🏻👌🏻👌🏻,2 years ago,Open,2000390383
Ben Jordan,4.0,Good pizza with good flavored crust. You can always get coupons online to make it a great deal.,2 years ago,Open,2000390383
Justin Christensen,5.0,"Some of the best pizza I've had in a long time. It was reasonably priced, and was very delicious. I especially loved their crusts with all of the different flavors that you can choose from. Also, they offer different styles of pizzas than I'm used to at a normal pizza place.",5 years ago,Open,2000390383
